Symbol,Name,Last Sale,Net Change,% Change,Market Cap,Country,IPO Year,Volume,Sector,Industry
RDI,Reading International Inc Class A Common Stock,$4.77,0.01,0.21%,104030862.00,United States,,26912,Consumer Services,Movies/Entertainment
RDUS,Radius Health Inc. Common Stock,$12.73,-0.05,-0.391%,601698039.00,United States,2014,344331,Health Care,Biotechnology: Pharmaceutical Preparations
RIDE,Lordstown Motors Corp. Class A Common Stock,$6.45,0.27,4.369%,1141506629.00,United States,2019,8206615,Capital Goods,Construction/Ag Equipment/Trucks
RNST,Renasant Corporation Common Stock,$33.48,0.23,0.692%,1886666701.00,United States,,220789,Finance,Major Banks
SABR,Sabre Corporation Common Stock,$11.32,0.46,4.236%,3652480817.00,United States,2014,4886853,Technology,EDP Services
SAFM,Sanderson Farms Inc. Common Stock,$186.15,-1.00,-0.534%,4156503328.00,United States,1987,323543,,
SBSI,Southside Bancshares Inc. Common Stock,$37.21,0.20,0.54%,1215049982.00,United States,,85492,Finance,Major Banks
SCWX,SecureWorks Corp. Class A Common Stock,$20.55,0.99,5.061%,1753926081.00,United States,2016,171365,Technology,EDP Services
SDC,SmileDirectClub Inc. Class A Common Stock,$5.98,0.83,16.117%,2320916679.00,United States,2019,49208368,Health Care,Medical/Dental Instruments
SEAC,SeaChange International Inc. Common Stock,$1.09,-0.02,-1.802%,52762190.00,United States,1996,929089,Technology,Radio And Television Broadcasting And Communications Equipment
SFNC,Simmons First National Corporation Class A Common Stock,$28.27,0.81,2.95%,3061193486.00,United States,,500104,Finance,Major Banks
SIGI,Selective Insurance Group Inc. Common Stock,$80.23,-0.12,-0.149%,4822426731.00,United States,,110208,Finance,Property-Casualty Insurers
SND,Smart Sand Inc. Common Stock,$2.35,0.03,1.293%,101745210.00,United States,2016,76385,Energy,Metal Fabrications
SOLY,Soliton Inc. Common Stock,$21.33,0.15,0.708%,460654284.00,United States,2019,64416,Health Care,Medical/Dental Instruments
SPTN,SpartanNash Company Common Stock,$21.03,0.03,0.143%,755781376.00,United States,,202985,Consumer Non-Durables,Food Distributors
SPWH,Sportsman's Warehouse Holdings Inc. Common Stock,$17.65,-0.03,-0.17%,774345477.00,United States,2014,461480,Consumer Services,Other Specialty Stores
SPWR,SunPower Corporation Common Stock,$22.21,0.95,4.468%,3839115636.00,United States,2005,3225110,Technology,Semiconductors
STKS,The ONE Group Hospitality Inc. Common Stock,$10.30,0.14,1.378%,328217483.00,United States,,115049,Consumer Services,Restaurants
STMP,Stamps.com Inc.  Common Stock ($0.001 Par Value),$328.39,-0.19,-0.058%,6100059345.00,United States,1999,376444,Technology,EDP Services
SUNW,Sunworks Inc. Common Stock,$6.92,0.15,2.216%,115072625.00,United States,,1456793,Technology,Semiconductors
TBNK,Territorial Bancorp Inc. Common Stock,$25.33,0.06,0.237%,237366012.00,United States,2009,19372,Finance,Savings Institutions
TCDA,Tricida Inc. Common Stock,$4.43,0.14,3.263%,223399292.00,United States,2018,181563,Health Care,Biotechnology: Pharmaceutical Preparations
THFF,First Financial Corporation Indiana Common Stock,$39.76,0.11,0.277%,518797585.00,United States,,60211,Finance,Major Banks
THRM,Gentherm Inc Common Stock,$81.96,0.83,1.023%,2717351262.00,United States,,105827,Capital Goods,Auto Parts:O.E.M.
TRMK,Trustmark Corporation Common Stock,$30.13,0.16,0.534%,1881768156.00,United States,,356104,Finance,Major Banks
TROW,T. Rowe Price Group Inc. Common Stock,$216.73,0.13,0.06%,49184031303.00,United States,1986,821767,Finance,Investment Managers
TRST,TrustCo Bank Corp NY Common Stock,$31.33,-0.24,-0.76%,603570602.00,United States,,116303,Finance,Major Banks
UIHC,United Insurance Holdings Corp. Common Stock,$3.06,-0.08,-2.548%,132212866.00,United States,,431072,Finance,Property-Casualty Insurers
USAP,Universal Stainless & Alloy Products Inc. Common Stock,$10.81,0.06,0.558%,96402045.00,United States,1994,8538,Basic Industries,Steel/Iron Ore
USWS,U.S. Well Services Inc. Class A Common Stock,$0.7089,-0.0497,-6.552%,66195321.00,United States,2017,3131361,Energy,Oil & Gas Production
VCNX,Vaccinex Inc. Common Stock,$2.32,-0.01,-0.429%,71458575.00,United States,2018,43801,Health Care,Biotechnology: Pharmaceutical Preparations
WAFD,Washington Federal Inc. Common Stock,$33.17,0.53,1.624%,2253780463.00,United States,,497765,Finance,Major Banks
WDFC,WD-40 Company Common Stock,$231.46,-0.03,-0.013%,3172799750.00,United States,1973,33951,Basic Industries,Industrial Specialties
WRLD,World Acceptance Corporation Common Stock,$206.10,10.07,5.137%,1379405453.00,United States,1991,43181,Finance,Finance: Consumer Services
WSBF,Waterstone Financial Inc. Common Stock (MD),$20.08,0.09,0.45%,504795297.00,United States,,60793,Finance,Savings Institutions
WTBA,West Bancorporation Common Stock,$29.38,-0.03,-0.102%,486381375.00,United States,,44052,Finance,Major Banks
XENT,Intersect ENT Inc. Common Stock,$27.09,0.03,0.111%,903348070.00,United States,2014,165397,Health Care,Medical/Dental Instruments
XONE,The ExOne Company Common Stock,$23.48,-0.28,-1.178%,521681974.00,United States,2013,370282,Capital Goods,Industrial Machinery/Components
Z,Zillow Group Inc. Class C Capital Stock,$94.49,2.66,2.897%,23958521842.00,United States,,4961014,Miscellaneous,Business Services
ZEUS,Olympic Steel Inc. Common Stock,$25.32,0.75,3.053%,280477793.00,United States,1994,71506,Basic Industries,Steel/Iron Ore
ZY,Zymergen Inc. Common Stock,$13.19,0.41,3.208%,1350521963.00,United States,2021,461379,Basic Industries,Industrial Specialties
