,Symbol,Company,Buy,Analyst
0,ACST,Acasti Pharma Inc. Class A Common Stock,0,Strong Sell
1,AKTX,Akari Therapeutics plc ADR (0.01 USD),0,Strong Sell
2,BELFB,Bel Fuse Inc. Class B Common Stock,0,Strong Sell
3,CCLP,CSI Compressco LP Common Units,0,Strong Sell
4,CPIX,Cumberland Pharmaceuticals Inc. Common Stock,0,Strong Sell
5,DYAI,Dyadic International Inc. Common Stock,0,Strong Sell
6,EBIX,Ebix Inc. Common Stock,0,Strong Sell
7,EVOK,Evoke Pharma Inc. Common Stock,0,Strong Sell
8,FCAP,First Capital Inc. Common Stock,0,Strong Sell
9,FLDM,Fluidigm Corporation Common Stock,0,Strong Sell
10,GTH,Genetron Holdings Limited ADS,0,Strong Sell
11,HUGE,FSD Pharma Inc. Class B Subordinate Voting Shares,0,Strong Sell
12,JBSS,John B. Sanfilippo & Son Inc. Common Stock,0,Strong Sell
13,JCS,Communications Systems Inc. Common Stock,0,Strong Sell
14,JOUT,Johnson Outdoors Inc. Class A Common Stock,0,Strong Sell
15,MARK,Remark Holdings Inc. Common Stock,0,Strong Sell
16,MMAT,Meta Materials Inc. Common Stock,0,Strong Sell
17,NCSM,NCS Multistage Holdings Inc. Common Stock,0,Strong Sell
18,NWS,News Corporation Class B Common Stock,0,Strong Sell
19,PBTS,Powerbridge Technologies Co. Ltd. Ordinary Shares,0,Strong Sell
20,POWL,Powell Industries Inc. Common Stock,0,Strong Sell
21,PSEC,Prospect Capital Corporation Common Stock,0,Strong Sell
22,REDU,RISE Education Cayman Ltd American Depositary Shares,0,Strong Sell
23,RGP,Resources Connection Inc. Common Stock,0,Strong Sell
24,SNGX,Soligenix Inc. Common Stock,0,Strong Sell
25,TLGT,Teligent Inc. Common Stock,0,Strong Sell
26,TOPS,TOP Ships Inc. Common Stock,0,Strong Sell
27,TRMT,Tremont Mortgage Trust Common Shares of Beneficial Interest,0,Strong Sell
28,TYME,Tyme Technologies Inc. Common Stock,0,Strong Sell
29,UFPT,UFP Technologies Inc. Common Stock,0,Strong Sell
30,WTER,The Alkaline Water Company Inc. Common Stock,0,Strong Sell
31,ACB,Aurora Cannabis Inc. Common Shares,0,Sell
32,AMCX,AMC Networks Inc. Class A Common Stock,0,Sell
33,CLOV,Clover Health Investments Corp. Class A Common Stock,0,Sell
34,FIZZ,National Beverage Corp. Common Stock,0,Sell
35,GGAL,Grupo Financiero Galicia S.A. American Depositary Shares,0,Sell
36,INVA,Innoviva Inc. Common Stock,0,Sell
37,MVST,Microvast Holdings Inc. Common Stock,0,Sell
38,ORPH,Orphazyme A/S American Depositary Shares,0,Sell
39,PAHC,Phibro Animal Health Corporation Class A Common Stock,0,Sell
40,QIWI,QIWI plc American Depositary Shares,0,Sell
41,YQ,17 Education & Technology Group Inc. American Depositary Shares,0,Sell
42,AAIC,Arlington Asset Investment Corp Class A (new),0,Hold
43,ABEV,Ambev S.A. American Depositary Shares (Each representing 1 Common Share),0,Hold
44,ADT,ADT Inc. Common Stock,0,Hold
45,AEG,AEGON N.V. Common Stock,0,Hold
46,AGM,Federal Agricultural Mortgage Corporation Common Stock,0,Hold
47,AGR,Avangrid Inc. Common Stock,0,Hold
48,AJRD,Aerojet Rocketdyne Holdings Inc. Common Stock,0,Hold
49,ALE,Allete Inc.,0,Hold
50,ALX,Alexander's Inc. Common Stock,0,Hold
51,AM,Antero Midstream Corporation Common Stock,0,Hold
52,AMC,AMC Entertainment Holdings Inc. Class A Common Stock,0,Hold
53,AMR,Alpha Metallurgical Resources Inc. Common Stock,0,Hold
54,APAM,Artisan Partners Asset Management Inc. Class A Common Stock,0,Hold
55,ARI,Apollo Commercial Real Estate Finance Inc,0,Hold
56,ARR,ARMOUR Residential REIT Inc.,0,Hold
57,ARW,Arrow Electronics Inc. Common Stock,0,Hold
58,ASB,Associated Banc-Corp Common Stock,0,Hold
59,ATIP,ATI Physical Therapy Inc. Class A Common Stock,0,Hold
60,AVAL,Grupo Aval Acciones y Valores S.A. ADR (Each representing 20 preferred shares),0,Hold
61,AWI,Armstrong World Industries Inc Common Stock,0,Hold
62,AZUL,Azul S.A. American Depositary Shares (each representing three preferred shares),0,Hold
63,BAP,Credicorp Ltd. Common Stock,0,Hold
64,BCSF,Bain Capital Specialty Finance Inc. Common Stock,0,Hold
65,BEDU,Bright Scholar Education Holdings Limited American Depositary Shares each  representing one Class A Ordinary Share,0,Hold
66,BEN,Franklin Resources Inc. Common Stock,0,Hold
67,BGS,B&G Foods Inc. B&G Foods Inc. Common Stock,0,Hold
68,BIG,Big Lots Inc. Common Stock,0,Hold
69,BKE,Buckle Inc. (The) Common Stock,0,Hold
70,BMI,Badger Meter Inc. Common Stock,0,Hold
71,BOH,Bank of Hawaii Corporation Common Stock,0,Hold
72,BPMP,BP Midstream Partners LP Common Units representing Limited Partner Interests,0,Hold
73,BRFS,BRF S.A.,0,Hold
74,BTU,Peabody Energy Corporation Common Stock ,0,Hold
75,CAAP,Corporacion America Airports SA Common Shares,0,Hold
76,CAI,CAI International Inc. Common Stock,0,Hold
77,CAJ,Canon Inc. American Depositary Shares,0,Hold
78,CANG,Cango Inc. American Depositary Shares  each representing two (2) Class A Ordinary Shares,0,Hold
79,CBU,Community Bank System Inc. Common Stock,0,Hold
80,CCO,Clear Channel Outdoor Holdings Inc. Common Stock,0,Hold
81,CCU,Compania Cervecerias Unidas S.A. Common Stock,0,Hold
82,CEPU,Central Puerto S.A. American Depositary Shares (each represents ten Common Shares),0,Hold
83,CFR,Cullen/Frost Bankers Inc. Common Stock,0,Hold
84,CHH,Choice Hotels International Inc. Common Stock,0,Hold
85,CHS,Chico's FAS Inc. Common Stock,0,Hold
86,CHT,Chunghwa Telecom Co. Ltd.,0,Hold
87,CIG,Comp En De Mn Cemig ADS American Depositary Shares,0,Hold
88,CIM,Chimera Investment Corporation Common Stock,0,Hold
89,CL,Colgate-Palmolive Company Common Stock,0,Hold
90,CLB,Core Laboratories N.V. Common Stock,0,Hold
91,CLDR,Cloudera Inc. Common Stock,0,Hold
92,CLI,Mack-Cali Realty Corporation Common Stock,0,Hold
93,CLS,Celestica Inc. Common Stock,0,Hold
94,CLX,Clorox Company (The) Common Stock,0,Hold
95,CMC,Commercial Metals Company Common Stock,0,Hold
96,CNA,CNA Financial Corporation Common Stock,0,Hold
97,COR,CoreSite Realty Corporation Common Stock,0,Hold
98,CORR,CorEnergy Infrastructure Trust Inc. Common Stock,0,Hold
99,CPAC,Cementos Pacasmayo S.A.A. American Depositary Shares (Each representing five Common Shares),0,Hold
100,CPB,Campbell Soup Company Common Stock,0,Hold
101,CPLG,CorePoint Lodging Inc. Common Stock ,0,Hold
102,CRS,Carpenter Technology Corporation Common Stock,0,Hold
103,CTK,CooTek (Cayman) Inc. American Depositary Shares each representing 50 Class A Ordinary Shares,0,Hold
104,CUK,Carnival Plc ADS ADS,0,Hold
105,CVI,CVR Energy Inc. Common Stock,0,Hold
106,CXP,Columbia Property Trust Inc. Common Stock,0,Hold
107,DDD,3D Systems Corporation Common Stock,0,Hold
108,DDS,Dillard's Inc. Common Stock,0,Hold
109,DIDI,DiDi Global Inc. American Depositary Shares (each four representing one Class A Ordinary Share),0,Hold
110,DK,Delek US Holdings Inc. Common Stock,0,Hold
111,DKL,Delek Logistics Partners L.P. Common Units representing Limited Partner Interests,0,Hold
112,DRQ,Dril-Quip Inc. Common Stock,0,Hold
113,E,ENI S.p.A. Common Stock,0,Hold
114,ELVT,Elevate Credit Inc. Common Stock,0,Hold
115,ENBL,Enable Midstream Partners LP Common Units representing limited partner interests,0,Hold
116,EPAC,Enerpac Tool Group Corp. Common Stock,0,Hold
117,EQC,Equity Commonwealth Common Shares of Beneficial Interest,0,Hold
118,ETRN,Equitrans Midstream Corporation Common Stock ,0,Hold
119,EXPR,Express Inc. Common Stock,0,Hold
120,FET,Forum Energy Technologies Inc. Common Stock,0,Hold
121,FHI,Federated Hermes Inc. Common Stock,0,Hold
122,FI,Frank's International N.V. Common Stock,0,Hold
123,FIX,Comfort Systems USA Inc. Common Stock,0,Hold
124,FLNG,FLEX LNG Ltd. Ordinary Shares,0,Hold
125,FLO,Flowers Foods Inc. Common Stock,0,Hold
126,FMS,Fresenius Medical Care AG Common Stock,0,Hold
127,FSLY,Fastly Inc. Class A Common Stock,0,Hold
128,GCP,GCP Applied Technologies Inc. Common Stock,0,Hold
129,GKOS,Glaukos Corporation Common Stock,0,Hold
130,GLOP,GasLog Partners LP Common Units representing limited partnership interests,0,Hold
131,GOL,Gol Linhas Aereas Inteligentes S.A. Sponsored ADR representing 2 Pfd Shares,0,Hold
132,GPX,GP Strategies Corporation Common Stock,0,Hold
133,GRA,W.R. Grace & Co. Common Stock,0,Hold
134,GSBD,Goldman Sachs BDC Inc. Common Stock,0,Hold
135,H,Hyatt Hotels Corporation Class A Common Stock,0,Hold
136,HBB,Hamilton Beach Brands Holding Company Class A Common Stock ,0,Hold
137,HE,Hawaiian Electric Industries Inc. Common Stock,0,Hold
138,HLI,Houlihan Lokey Inc. Class A Common Stock,0,Hold
139,HMN,Horace Mann Educators Corporation Common Stock,0,Hold
140,HMY,Harmony Gold Mining Company Limited,0,Hold
141,HRL,Hormel Foods Corporation Common Stock,0,Hold
142,HSBC,HSBC Holdings plc. Common Stock,0,Hold
143,HT,Hersha Hospitality Trust Class A Common Shares of Beneficial Interest,0,Hold
144,HXL,Hexcel Corporation Common Stock,0,Hold
145,ICL,ICL Group Ltd. Ordinary Shares,0,Hold
146,IHG,Intercontinental Hotels Group American Depositary Shares (Each representing one Ordinary Share),0,Hold
147,INGR,Ingredion Incorporated Common Stock,0,Hold
148,JHG,Janus Henderson Group plc Ordinary Shares,0,Hold
149,JKS,JinkoSolar Holding Company Limited American Depositary Shares (each representing 4 Common Shares),0,Hold
150,JMIA,Jumia Technologies AG American Depositary Shares each representing two Ordinary Shares,0,Hold
151,JMP,JMP Group LLC Common Shares,0,Hold
152,JWN,Nordstrom Inc. Common Stock,0,Hold
153,KAMN,Kaman Corporation Common Stock,0,Hold
154,KMB,Kimberly-Clark Corporation Common Stock,0,Hold
155,KMI,Kinder Morgan Inc. Common Stock,0,Hold
156,KNOP,KNOT Offshore Partners LP Common Units representing Limited Partner Interests,0,Hold
157,KR,Kroger Company (The) Common Stock,0,Hold
158,KRA,Kraton Corporation Common Stock,0,Hold
159,LCI,Lannett Co Inc Common Stock,0,Hold
160,LII,Lennox International Inc. Common Stock,0,Hold
161,LL,Lumber Liquidators Holdings Inc Common Stock,0,Hold
162,LOMA,Loma Negra Compania Industrial Argentina Sociedad Anonima ADS,0,Hold
163,LPL,LG Display Co Ltd AMERICAN DEPOSITORY SHARES,0,Hold
164,LTC,LTC Properties Inc. Common Stock,0,Hold
165,LUMN,Lumen Technologies Inc. Common Stock,0,Hold
166,MAC,Macerich Company (The) Common Stock,0,Hold
167,MD,Mednax Inc. Common Stock,0,Hold
168,MDLA,Medallia Inc. Common Stock,0,Hold
169,MEI,Methode Electronics Inc. Common Stock,0,Hold
170,MFG,Mizuho Financial Group Inc. Sponosred ADR (Japan),0,Hold
171,MKC,McCormick & Company Incorporated Common Stock,0,Hold
172,MOV,Movado Group Inc. Common Stock,0,Hold
173,MTD,Mettler-Toledo International Inc. Common Stock,0,Hold
174,NBR,Nabors Industries Ltd.,0,Hold
175,NEXA,Nexa Resources S.A. Common Shares,0,Hold
176,NGL,NGL ENERGY PARTNERS LP Common Units representing Limited Partner Interests,0,Hold
177,NHI,National Health Investors Inc. Common Stock,0,Hold
178,NINE,Nine Energy Service Inc. Common Stock,0,Hold
179,NTCO,Natura &Co Holding S.A. American Depositary Shares ,0,Hold
180,NYC,New York City REIT Inc. Class A Common Stock,0,Hold
181,OLP,One Liberty Properties Inc. Common Stock,0,Hold
182,PAM,Pampa Energia S.A. Pampa Energia S.A.,0,Hold
183,PBF,PBF Energy Inc. Class A Common Stock,0,Hold
184,PBFX,PBF Logistics LP Common Units representing limited partner interests,0,Hold
185,PGRE,Paramount Group Inc. Common Stock,0,Hold
186,PHI,PLDT Inc. Sponsored ADR,0,Hold
187,PKG,Packaging Corporation of America Common Stock,0,Hold
188,PLTR,Palantir Technologies Inc. Class A Common Stock,0,Hold
189,PNM,PNM Resources Inc. (Holding Co.) Common Stock,0,Hold
190,PNW,Pinnacle West Capital Corporation Common Stock,0,Hold
191,PRTY,Party City Holdco Inc. Common Stock,0,Hold
192,PRU,Prudential Financial Inc. Common Stock,0,Hold
193,PSB,PS Business Parks Inc. (MD) Common Stock,0,Hold
194,QS,QuantumScape Corporation Class A Common Stock,0,Hold
195,RES,RPC Inc. Common Stock,0,Hold
196,REV,Revlon Inc. New Common Stock,0,Hold
197,RGR,Sturm Ruger & Company Inc. Common Stock,0,Hold
198,RIG,Transocean Ltd (Switzerland) Common Stock,0,Hold
199,RKT,Rocket Companies Inc. Class A Common Stock,0,Hold
200,RNR,RenaissanceRe Holdings Ltd. Common Stock,0,Hold
201,RPAI,Retail Properties of America Inc. Class A Common Stock,0,Hold
202,RSF,RiverNorth Specialty Finance Corporation,0,Hold
203,RYI,Ryerson Holding Corporation Common Stock,0,Hold
204,RYN,Rayonier Inc. REIT Common Stock,0,Hold
205,SCU,Sculptor Capital Management Inc. Class A Common Stock,0,Hold
206,SFBS,ServisFirst Bancshares Inc. Common Stock,0,Hold
207,SHO,Sunstone Hotel Investors Inc. Sunstone Hotel Investors Inc. Common Shares,0,Hold
208,SII,Sprott Inc. Common Shares,0,Hold
209,SJM,J.M. Smucker Company (The) New Common Stock,0,Hold
210,SJW,SJW Group Common Stock (DE),0,Hold
211,SKT,Tanger Factory Outlet Centers Inc. Common Stock,0,Hold
212,SKY,Skyline Champion Corporation Common Stock,0,Hold
213,SMLP,Summit Midstream Partners LP Common Units Representing Limited Partner Interests,0,Hold
214,SNR,New Senior Investment Group Inc. Common Stock,0,Hold
215,SON,Sonoco Products Company Common Stock,0,Hold
216,SPNT,SiriusPoint Ltd. Common Shares,0,Hold
217,SRLP,Sprague Resources LP Common Units representing Limited Partner Interests,0,Hold
218,TAL,TAL Education Group American Depositary Shares,0,Hold
219,TEVA,Teva Pharmaceutical Industries Limited American Depositary Shares,0,Hold
220,TISI,Team Inc. Common Stock,0,Hold
221,TTC,Toro Company (The) Common Stock,0,Hold
222,TWI,Titan International Inc. (DE) Common Stock,0,Hold
223,UE,Urban Edge Properties Common Shares of Beneficial Interest,0,Hold
224,UL,Unilever PLC Common Stock,0,Hold
225,UNF,Unifirst Corporation Common Stock,0,Hold
226,UNFI,United Natural Foods Inc. Common Stock,0,Hold
227,USAC,USA Compression Partners LP Common Units Representing Limited Partner Interests,0,Hold
228,USNA,USANA Health Sciences Inc. Common Stock,0,Hold
229,UVE,UNIVERSAL INSURANCE HOLDINGS INC Common Stock,0,Hold
230,VER,VEREIT Inc. Common Stock,0,Hold
231,VET,Vermilion Energy Inc. Common (Canada),0,Hold
232,VIV,Telefonica Brasil S.A. American Depositary Shares (Each representing One Common Share),0,Hold
233,VNE,Veoneer Inc. Common Stock ,0,Hold
234,VNO,Vornado Realty Trust Common Stock,0,Hold
235,WBT,Welbilt Inc. Common Stock,0,Hold
236,WIT,Wipro Limited Common Stock,0,Hold
237,WLKP,Westlake Chemical Partners LP Common Units representing limited partner interests,0,Hold
238,WOR,Worthington Industries Inc. Common Stock,0,Hold
239,WPG,Washington Prime Group Inc. Common Stock,0,Hold
240,WRE,Washington Real Estate Investment Trust Common Stock,0,Hold
241,WTM,White Mountains Insurance Group Ltd. Common Stock,0,Hold
242,WTS,Watts Water Technologies Inc. Class A Common Stock,0,Hold
243,XL,XL Fleet Corp. Class A Common Stock,0,Hold
244,YELP,Yelp Inc. Common Stock,0,Hold
245,YSG,Yatsen Holding Limited American Depositary Shares each representing four Class A ordinary shares,0,Hold
246,AAON,AAON Inc. Common Stock,0,Hold
247,ABTX,Allegiance Bancshares Inc. Common Stock,0,Hold
248,ADMP,Adamis Pharmaceuticals Corporation Common Stock,0,Hold
249,ADP,Automatic Data Processing Inc. Common Stock,0,Hold
250,AESE,Allied Esports Entertainment Inc. Common Stock,0,Hold
251,ALOT,AstroNova Inc. Common Stock,0,Hold
252,ALRS,Alerus Financial Corporation Common Stock,0,Hold
253,ALTA,Altabancorp Common Stock,0,Hold
254,ALTM,Altus Midstream Company Class A Common Stock,0,Hold
255,ALYA,Alithya Group inc. Class A Subordinate Voting Shares,0,Hold
256,AOSL,Alpha and Omega Semiconductor Limited Common Shares,0,Hold
257,APPF,AppFolio Inc. Class A Common Stock,0,Hold
258,APRE,Aprea Therapeutics Inc. Common stock,0,Hold
259,ARCT,Arcturus Therapeutics Holdings Inc. Common Stock,0,Hold
260,AROW,Arrow Financial Corporation Common Stock,0,Hold
261,ASLE,AerSale Corporation Common Stock,0,Hold
262,ATXI,Avenue Therapeutics Inc. Common Stock,0,Hold
263,AXDX,Accelerate Diagnostics Inc. Common Stock,0,Hold
264,BANF,BancFirst Corporation Common Stock,0,Hold
265,BBBY,Bed Bath & Beyond Inc. Common Stock,0,Hold
266,BCBP,BCB Bancorp Inc. (NJ) Common Stock,0,Hold
267,BFC,Bank First Corporation Common Stock,0,Hold
268,BHF,Brighthouse Financial Inc. Common Stock,0,Hold
269,BKCC,BlackRock Capital Investment Corporation Common Stock,0,Hold
270,BKEP,Blueknight Energy Partners L.P. Common Units,0,Hold
271,BLBD,Blue Bird Corporation Common Stock,0,Hold
272,BLCM,Bellicum Pharmaceuticals Inc. Common Stock,0,Hold
273,BLCT,BlueCity Holdings Limited American Depositary Shares,0,Hold
274,BOCH,Bank of Commerce Holdings (CA) Common Stock,0,Hold
275,BSBK,Bogota Financial Corp. Common Stock,0,Hold
276,CACC,Credit Acceptance Corporation Common Stock,0,Hold
277,CBFV,CB Financial Services Inc. Common Stock,0,Hold
278,CBRL,Cracker Barrel Old Country Store Inc Common Stock,0,Hold
279,CBSH,Commerce Bancshares Inc. Common Stock,0,Hold
280,CBTX,CBTX Inc. Common Stock,0,Hold
281,CCBG,Capital City Bank Group Common Stock,0,Hold
282,CFBK,CF Bankshares Inc. Common Stock,0,Hold
283,CFFN,Capitol Federal Financial Inc. Common Stock,0,Hold
284,CHCO,City Holding Company Common Stock,0,Hold
285,CLBK,Columbia Financial Inc. Common Stock,0,Hold
286,CLNE,Clean Energy Fuels Corp. Common Stock,0,Hold
287,CLVS,Clovis Oncology Inc. Common Stock,0,Hold
288,CNDT,Conduent Incorporated Common Stock ,0,Hold
289,CNFR,Conifer Holdings Inc. Common Stock,0,Hold
290,CNXN,PC Connection Inc. Common Stock,0,Hold
291,COHR,Coherent Inc. Common Stock,0,Hold
292,COLB,Columbia Banking System Inc. Common Stock,0,Hold
293,CRON,Cronos Group Inc. Common Share,0,Hold
294,CRTX,Cortexyme Inc. Common Stock,0,Hold
295,CRWS,Crown Crafts Inc Common Stock,0,Hold
296,CVAC,CureVac N.V. Ordinary Shares,0,Hold
297,DFFN,Diffusion Pharmaceuticals Inc. Common Stock,0,Hold
298,DFH,Dream Finders Homes Inc. Class A Common Stock,0,Hold
299,DHC,Diversified Healthcare Trust Common Shares of Beneficial Interest,0,Hold
300,DISCK,Discovery Inc. Series C Common Stock,0,Hold
301,DSPG,DSP Group Inc. Common Stock,0,Hold
302,EBSB,Meridian Bancorp Inc. Common Stock,0,Hold
303,EGBN,Eagle Bancorp Inc. Common Stock,0,Hold
304,ENDP,Endo International plc Ordinary Shares,0,Hold
305,ESGR,Enstar Group Limited Ordinary Shares,0,Hold
306,ESLT,Elbit Systems Ltd. Ordinary Shares,0,Hold
307,ESSA,ESSA Bancorp Inc. Common Stock,0,Hold
308,ESXB,Community Bankers Trust Corporation Common Stock (VA),0,Hold
309,EXPD,Expeditors International of Washington Inc. Common Stock,0,Hold
310,FANH,Fanhua Inc. American Depositary Shares,0,Hold
311,FARO,FARO Technologies Inc. Common Stock,0,Hold
312,FBRX,Forte Biosciences Inc. Common Stock,0,Hold
313,FCEL,FuelCell Energy Inc. Common Stock,0,Hold
314,FCRD,First Eagle Alternative Capital BDC Inc. Common Stock,0,Hold
315,FFBC,First Financial Bancorp. Common Stock,0,Hold
316,FFIN,First Financial Bankshares Inc. Common Stock,0,Hold
317,FHB,First Hawaiian Inc. Common Stock,0,Hold
318,FLNT,Fluent Inc. Common Stock,0,Hold
319,FMAO,Farmers & Merchants Bancorp Inc. Common Stock,0,Hold
320,FNWB,First Northwest Bancorp Common Stock,0,Hold
321,FRBK,Republic First Bancorp Inc. Common Stock,0,Hold
322,FTEK,Fuel Tech Inc. Common Stock,0,Hold
323,FULT,Fulton Financial Corporation Common Stock,0,Hold
324,GABC,German American Bancorp Inc. Common Stock,0,Hold
325,GAIN,Gladstone Investment Corporation Business Development Company,0,Hold
326,GBDC,Golub Capital BDC Inc. Common Stock,0,Hold
327,GBLI,Global Indemnity Group LLC Class A Common Stock (DE),0,Hold
328,GECC,Great Elm Capital Corp. Common Stock,0,Hold
329,GLAD,Gladstone Capital Corporation Common Stock,0,Hold
330,GRPN,Groupon Inc. Common Stock,0,Hold
331,GSKY,GreenSky Inc. Class A Common Stock,0,Hold
332,HA,Hawaiian Holdings Inc. Common Stock,0,Hold
333,HHR,HeadHunter Group PLC American Depositary Shares,0,Hold
334,HMHC,Houghton Mifflin Harcourt Company Common Stock,0,Hold
335,HOPE,Hope Bancorp Inc. Common Stock,0,Hold
336,HRZN,Horizon Technology Finance Corporation Common Stock,0,Hold
337,HTBI,HomeTrust Bancshares Inc. Common Stock,0,Hold
338,ICMB,Investcorp Credit Management BDC Inc. Common Stock,0,Hold
339,IDRA,Idera Pharmaceuticals Inc. Common Stock,0,Hold
340,INFN,Infinera Corporation Common Stock,0,Hold
341,INGN,Inogen Inc Common Stock,0,Hold
342,INOV,Inovalon Holdings Inc. Class A Common Stock,0,Hold
343,INTC,Intel Corporation Common Stock,0,Hold
344,INTZ,Intrusion Inc. Common Stock,0,Hold
345,IRBT,iRobot Corporation Common Stock,0,Hold
346,ITRM,Iterum Therapeutics plc Ordinary Share,0,Hold
347,ITRN,Ituran Location and Control Ltd. Ordinary Shares,0,Hold
348,JAKK,JAKKS Pacific Inc. Common Stock,0,Hold
349,JOBS,51job Inc. American Depositary Shares,0,Hold
350,KLXE,KLX Energy Services Holdings Inc. Common Stock,0,Hold
351,KRMD,Repro Med Systems Inc. Common Stock,0,Hold
352,LAZY,Lazydays Holdings Inc. Common Stock,0,Hold
353,LGIH,LGI Homes Inc. Common Stock,0,Hold
354,LHDX,Lucira Health Inc. Common Stock,0,Hold
355,LILA,Liberty Latin America Ltd. Class A Common Stock,0,Hold
356,LILAK,Liberty Latin America Ltd. Class C Common Stock,0,Hold
357,LJPC,La Jolla Pharmaceutical Company Common Stock,0,Hold
358,LKFN,Lakeland Financial Corporation Common Stock,0,Hold
359,LMNL,Liminal BioSciences Inc. Common Shares,0,Hold
360,LMRK,Landmark Infrastructure Partners LP Common Units,0,Hold
361,LSTR,Landstar System Inc. Common Stock,0,Hold
362,MCBS,MetroCity Bankshares Inc. Common Stock,0,Hold
363,MGEE,MGE Energy Inc,0,Hold
364,MGI,Moneygram International Inc. Common Stock,0,Hold
365,MGLN,Magellan Health Inc. Common Stock,0,Hold
366,MGPI,MGP Ingredients Inc.,0,Hold
367,MILE,Metromile Inc. Common Stock,0,Hold
368,MLVF,Malvern Bancorp Inc. Common Stock,0,Hold
369,MMLP,Martin Midstream Partners L.P. Limited Partnership,0,Hold
370,MMYT,MakeMyTrip Limited Ordinary Shares,0,Hold
371,MNRO,Monro Inc. Common Stock,0,Hold
372,MSON,MISONIX Inc. Common Stock (DE),0,Hold
373,MVBF,MVB Financial Corp. Common Stock,0,Hold
374,MVIS,MicroVision Inc. Common Stock,0,Hold
375,MYGN,Myriad Genetics Inc. Common Stock,0,Hold
376,NATI,National Instruments Corporation Common Stock,0,Hold
377,NEWT,Newtek Business Services Corp. Common Stock (Maryland),0,Hold
378,NOVT,Novanta Inc. Common Stock,0,Hold
379,NRIM,Northrim BanCorp Inc Common Stock,0,Hold
380,NTCT,NetScout Systems Inc. Common Stock,0,Hold
381,NTUS,Natus Medical Incorporated Common Stock,0,Hold
382,NWBI,Northwest Bancshares Inc. Common Stock,0,Hold
383,ODP,The ODP Corporation Common Stock,0,Hold
384,ODT,Odonate Therapeutics Inc. Common Stock,0,Hold
385,OMP,Oasis Midstream Partners LP Common Units Representing Limited Partner Interests,0,Hold
386,OPI,Office Properties Income Trust Common Shares of Beneficial Interest,0,Hold
387,OXSQ,Oxford Square Capital Corp. Common Stock,0,Hold
388,OZON,Ozon Holdings PLC American Depositary Shares each ADS representing one ordinary share,0,Hold
389,PBCT,People's United Financial Inc. Common Stock,0,Hold
390,PBIP,Prudential Bancorp Inc. Common Stock,0,Hold
391,PBPB,Potbelly Corporation Common Stock,0,Hold
392,PBYI,Puma Biotechnology Inc Common Stock,0,Hold
393,PETS,PetMed Express Inc. Common Stock,0,Hold
394,PFX,PhenixFIN Corporation Common Stock,0,Hold
395,PROG,Progenity Inc. Common Stock,0,Hold
396,PROV,Provident Financial Holdings Inc. Common Stock,0,Hold
397,PXS,Pyxis Tankers Inc. Common Stock,0,Hold
398,QADA,QAD Inc. Class A Common Stock,0,Hold
399,QLYS,Qualys Inc. Common Stock,0,Hold
400,RAIL,FreightCar America Inc. Common Stock,0,Hold
401,RAVN,Raven Industries Inc. Common Stock,0,Hold
402,RDI,Reading International Inc Class A Common Stock,0,Hold
403,RDUS,Radius Health Inc. Common Stock,0,Hold
404,RIDE,Lordstown Motors Corp. Class A Common Stock,0,Hold
405,RNST,Renasant Corporation Common Stock,0,Hold
406,SABR,Sabre Corporation Common Stock,0,Hold
407,SAFM,Sanderson Farms Inc. Common Stock,0,Hold
408,SBSI,Southside Bancshares Inc. Common Stock,0,Hold
409,SCR,Score Media and Gaming Inc. Class A Subordinate Voting Shares,0,Hold
410,SCWX,SecureWorks Corp. Class A Common Stock,0,Hold
411,SDC,SmileDirectClub Inc. Class A Common Stock,0,Hold
412,SEAC,SeaChange International Inc. Common Stock,0,Hold
413,SFNC,Simmons First National Corporation Class A Common Stock,0,Hold
414,SIGI,Selective Insurance Group Inc. Common Stock,0,Hold
415,SMMT,Summit Therapeutics Inc. Common Stock ,0,Hold
416,SND,Smart Sand Inc. Common Stock,0,Hold
417,SNDL,Sundial Growers Inc. Common Shares,0,Hold
418,SOLY,Soliton Inc. Common Stock,0,Hold
419,SPTN,SpartanNash Company Common Stock,0,Hold
420,SPWH,Sportsman's Warehouse Holdings Inc. Common Stock,0,Hold
421,SPWR,SunPower Corporation Common Stock,0,Hold
422,STKS,The ONE Group Hospitality Inc. Common Stock,0,Hold
423,STMP,Stamps.com Inc.  Common Stock ($0.001 Par Value),0,Hold
424,SUNW,Sunworks Inc. Common Stock,0,Hold
425,TBNK,Territorial Bancorp Inc. Common Stock,0,Hold
426,TC,TuanChe Limited American Depositary Shares,0,Hold
427,TCDA,Tricida Inc. Common Stock,0,Hold
428,THFF,First Financial Corporation Indiana Common Stock,0,Hold
429,THRM,Gentherm Inc Common Stock,0,Hold
430,THTX,Theratechnologies Inc. Common Shares,0,Hold
431,TIGO,Millicom International Cellular S.A. Common Stock,0,Hold
432,TRMK,Trustmark Corporation Common Stock,0,Hold
433,TROW,T. Rowe Price Group Inc. Common Stock,0,Hold
434,TRST,TrustCo Bank Corp NY Common Stock,0,Hold
435,TRVG,trivago N.V. American Depositary Shares,0,Hold
436,UIHC,United Insurance Holdings Corp. Common Stock,0,Hold
437,USAP,Universal Stainless & Alloy Products Inc. Common Stock,0,Hold
438,USWS,U.S. Well Services Inc. Class A Common Stock,0,Hold
439,VCNX,Vaccinex Inc. Common Stock,0,Hold
440,VIOT,Viomi Technology Co. Ltd American Depositary Shares,0,Hold
441,WAFD,Washington Federal Inc. Common Stock,0,Hold
442,WDFC,WD-40 Company Common Stock,0,Hold
443,WRLD,World Acceptance Corporation Common Stock,0,Hold
444,WSBF,Waterstone Financial Inc. Common Stock (MD),0,Hold
