,Symbol,Company,Buy,Analyst
445,WTBA,West Bancorporation Common Stock,0,Hold
446,XENT,Intersect ENT Inc. Common Stock,0,Hold
447,XONE,The ExOne Company Common Stock,0,Hold
448,YJ,Yunji Inc. American Depository Shares,0,Hold
449,Z,Zillow Group Inc. Class C Capital Stock,0,Hold
450,ZEUS,Olympic Steel Inc. Common Stock,0,Hold
451,ZY,Zymergen Inc. Common Stock,0,Hold
452,APRN,Blue Apron Holdings Inc. Class A Common Stock,0,Strong Sell
453,BBAR,Banco BBVA Argentina S.A. ADS,0,Strong Sell
454,BVN,Buenaventura Mining Company Inc.,0,Strong Sell
455,CNS,Cohen & Steers Inc Common Stock,0,Strong Sell
456,ENIA,Enel Americas S.A. American Depositary Shares,0,Strong Sell
457,FPH,Five Point Holdings LLC Class A Common Shares,0,Strong Sell
458,GCI,Gannett Co. Inc. Common Stock,0,Strong Sell
459,KB,KB Financial Group Inc,0,Strong Sell
460,LAIX,LAIX Inc. American Depositary Shares each  representing one Class A Ordinary Share,0,Strong Sell
461,MMI,Marcus & Millichap Inc. Common Stock,0,Strong Sell
462,NL,NL Industries Inc. Common Stock,0,Strong Sell
463,NMM,Navios Maritime Partners LP Common Units Representing Limited Partner Interests,0,Strong Sell
464,ONE,OneSmart International Education Group Limited ADS,0,Strong Sell
465,PRT,PermRock Royalty Trust Trust Units,0,Strong Sell
466,RYB,RYB Education Inc. American depositary shares each representing one Class A ordinary share,0,Strong Sell
467,SHG,Shinhan Financial Group Co Ltd American Depositary Shares,0,Strong Sell
468,SOGO,Sogou Inc. American Depositary Shares each representing one Class A Ordinary Share,0,Strong Sell
469,TCS,Container Store (The) Common Stock,0,Strong Sell
470,TEO,Telecom Argentina SA,0,Strong Sell
471,TGS,Transportadora de Gas del Sur SA TGS Common Stock,0,Strong Sell
472,WEI,Weidai Ltd. American depositary shares each  representing one (1) Class A ordinary share,0,Strong Sell
473,WF,Woori Financial Group Inc. American Depositary Shares (each representing three (3) shares of Common Stock),0,Strong Sell
474,YALA,Yalla Group Limited American Depositary Shares each representing one Class A Ordinary Share,0,Strong Sell
475,ZME,Zhangmen Education Inc. American Depositary Shares each representing nine (9) Class A ordinary shares,0,Strong Sell
476,AAPL,Apple Inc. Common Stock,1,Strong Buy
477,MSFT,Microsoft Corporation Common Stock,1,Strong Buy
478,GOOG,Alphabet Inc. Class C Capital Stock,1,Strong Buy
479,GOOGL,Alphabet Inc. Class A Common Stock,1,Strong Buy
480,AMZN,Amazon.com Inc. Common Stock,1,Strong Buy
481,FB,Facebook Inc. Class A Common Stock,1,Strong Buy
482,TSLA,Tesla Inc. Common Stock,1,Buy
483,NVDA,NVIDIA Corporation Common Stock,1,Strong Buy
484,V,Visa Inc.,1,Strong Buy
485,JPM,JP Morgan Chase & Co. Common Stock,1,Strong Buy
486,JNJ,Johnson & Johnson Common Stock,1,Strong Buy
487,WMT,Walmart Inc. Common Stock,1,Strong Buy
488,UNH,UnitedHealth Group Incorporated Common Stock (DE),1,Strong Buy
489,PG,Procter & Gamble Company (The) Common Stock,1,Buy
490,HD,Home Depot Inc. (The) Common Stock,1,Strong Buy
491,BAC,Bank of America Corporation Common Stock,1,Strong Buy
492,MA,Mastercard Incorporated Common Stock,1,Strong Buy
493,DIS,Walt Disney Company (The) Common Stock,1,Strong Buy
494,PYPL,PayPal Holdings Inc. Common Stock,1,Strong Buy
495,ADBE,Adobe Inc. Common Stock,1,Strong Buy
496,CMCSA,Comcast Corporation Class A Common Stock,1,Strong Buy
497,NFLX,Netflix Inc. Common Stock,1,Strong Buy
498,PFE,Pfizer Inc. Common Stock,1,Buy
499,CRM,Salesforce.com Inc Common Stock,1,Strong Buy
500,NKE,Nike Inc. Common Stock,1,Strong Buy
501,CSCO,Cisco Systems Inc. Common Stock (DE),1,Strong Buy
502,KO,Coca-Cola Company (The) Common Stock,1,Strong Buy
503,ORCL,Oracle Corporation Common Stock,1,Buy
504,XOM,Exxon Mobil Corporation Common Stock,1,Buy
505,DHR,Danaher Corporation Common Stock,1,Strong Buy
506,ACN,Accenture plc Class A Ordinary Shares (Ireland),1,Strong Buy
507,ABT,Abbott Laboratories Common Stock,1,Strong Buy
508,LLY,Eli Lilly and Company Common Stock,1,Strong Buy
509,TMO,Thermo Fisher Scientific Inc Common Stock,1,Strong Buy
510,PEP,PepsiCo Inc. Common Stock,1,Buy
511,AVGO,Broadcom Inc. Common Stock,1,Strong Buy
512,COST,Costco Wholesale Corporation Common Stock,1,Strong Buy
513,T,AT&T Inc.,1,Buy
514,WFC,Wells Fargo & Company Common Stock,1,Strong Buy
515,ABBV,AbbVie Inc. Common Stock,1,Strong Buy
516,CVX,Chevron Corporation Common Stock,1,Strong Buy
517,MS,Morgan Stanley Common Stock,1,Strong Buy
518,MRK,Merck & Company Inc. Common Stock (new),1,Buy
519,TXN,Texas Instruments Incorporated Common Stock,1,Strong Buy
520,MCD,McDonald's Corporation Common Stock,1,Strong Buy
521,MDT,Medtronic plc. Ordinary Shares,1,Strong Buy
522,MRNA,Moderna Inc. Common Stock,1,Buy
523,UPS,United Parcel Service Inc. Common Stock,1,Buy
524,NEE,NextEra Energy Inc. Common Stock,1,Strong Buy
525,PM,Philip Morris International Inc Common Stock,1,Strong Buy
526,TMUS,T-Mobile US Inc. Common Stock,1,Strong Buy
527,INTU,Intuit Inc. Common Stock,1,Strong Buy
528,QCOM,QUALCOMM Incorporated Common Stock,1,Strong Buy
529,HON,Honeywell International Inc. Common Stock,1,Strong Buy
530,C,Citigroup Inc. Common Stock,1,Strong Buy
531,LOW,Lowe's Companies Inc. Common Stock,1,Strong Buy
532,CHTR,Charter Communications Inc. Class A Common Stock New,1,Strong Buy
533,BLK,BlackRock Inc. Common Stock,1,Strong Buy
534,BMY,Bristol-Myers Squibb Company Common Stock,1,Strong Buy
535,GS,Goldman Sachs Group Inc. (The) Common Stock,1,Strong Buy
536,AMT,American Tower Corporation (REIT) Common Stock,1,Strong Buy
537,SBUX,Starbucks Corporation Common Stock,1,Strong Buy
538,SCHW,Charles Schwab Corporation (The) Common Stock,1,Strong Buy
539,UNP,Union Pacific Corporation Common Stock,1,Strong Buy
540,NOW,ServiceNow Inc. Common Stock,1,Strong Buy
541,AXP,American Express Company Common Stock,1,Buy
542,AMD,Advanced Micro Devices Inc. Common Stock,1,Strong Buy
543,RTX,Raytheon Technologies Corporation Common Stock,1,Strong Buy
544,AMAT,Applied Materials Inc. Common Stock,1,Strong Buy
545,BA,Boeing Company (The) Common Stock,1,Strong Buy
546,ISRG,Intuitive Surgical Inc. Common Stock,1,Buy
547,AMGN,Amgen Inc. Common Stock,1,Buy
548,IBM,International Business Machines Corporation Common Stock,1,Buy
549,TGT,Target Corporation Common Stock,1,Strong Buy
550,EL,Estee Lauder Companies Inc. (The) Common Stock,1,Strong Buy
551,CVS,CVS Health Corporation Common Stock,1,Strong Buy
552,CAT,Caterpillar Inc. Common Stock,1,Buy
553,GE,General Electric Company Common Stock,1,Buy
554,DE,Deere & Company Common Stock,1,Strong Buy
555,SPGI,S&P Global Inc. Common Stock,1,Strong Buy
556,MMM,3M Company Common Stock,1,Buy
557,SQ,Square Inc. Class A Common Stock,1,Strong Buy
558,SYK,Stryker Corporation Common Stock,1,Strong Buy
559,TEAM,Atlassian Corporation Plc Class A Ordinary Shares,1,Strong Buy
560,PLD,Prologis Inc. Common Stock,1,Strong Buy
561,BKNG,Booking Holdings Inc. Common Stock,1,Buy
562,ZTS,Zoetis Inc. Class A Common Stock,1,Strong Buy
563,LMT,Lockheed Martin Corporation Common Stock,1,Strong Buy
564,BX,Blackstone Inc. Common Stock,1,Strong Buy
565,SNOW,Snowflake Inc. Class A Common Stock,1,Buy
566,ANTM,Anthem Inc. Common Stock,1,Strong Buy
567,MO,Altria Group Inc.,1,Strong Buy
568,GILD,Gilead Sciences Inc. Common Stock,1,Strong Buy
569,LRCX,Lam Research Corporation Common Stock,1,Strong Buy
570,USB,U.S. Bancorp Common Stock,1,Buy
571,MDLZ,Mondelez International Inc. Class A Common Stock,1,Strong Buy
572,TJX,TJX Companies Inc. (The) Common Stock,1,Strong Buy
573,MU,Micron Technology Inc. Common Stock,1,Strong Buy
574,CCI,Crown Castle International Corp. (REIT) Common Stock,1,Strong Buy
575,HCA,HCA Healthcare Inc. Common Stock,1,Strong Buy
576,PNC,PNC Financial Services Group Inc. (The) Common Stock,1,Buy
577,MMC,Marsh & McLennan Companies Inc. Common Stock,1,Buy
578,CB,Chubb Limited  Common Stock,1,Strong Buy
579,ZM,Zoom Video Communications Inc. Class A Common Stock,1,Buy
580,COP,ConocoPhillips Common Stock,1,Strong Buy
581,SHW,Sherwin-Williams Company (The) Common Stock,1,Strong Buy
582,DUK,Duke Energy Corporation (Holding Company) Common Stock,1,Buy
583,FIS,Fidelity National Information Services Inc. Common Stock,1,Strong Buy
584,EQIX,Equinix Inc. Common Stock REIT,1,Strong Buy
585,EW,Edwards Lifesciences Corporation Common Stock,1,Strong Buy
586,GM,General Motors Company Common Stock,1,Strong Buy
587,BDX,Becton Dickinson and Company Common Stock,1,Buy
588,TFC,Truist Financial Corporation Common Stock,1,Buy
589,DELL,Dell Technologies Inc. Class C Common Stock ,1,Strong Buy
590,FISV,Fiserv Inc. Common Stock,1,Strong Buy
591,UBER,Uber Technologies Inc. Common Stock,1,Strong Buy
592,COF,Capital One Financial Corporation Common Stock,1,Strong Buy
593,MCO,Moody's Corporation Common Stock,1,Strong Buy
594,CI,Cigna Corporation Common Stock,1,Strong Buy
595,SO,Southern Company (The) Common Stock,1,Buy
596,CSX,CSX Corporation Common Stock,1,Strong Buy
597,ITW,Illinois Tool Works Inc. Common Stock,1,Buy
598,REGN,Regeneron Pharmaceuticals Inc. Common Stock,1,Strong Buy
599,FDX,FedEx Corporation Common Stock,1,Strong Buy
600,CME,CME Group Inc. Class A Common Stock,1,Buy
601,ICE,Intercontinental Exchange Inc. Common Stock,1,Strong Buy
602,DASH,DoorDash Inc. Class A Common Stock,1,Buy
603,AON,Aon plc Class A Ordinary Shares (Ireland),1,Buy
604,ILMN,Illumina Inc. Common Stock,1,Buy
605,WM,Waste Management Inc. Common Stock,1,Buy
606,ADI,Analog Devices Inc. Common Stock,1,Strong Buy
607,BSX,Boston Scientific Corporation Common Stock,1,Strong Buy
608,ECL,Ecolab Inc. Common Stock,1,Buy
609,ETN,Eaton Corporation PLC Ordinary Shares,1,Strong Buy
610,NSC,Norfolk Southern Corporation Common Stock,1,Buy
611,ADSK,Autodesk Inc. Common Stock,1,Strong Buy
612,D,Dominion Energy Inc. Common Stock,1,Strong Buy
613,ATVI,Activision Blizzard Inc. Common Stock,1,Strong Buy
614,APD,Air Products and Chemicals Inc. Common Stock,1,Strong Buy
615,EMR,Emerson Electric Company Common Stock,1,Strong Buy
616,TWLO,Twilio Inc. Class A Common Stock,1,Strong Buy
617,NOC,Northrop Grumman Corporation Common Stock,1,Strong Buy
618,NXPI,NXP Semiconductors N.V. Common Stock,1,Strong Buy
619,IDXX,IDEXX Laboratories Inc. Common Stock,1,Strong Buy
620,ALGN,Align Technology Inc. Common Stock,1,Strong Buy
621,KLAC,KLA Corporation Common Stock,1,Strong Buy
622,PSA,Public Storage Common Stock,1,Buy
623,GD,General Dynamics Corporation Common Stock,1,Strong Buy
624,PGR,Progressive Corporation (The) Common Stock,1,Buy
625,JCI,Johnson Controls International plc Ordinary Share,1,Strong Buy
626,FCX,Freeport-McMoRan Inc. Common Stock,1,Buy
627,DOCU,DocuSign Inc. Common Stock,1,Strong Buy
628,CRWD,CrowdStrike Holdings Inc. Class A Common Stock,1,Strong Buy
629,DXCM,DexCom Inc. Common Stock,1,Strong Buy
630,MSCI,MSCI Inc Common Stock,1,Buy
631,MET,MetLife Inc. Common Stock,1,Strong Buy
632,CMG,Chipotle Mexican Grill Inc. Common Stock,1,Strong Buy
633,A,Agilent Technologies Inc. Common Stock,1,Strong Buy
634,LULU,lululemon athletica inc. Common Stock,1,Strong Buy
635,INFO,IHS Markit Ltd. Common Shares,1,Strong Buy
636,F,Ford Motor Company Common Stock,1,Strong Buy
637,WDAY,Workday Inc. Class A Common Stock,1,Strong Buy
638,HUM,Humana Inc. Common Stock,1,Strong Buy
639,MRVL,Marvell Technology Inc. Common Stock,1,Strong Buy
640,SNPS,Synopsys Inc. Common Stock,1,Strong Buy
641,DG,Dollar General Corporation Common Stock,1,Strong Buy
642,MNST,Monster Beverage Corporation,1,Strong Buy
643,KDP,Keurig Dr Pepper Inc. Common Stock,1,Strong Buy
644,ROP,Roper Technologies Inc. Common Stock,1,Strong Buy
645,EXC,Exelon Corporation Common Stock,1,Strong Buy
646,IQV,IQVIA Holdings Inc. Common Stock,1,Strong Buy
647,TWTR,Twitter Inc. Common Stock,1,Buy
648,FTNT,Fortinet Inc. Common Stock,1,Buy
649,VRTX,Vertex Pharmaceuticals Incorporated Common Stock,1,Strong Buy
650,GPN,Global Payments Inc. Common Stock,1,Strong Buy
651,CARR,Carrier Global Corporation Common Stock ,1,Buy
652,EBAY,eBay Inc. Common Stock,1,Buy
653,MAR,Marriott International Class A Common Stock,1,Buy
654,PANW,Palo Alto Networks Inc. Common Stock,1,Strong Buy
655,CDNS,Cadence Design Systems Inc. Common Stock,1,Strong Buy
656,AIG,American International Group Inc. New Common Stock,1,Buy
657,NEM,Newmont Corporation,1,Strong Buy
658,LHX,L3Harris Technologies Inc. Common Stock,1,Strong Buy
659,APH,Amphenol Corporation Common Stock,1,Strong Buy
660,BK,The Bank of New York Mellon Corporation Common Stock,1,Strong Buy
661,DOW,Dow Inc. Common Stock ,1,Buy
662,BIIB,Biogen Inc. Common Stock,1,Buy
663,MCHP,Microchip Technology Incorporated Common Stock,1,Strong Buy
664,TT,Trane Technologies plc,1,Buy
665,KHC,The Kraft Heinz Company Common Stock,1,Buy
666,DLR,Digital Realty Trust Inc. Common Stock,1,Strong Buy
667,MTCH,Match Group Inc. Common Stock,1,Strong Buy
668,EOG,EOG Resources Inc. Common Stock,1,Strong Buy
669,SPOT,Spotify Technology S.A. Ordinary Shares,1,Strong Buy
670,AEP,American Electric Power Company Inc. Common Stock,1,Strong Buy
671,SRE,DBA Sempra Common Stock,1,Buy
672,WBA,Walgreens Boots Alliance Inc. Common Stock,1,Buy
673,SPG,Simon Property Group Inc. Common Stock,1,Buy
674,RMD,ResMed Inc. Common Stock,1,Buy
675,BAX,Baxter International Inc. Common Stock,1,Strong Buy
676,STZ,Constellation Brands Inc. Common Stock,1,Strong Buy
677,APTV,Aptiv PLC Ordinary Shares,1,Strong Buy
678,VEEV,Veeva Systems Inc. Class A Common Stock,1,Strong Buy
679,ORLY,O'Reilly Automotive Inc. Common Stock,1,Strong Buy
680,MSI,Motorola Solutions Inc. Common Stock,1,Strong Buy
681,CTAS,Cintas Corporation Common Stock,1,Strong Buy
682,SLB,Schlumberger N.V. Common Stock,1,Strong Buy
683,ROKU,Roku Inc. Class A Common Stock,1,Strong Buy
684,CTSH,Cognizant Technology Solutions Corporation Class A Common Stock,1,Strong Buy
685,ROST,Ross Stores Inc. Common Stock,1,Strong Buy
686,RSG,Republic Services Inc. Common Stock,1,Buy
687,PAYX,Paychex Inc. Common Stock,1,Buy
688,NET,Cloudflare Inc. Class A Common Stock,1,Strong Buy
689,TRV,The Travelers Companies Inc. Common Stock,1,Buy
690,SYY,Sysco Corporation Common Stock,1,Strong Buy
691,XLNX,Xilinx Inc. Common Stock,1,Buy
692,EA,Electronic Arts Inc. Common Stock,1,Strong Buy
693,SBAC,SBA Communications Corporation Class A Common Stock,1,Strong Buy
694,ALL,Allstate Corporation (The) Common Stock,1,Buy
695,PXD,Pioneer Natural Resources Company Common Stock,1,Strong Buy
696,OTIS,Otis Worldwide Corporation Common Stock ,1,Strong Buy
697,MPC,Marathon Petroleum Corporation Common Stock,1,Strong Buy
698,YUM,Yum! Brands Inc.,1,Buy
699,KKR,KKR & Co. Inc. Common Stock,1,Strong Buy
700,PH,Parker-Hannifin Corporation Common Stock,1,Strong Buy
701,ZS,Zscaler Inc. Common Stock,1,Strong Buy
702,OKTA,Okta Inc. Class A Common Stock,1,Strong Buy
703,U,Unity Software Inc. Common Stock,1,Strong Buy
704,DFS,Discover Financial Services Common Stock,1,Buy
705,ROK,Rockwell Automation Inc. Common Stock,1,Buy
706,WELL,Welltower Inc. Common Stock,1,Strong Buy
707,AFL,AFLAC Incorporated Common Stock,1,Buy
708,HLT,Hilton Worldwide Holdings Inc. Common Stock ,1,Buy
709,DD,DuPont de Nemours Inc. Common Stock,1,Buy
710,HSY,The Hershey Company Common Stock,1,Buy
711,IFF,Internationa Flavors & Fragrances Inc. Common Stock,1,Strong Buy
712,CNC,Centene Corporation Common Stock,1,Strong Buy
713,PPG,PPG Industries Inc. Common Stock,1,Strong Buy
714,GIS,General Mills Inc. Common Stock,1,Buy
715,EPAM,EPAM Systems Inc. Common Stock,1,Strong Buy
716,XEL,Xcel Energy Inc. Common Stock,1,Buy
717,CPRT,Copart Inc. (DE) Common Stock,1,Strong Buy
718,CSGP,CoStar Group Inc. Common Stock,1,Strong Buy
719,ADM,Archer-Daniels-Midland Company Common Stock,1,Strong Buy
720,FRC,FIRST REPUBLIC BANK Common Stock,1,Buy
721,AZO,AutoZone Inc. Common Stock,1,Strong Buy
722,TDG,Transdigm Group Incorporated Transdigm Group Inc. Common Stock,1,Strong Buy
723,SIVB,SVB Financial Group Common Stock,1,Buy
724,ODFL,Old Dominion Freight Line Inc. Common Stock,1,Buy
725,CMI,Cummins Inc. Common Stock,1,Buy
726,PINS,Pinterest Inc. Class A Common Stock,1,Buy
727,WST,West Pharmaceutical Services Inc. Common Stock,1,Strong Buy
728,DDOG,Datadog Inc. Class A Common Stock,1,Strong Buy
729,AWK,American Water Works Company Inc. Common Stock,1,Buy
730,MDB,MongoDB Inc. Class A Common Stock,1,Strong Buy
731,EFX,Equifax Inc. Common Stock,1,Buy
732,KEYS,Keysight Technologies Inc. Common Stock,1,Strong Buy
733,VRSK,Verisk Analytics Inc. Common Stock,1,Strong Buy
734,GLW,Corning Incorporated Common Stock,1,Strong Buy
735,NDAQ,Nasdaq Inc. Common Stock,1,Strong Buy
736,CBRE,CBRE Group Inc Common Stock Class A,1,Strong Buy
737,GRMN,Garmin Ltd. Common Stock (Switzerland),1,Buy
738,ANSS,ANSYS Inc. Common Stock,1,Buy
739,MCK,McKesson Corporation Common Stock,1,Strong Buy
740,HPQ,HP Inc. Common Stock,1,Buy
741,NUE,Nucor Corporation Common Stock,1,Buy
742,HUBS,HubSpot Inc. Common Stock,1,Strong Buy
743,PEG,Public Service Enterprise Group Incorporated Common Stock,1,Strong Buy
744,DHI,D.R. Horton Inc. Common Stock,1,Strong Buy
745,LYB,LyondellBasell Industries NV Ordinary Shares Class A (Netherlands),1,Buy
746,LBRDA,Liberty Broadband Corporation Class A Common Stock,1,Strong Buy
747,LBRDK,Liberty Broadband Corporation Class C Common Stock,1,Strong Buy
748,CTVA,Corteva Inc. Common Stock ,1,Strong Buy
749,AVB,AvalonBay Communities Inc. Common Stock,1,Buy
750,WMB,Williams Companies Inc. (The) Common Stock,1,Strong Buy
751,AJG,Arthur J. Gallagher & Co. Common Stock,1,Strong Buy
752,ZBRA,Zebra Technologies Corporation Class A Common Stock,1,Buy
753,FAST,Fastenal Company Common Stock,1,Buy
754,AMP,Ameriprise Financial Inc. Common Stock,1,Strong Buy
755,TTD,The Trade Desk Inc. Class A Common Stock,1,Strong Buy
756,EQR,Equity Residential Common Shares of Beneficial Interest,1,Buy
757,WLTW,Willis Towers Watson Public Limited Company Ordinary Shares,1,Buy
758,ZBH,Zimmer Biomet Holdings Inc. Common Stock,1,Strong Buy
759,BLL,Ball Corporation Common Stock,1,Buy
760,AME,AMETEK Inc.,1,Strong Buy
761,ARE,Alexandria Real Estate Equities Inc. Common Stock,1,Strong Buy
762,SWK,Stanley Black & Decker Inc. Common Stock,1,Strong Buy
763,LEN,Lennar Corporation Class A Common Stock,1,Buy
764,STT,State Street Corporation Common Stock,1,Strong Buy
765,ES,Eversource Energy (D/B/A) Common Stock,1,Buy
766,PCAR,PACCAR Inc. Common Stock,1,Buy
767,SWKS,Skyworks Solutions Inc. Common Stock,1,Strong Buy
768,LVS,Las Vegas Sands Corp. Common Stock,1,Buy
769,WEC,WEC Energy Group Inc. Common Stock,1,Buy
770,PSX,Phillips 66 Common Stock,1,Buy
771,LH,Laboratory Corporation of America Holdings Common Stock,1,Strong Buy
772,LUV,Southwest Airlines Company Common Stock,1,Strong Buy
773,PTON,Peloton Interactive Inc. Class A Common Stock,1,Strong Buy
774,PAYC,Paycom Software Inc. Common Stock,1,Strong Buy
775,LSXMA,Liberty Media Corporation Series A Liberty SiriusXM Common Stock,1,Strong Buy
776,LSXMK,Liberty Media Corporation Series C Liberty SiriusXM Common Stock,1,Strong Buy
777,FWONK,Liberty Media Corporation Series C Liberty Formula One Common Stock,1,Strong Buy
778,FWONA,Liberty Media Corporation Series A Liberty Formula One Common Stock,1,Buy
779,GNRC,Generac Holdlings Inc. Common Stock,1,Strong Buy
780,FITB,Fifth Third Bancorp Common Stock,1,Strong Buy
781,TSN,Tyson Foods Inc. Common Stock,1,Buy
782,SGEN,Seagen Inc. Common Stock,1,Buy
783,ANET,Arista Networks Inc. Common Stock,1,Strong Buy
784,ETSY,Etsy Inc. Common Stock,1,Strong Buy
785,SYF,Synchrony Financial Common Stock,1,Strong Buy
786,BILL,Bill.com Holdings Inc. Common Stock,1,Strong Buy
787,ALB,Albemarle Corporation Common Stock,1,Buy
788,VLO,Valero Energy Corporation Common Stock,1,Strong Buy
789,VFC,V.F. Corporation Common Stock,1,Strong Buy
790,BBY,Best Buy Co. Inc. Common Stock,1,Buy
791,CDW,CDW Corporation Common Stock,1,Buy
792,FTV,Fortive Corporation Common Stock ,1,Buy
793,O,Realty Income Corporation Common Stock,1,Strong Buy
794,IT,Gartner Inc. Common Stock,1,Buy
795,WY,Weyerhaeuser Company Common Stock,1,Strong Buy
796,VIAC,ViacomCBS Inc. Class B Common Stock,1,Buy
797,ABC,AmerisourceBergen Corporation Common Stock,1,Buy
798,OXY,Occidental Petroleum Corporation Common Stock,1,Buy
799,BKR,Baker Hughes Company Class A Common Stock,1,Strong Buy
800,KSU,Kansas City Southern Common Stock,1,Buy
801,CCL,Carnival Corporation Common Stock,1,Buy
802,DAL,Delta Air Lines Inc. Common Stock,1,Strong Buy
803,WAT,Waters Corporation Common Stock,1,Buy
804,VRSN,VeriSign Inc. Common Stock,1,Strong Buy
805,AVTR,Avantor Inc. Common Stock,1,Strong Buy
806,OKE,ONEOK Inc. Common Stock,1,Strong Buy
807,URI,United Rentals Inc. Common Stock,1,Buy
808,EXR,Extra Space Storage Inc Common Stock,1,Strong Buy
809,SPLK,Splunk Inc. Common Stock,1,Strong Buy
810,SIRI,Sirius XM Holdings Inc. Common Stock,1,Strong Buy
811,HIG,Hartford Financial Services Group Inc. (The) Common Stock,1,Strong Buy
812,PCG,Pacific Gas & Electric Co. Common Stock,1,Buy
813,YUMC,Yum China Holdings Inc. Common Stock,1,Buy
814,XYL,Xylem Inc. Common Stock New,1,Buy
815,DOV,Dover Corporation Common Stock,1,Buy
816,DKNG,DraftKings Inc. Class A Common Stock,1,Strong Buy
817,HZNP,Horizon Therapeutics Public Limited Company Ordinary Shares,1,Strong Buy
818,COO,The Cooper Companies Inc. Common Stock,1,Strong Buy
819,CTLT,Catalent Inc. Common Stock,1,Strong Buy
820,BIO,Bio-Rad Laboratories Inc. Class A Common Stock,1,Strong Buy
821,TSCO,Tractor Supply Company Common Stock,1,Strong Buy
822,INVH,Invitation Homes Inc. Common Stock,1,Strong Buy
823,VMC,Vulcan Materials Company (Holding Company) Common Stock,1,Buy
824,TRMB,Trimble Inc. Common Stock,1,Buy
825,IR,Ingersoll Rand Inc. Common Stock,1,Strong Buy
826,NTRS,Northern Trust Corporation Common Stock,1,Buy
827,CZR,Caesars Entertainment Inc. Common Stock,1,Strong Buy
828,SUI,Sun Communities Inc. Common Stock,1,Strong Buy
829,MPWR,Monolithic Power Systems Inc. Common Stock,1,Strong Buy
830,ETR,Entergy Corporation Common Stock,1,Strong Buy
831,PPL,PPL Corporation Common Stock,1,Buy
832,DTE,DTE Energy Company Common Stock,1,Buy
833,IP,International Paper Company Common Stock,1,Buy
834,DISH,DISH Network Corporation Class A Common Stock,1,Buy
835,ZG,Zillow Group Inc. Class A Common Stock,1,Strong Buy
836,TRU,TransUnion Common Stock,1,Strong Buy
837,MLM,Martin Marietta Materials Inc. Common Stock,1,Buy
838,HES,Hess Corporation Common Stock,1,Strong Buy
839,EIX,Edison International Common Stock,1,Buy
840,KMX,CarMax Inc,1,Strong Buy
841,ALNY,Alnylam Pharmaceuticals Inc. Common Stock,1,Strong Buy
842,HBAN,Huntington Bancshares Incorporated Common Stock,1,Strong Buy
843,CRL,Charles River Laboratories International Inc. Common Stock,1,Strong Buy
844,EXPE,Expedia Group Inc. Common Stock,1,Buy
845,MAA,Mid-America Apartment Communities Inc. Common Stock,1,Buy
846,AEE,Ameren Corporation Common Stock,1,Buy
847,CERN,Cerner Corporation Common Stock,1,Strong Buy
848,K,Kellogg Company Common Stock,1,Buy
849,VTR,Ventas Inc. Common Stock,1,Buy
850,UPST,Upstart Holdings Inc. Common stock,1,Strong Buy
851,FLT,FleetCor Technologies Inc. Common Stock,1,Strong Buy
852,GWW,W.W. Grainger Inc. Common Stock,1,Buy
853,STE,STERIS plc (Ireland) Ordinary Shares,1,Strong Buy
854,W,Wayfair Inc. Class A Common Stock,1,Buy
855,TDOC,Teladoc Health Inc. Common Stock,1,Buy
856,ESS,Essex Property Trust Inc. Common Stock,1,Buy
857,RCL,D/B/A Royal Caribbean Cruises Ltd. Common Stock,1,Buy
858,ON,ON Semiconductor Corporation Common Stock,1,Strong Buy
859,PKI,PerkinElmer Inc. Common Stock,1,Buy
860,ENPH,Enphase Energy Inc. Common Stock,1,Strong Buy
861,NTAP,NetApp Inc. Common Stock,1,Strong Buy
862,TECH,Bio-Techne Corp Common Stock,1,Strong Buy
863,FE,FirstEnergy Corp. Common Stock,1,Buy
864,CHD,Church & Dwight Company Inc. Common Stock,1,Buy
865,DVN,Devon Energy Corporation Common Stock,1,Strong Buy
866,ULTA,Ulta Beauty Inc. Common Stock,1,Strong Buy
867,FOX,Fox Corporation Class B Common Stock,1,Strong Buy
868,FOXA,Fox Corporation Class A Common Stock,1,Strong Buy
869,TER,Teradyne Inc. Common Stock,1,Strong Buy
870,DT,Dynatrace Inc. Common Stock,1,Strong Buy
871,TDY,Teledyne Technologies Incorporated Common Stock,1,Strong Buy
872,KEY,KeyCorp Common Stock,1,Buy
873,PODD,Insulet Corporation Common Stock,1,Buy
874,QRVO,Qorvo Inc. Common Stock,1,Strong Buy
875,DLTR,Dollar Tree Inc. Common Stock,1,Buy
876,BR,Broadridge Financial Solutions Inc.Common Stock,1,Buy
877,HOLX,Hologic Inc. Common Stock,1,Strong Buy
878,UI,Ubiquiti Inc. Common Stock,1,Buy
879,MGM,MGM Resorts International Common Stock,1,Buy
880,DRI,Darden Restaurants Inc. Common Stock,1,Strong Buy
881,BSY,Bentley Systems Incorporated Class B Common Stock,1,Strong Buy
882,BURL,Burlington Stores Inc. Common Stock,1,Strong Buy
883,DRE,Duke Realty Corporation Common Stock,1,Strong Buy
884,POOL,Pool Corporation Common Stock,1,Strong Buy
885,AMCR,Amcor plc Ordinary Shares,1,Buy
886,TYL,Tyler Technologies Inc. Common Stock,1,Strong Buy
887,DGX,Quest Diagnostics Incorporated Common Stock,1,Strong Buy
888,PEAK,Healthpeak Properties Inc. Common Stock,1,Buy
889,LYV,Live Nation Entertainment Inc. Common Stock,1,Buy
890,ALLY,Ally Financial Inc. Common Stock,1,Strong Buy
891,RF,Regions Financial Corporation Common Stock,1,Buy
892,CINF,Cincinnati Financial Corporation Common Stock,1,Buy
893,RJF,Raymond James Financial Inc. Common Stock,1,Strong Buy
894,CFG,Citizens Financial Group Inc. Common Stock,1,Strong Buy
895,DPZ,Domino's Pizza Inc Common Stock,1,Buy
896,HAL,Halliburton Company Common Stock,1,Strong Buy
897,AVY,Avery Dennison Corporation Common Stock,1,Buy
898,ROL,Rollins Inc. Common Stock,1,Buy
899,AKAM,Akamai Technologies Inc. Common Stock,1,Strong Buy
