,Symbol,Company,Buy,Analyst
1358,TRIP,TripAdvisor Inc. Common Stock,1,Buy
1359,FEYE,FireEye Inc. Common Stock,1,Buy
1360,R,Ryder System Inc. Common Stock,1,Buy
1361,CRI,Carter's Inc. Common Stock,1,Strong Buy
1362,STL,Sterling Bancorp,1,Strong Buy
1363,UMPQ,Umpqua Holdings Corporation Common Stock,1,Strong Buy
1364,LESL,Leslie's Inc. Common Stock,1,Strong Buy
1365,WTFC,Wintrust Financial Corporation Common Stock,1,Strong Buy
1366,QRTEA,Qurate Retail Inc. Series A Common Stock ,1,Buy
1367,KMPR,Kemper Corporation,1,Buy
1368,SPR,Spirit Aerosystems Holdings Inc. Common Stock,1,Strong Buy
1369,AYX,Alteryx Inc. Class A Common Stock,1,Buy
1370,SKLZ,Skillz Inc. Class A Common Stock,1,Buy
1371,SPB,Spectrum Brands Holdings Inc. Common Stock,1,Strong Buy
1372,HPP,Hudson Pacific Properties Inc. Common Stock,1,Buy
1373,AXS,Axis Capital Holdings Limited Common Stock,1,Buy
1374,LOPE,Grand Canyon Education Inc. Common Stock,1,Strong Buy
1375,UNVR,Univar Solutions Inc. Common Stock,1,Strong Buy
1376,JBGS,JBG SMITH Properties Common Shares ,1,Buy
1377,MSP,Datto Holding Corp. Common Stock,1,Buy
1378,FTDR,Frontdoor Inc. Common Stock,1,Strong Buy
1379,ALSN,Allison Transmission Holdings Inc. Common Stock,1,Buy
1380,SGFY,Signify Health Inc. Class A Common Stock,1,Strong Buy
1381,AVT,Avnet Inc. Common Stock,1,Buy
1382,HAIN,Hain Celestial Group Inc. (The) Common Stock,1,Strong Buy
1383,MSM,MSC Industrial Direct Company Inc. Common Stock,1,Buy
1384,IOVA,Iovance Biotherapeutics Inc. Common Stock,1,Strong Buy
1385,EPR,EPR Properties Common Stock,1,Buy
1386,FOUR,Shift4 Payments Inc. Class A Common Stock,1,Buy
1387,SIX,Six Flags Entertainment Corporation New Common Stock,1,Strong Buy
1388,SWCH,Switch Inc. Class A Common Stock,1,Strong Buy
1389,MCFE,McAfee Corp. Class A Common Stock,1,Buy
1390,VSAT,ViaSat Inc. Common Stock,1,Strong Buy
1391,MSGS,Madison Square Garden Sports Corp. Class A Common Stock (New),1,Strong Buy
1392,FNB,F.N.B. Corporation Common Stock,1,Strong Buy
1393,VRM,Vroom Inc. Common Stock,1,Strong Buy
1394,SHLS,Shoals Technologies Group Inc. Class A Common Stock,1,Strong Buy
1395,KEX,Kirby Corporation Common Stock,1,Buy
1396,COMM,CommScope Holding Company Inc. Common Stock,1,Strong Buy
1397,NKTR,Nektar Therapeutics  Common Stock,1,Buy
1398,VIRT,Virtu Financial Inc. Class A Common Stock,1,Strong Buy
1399,SWI,SolarWinds Corporation Common Stock,1,Buy
1400,SAGE,Sage Therapeutics Inc. Common Stock,1,Buy
1401,MRCY,Mercury Systems Inc Common Stock,1,Buy
1402,WWE,World Wrestling Entertainment Inc. Class A Common Stock,1,Strong Buy
1403,CPA,Copa Holdings S.A. Copa Holdings S.A. Class A Common Stock,1,Buy
1404,NABL,N-able Inc. Common Stock,1,Strong Buy
1405,GO,Grocery Outlet Holding Corp. Common Stock,1,Buy
1406,SNDR,Schneider National Inc. Common Stock,1,Buy
1407,PSFE,Paysafe Limited Common Shares,1,Strong Buy
1408,UWMC,UWM Holdings Corporation Class A Common Stock,1,Strong Buy
1409,GOCO,GoHealth Inc. Class A Common Stock,1,Strong Buy
1410,ARD,Ardagh Group S.A. Common Shares,1,Strong Buy
