,Symbol,Company,Buy,Analyst
900,SSNC,SS&C Technologies Holdings Inc. Common Stock,1,Buy
901,CMS,CMS Energy Corporation Common Stock,1,Strong Buy
902,TFX,Teleflex Incorporated Common Stock,1,Strong Buy
903,VICI,VICI Properties Inc. Common Stock,1,Strong Buy
904,JBHT,J.B. Hunt Transport Services Inc. Common Stock,1,Buy
905,EXAS,Exact Sciences Corporation Common Stock,1,Strong Buy
906,WDC,Western Digital Corporation Common Stock,1,Strong Buy
907,HPE,Hewlett Packard Enterprise Company Common Stock,1,Strong Buy
908,CG,The Carlyle Group Inc. Common Stock,1,Strong Buy
909,COUP,Coupa Software Incorporated Common Stock,1,Buy
910,RNG,RingCentral Inc. Class A Common Stock,1,Strong Buy
911,TTWO,Take-Two Interactive Software Inc. Common Stock,1,Strong Buy
912,GPC,Genuine Parts Company Common Stock,1,Buy
913,ENTG,Entegris Inc. Common Stock,1,Buy
914,PFG,Principal Financial Group Inc Common Stock,1,Buy
915,J,Jacobs Engineering Group Inc. Common Stock,1,Strong Buy
916,MTB,M&T Bank Corporation Common Stock,1,Buy
917,NVR,NVR Inc. Common Stock,1,Buy
918,NUAN,Nuance Communications Inc. Common Stock,1,Buy
919,BXP,Boston Properties Inc. Common Stock,1,Buy
920,NVAX,Novavax Inc. Common Stock,1,Strong Buy
921,BBWI,Bath & Body Works Inc.,1,Strong Buy
922,WAB,Westinghouse Air Brake Technologies Corporation Common Stock,1,Strong Buy
923,CE,Celanese Corporation Celanese Corporation Common Stock,1,Strong Buy
924,MKL,Markel Corporation Common Stock,1,Strong Buy
925,IEX,IDEX Corporation Common Stock,1,Strong Buy
926,LYFT,Lyft Inc. Class A Common Stock,1,Strong Buy
927,VTRS,Viatris Inc. Common Stock,1,Buy
928,PWR,Quanta Services Inc. Common Stock,1,Strong Buy
929,PPD,PPD Inc. Common Stock,1,Buy
930,RGEN,Repligen Corporation Common Stock,1,Strong Buy
931,INCY,Incyte Corp. Common Stock,1,Buy
932,RPRX,Royalty Pharma plc Class A Ordinary Shares ,1,Strong Buy
933,HEI,Heico Corporation Common Stock,1,Buy
934,BRO,Brown & Brown Inc. Common Stock,1,Buy
935,MKTX,MarketAxess Holdings Inc. Common Stock,1,Buy
936,CDAY,Ceridian HCM Holding Inc. Common Stock,1,Buy
937,ABMD,ABIOMED Inc. Common Stock,1,Strong Buy
938,AES,The AES Corporation Common Stock,1,Strong Buy
939,CAG,ConAgra Brands Inc. Common Stock,1,Buy
940,UDR,UDR Inc. Common Stock,1,Strong Buy
941,CGNX,Cognex Corporation Common Stock,1,Buy
942,OMC,Omnicom Group Inc. Common Stock,1,Buy
943,AVLR,Avalara Inc. Common Stock,1,Strong Buy
944,VMW,Vmware Inc. Common stock Class A,1,Buy
945,TXT,Textron Inc. Common Stock,1,Strong Buy
946,CLR,Continental Resources Inc. Common Stock,1,Buy
947,ACGL,Arch Capital Group Ltd. Common Stock,1,Buy
948,MOH,Molina Healthcare Inc Common Stock,1,Strong Buy
949,CLVT,Clarivate Plc Ordinary Shares,1,Strong Buy
950,LKQ,LKQ Corporation Common Stock,1,Strong Buy
951,CVNA,Carvana Co. Class A Common Stock,1,Strong Buy
952,ELAN,Elanco Animal Health Incorporated Common Stock,1,Buy
953,NLOK,NortonLifeLock Inc. Common Stock,1,Strong Buy
954,CPT,Camden Property Trust Common Stock,1,Strong Buy
955,ELS,Equity Lifestyle Properties Inc. Common Stock,1,Strong Buy
956,CAH,Cardinal Health Inc. Common Stock,1,Buy
957,MASI,Masimo Corporation Common Stock,1,Strong Buy
958,PCTY,Paylocity Holding Corporation Common Stock,1,Strong Buy
959,CNP,CenterPoint Energy Inc (Holding Co) Common Stock,1,Buy
960,EVRG,Evergy Inc. Common Stock,1,Buy
961,LNT,Alliant Energy Corporation Common Stock,1,Buy
962,IPG,Interpublic Group of Companies Inc. (The) Common Stock,1,Buy
963,FANG,Diamondback Energy Inc. Commmon Stock,1,Strong Buy
964,PTC,PTC Inc. Common Stock,1,Strong Buy
965,ESTC,Elastic N.V. Ordinary Shares,1,Strong Buy
966,CCK,Crown Holdings Inc.,1,Strong Buy
967,RH,RH Common Stock,1,Strong Buy
968,ZEN,Zendesk Inc. Common Stock,1,Strong Buy
969,MAS,Masco Corporation Common Stock,1,Buy
970,EMN,Eastman Chemical Company Common Stock,1,Strong Buy
971,ACI,Albertsons Companies Inc. Class A Common Stock,1,Buy
972,UAL,United Airlines Holdings Inc. Common Stock,1,Buy
973,BMRN,BioMarin Pharmaceutical Inc. Common Stock,1,Strong Buy
974,NDSN,Nordson Corporation Common Stock,1,Buy
975,TXG,10x Genomics Inc. Class A Common Stock,1,Strong Buy
976,PLUG,Plug Power Inc. Common Stock,1,Buy
977,WPC,W. P. Carey Inc. REIT,1,Strong Buy
978,CTXS,Citrix Systems Inc. Common Stock,1,Buy
979,HWM,Howmet Aerospace Inc. Common Stock,1,Strong Buy
980,WSM,Williams-Sonoma Inc. Common Stock (DE),1,Buy
981,WHR,Whirlpool Corporation Common Stock,1,Buy
982,XRAY,DENTSPLY SIRONA Inc. Common Stock,1,Strong Buy
983,WRK,Westrock Company Common Stock,1,Strong Buy
984,FND,Floor & Decor Holdings Inc. Common Stock,1,Strong Buy
985,HAS,Hasbro Inc. Common Stock,1,Strong Buy
986,ATH,Athene Holding Ltd. Class A Common Shares,1,Buy
987,KIM,Kimco Realty Corporation Common Stock,1,Strong Buy
988,LDOS,Leidos Holdings Inc. Common Stock,1,Strong Buy
989,DISCA,Discovery Inc. Series A Common Stock,1,Buy
990,STLD,Steel Dynamics Inc.,1,Strong Buy
991,FBHS,Fortune Brands Home & Security Inc. Common Stock,1,Strong Buy
992,NVCR,NovoCure Limited Ordinary Shares,1,Buy
993,FNF,FNF Group of Fidelity National Financial Inc. Common Stock,1,Strong Buy
994,AMH,American Homes 4 Rent Common Shares of Beneficial Interest,1,Strong Buy
995,IRM,Iron Mountain Incorporated (Delaware)Common Stock REIT,1,Buy
996,GLOB,Globant S.A. Common Shares,1,Strong Buy
997,GGG,Graco Inc. Common Stock,1,Buy
998,MHK,Mohawk Industries Inc. Common Stock,1,Buy
999,AAP,Advance Auto Parts Inc Advance Auto Parts Inc W/I,1,Buy
1000,PNR,Pentair plc. Ordinary Share,1,Buy
1001,NWSA,News Corporation Class A Common Stock,1,Strong Buy
1002,BRKR,Bruker Corporation Common Stock,1,Buy
1003,GH,Guardant Health Inc. Common Stock,1,Strong Buy
1004,MOS,Mosaic Company (The) Common Stock,1,Strong Buy
1005,DVA,DaVita Inc. Common Stock,1,Buy
1006,WRB,W.R. Berkley Corporation Common Stock,1,Buy
1007,ARES,Ares Management Corporation Class A Common Stock,1,Strong Buy
1008,SC,Santander Consumer USA Holdings Inc. Common Stock,1,Buy
1009,FICO,Fair Isaac Corproation Common Stock,1,Strong Buy
1010,FMC,FMC Corporation Common Stock,1,Strong Buy
1011,JKHY,Jack Henry & Associates Inc. Common Stock,1,Buy
1012,FFIV,F5 Networks Inc. Common Stock,1,Strong Buy
1013,AAL,American Airlines Group Inc. Common Stock,1,Buy
1014,GDDY,GoDaddy Inc. Class A Common Stock,1,Strong Buy
1015,LNC,Lincoln National Corporation Common Stock,1,Buy
1016,DAR,Darling Ingredients Inc. Common Stock,1,Strong Buy
1017,OSH,Oak Street Health Inc. Common Stock,1,Strong Buy
1018,NLY,Annaly Capital Management Inc Common Stock,1,Strong Buy
1019,ALLE,Allegion plc Ordinary Shares,1,Buy
1020,TREX,Trex Company Inc. Common Stock,1,Buy
1021,UHS,Universal Health Services Inc. Common Stock,1,Buy
1022,PHM,PulteGroup Inc. Common Stock,1,Strong Buy
1023,JLL,Jones Lang LaSalle Incorporated Common Stock,1,Buy
1024,QGEN,Qiagen N.V. Common Shares ,1,Buy
1025,EQH,Equitable Holdings Inc. Common Stock,1,Strong Buy
1026,AGL,agilon health inc. Common Stock,1,Strong Buy
1027,MPW,Medical Properties Trust Inc. common stock,1,Strong Buy
1028,DECK,Deckers Outdoor Corporation Common Stock,1,Strong Buy
1029,PENN,Penn National Gaming Inc. Common Stock,1,Buy
1030,CABO,Cable One Inc. Common Stock,1,Buy
1031,CHRW,C.H. Robinson Worldwide Inc. Common Stock,1,Buy
1032,WIX,Wix.com Ltd. Ordinary Shares,1,Strong Buy
1033,ATUS,Altice USA Inc. Class A Common Stock,1,Buy
1034,SNA,Snap-On Incorporated Common Stock,1,Buy
1035,HST,Host Hotels & Resorts Inc. Common Stock,1,Buy
1036,IVZ,Invesco Ltd Common Stock,1,Buy
1037,MTN,Vail Resorts Inc. Common Stock,1,Buy
1038,ATO,Atmos Energy Corporation Common Stock,1,Strong Buy
1039,LPLA,LPL Financial Holdings Inc. Common Stock,1,Strong Buy
1040,AXON,Axon Enterprise Inc. Common Stock,1,Strong Buy
1041,REG,Regency Centers Corporation Common Stock,1,Buy
1042,BKI,Black Knight Inc. Common Stock ,1,Strong Buy
1043,WTRG,Essential Utilities Inc. Common Stock,1,Strong Buy
1044,RHI,Robert Half International Inc. Common Stock,1,Buy
1045,PLTK,Playtika Holding Corp. Common Stock,1,Strong Buy
1046,CLF,Cleveland-Cliffs Inc. Common Stock,1,Buy
1047,BG,Bunge Limited Bunge Limited,1,Buy
1048,GLPI,Gaming and Leisure Properties Inc. Common Stock,1,Strong Buy
1049,WLK,Westlake Chemical Corporation Common Stock,1,Strong Buy
1050,NTRA,Natera Inc. Common Stock,1,Strong Buy
1051,AFG,American Financial Group Inc. Common Stock,1,Buy
1052,IAC,IAC/InterActiveCorp Common Stock,1,Strong Buy
1053,TPR,Tapestry Inc. Common Stock,1,Strong Buy
1054,FIVN,Five9 Inc. Common Stock,1,Buy
1055,FSLR,First Solar Inc. Common Stock,1,Buy
1056,AOS,A.O. Smith Corporation Common Stock,1,Buy
1057,BLDR,Builders FirstSource Inc. Common Stock,1,Strong Buy
1058,HSIC,Henry Schein Inc. Common Stock,1,Buy
1059,BAH,Booz Allen Hamilton Holding Corporation Common Stock,1,Strong Buy
1060,WSO,Watsco Inc. Common Stock,1,Buy
1061,STNE,StoneCo Ltd. Class A Common Shares,1,Buy
1062,NRG,NRG Energy Inc. Common Stock,1,Strong Buy
1063,PEGA,Pegasystems Inc. Common Stock,1,Strong Buy
1064,NWL,Newell Brands Inc. Common Stock,1,Buy
1065,CHGG,Chegg Inc. Common Stock,1,Strong Buy
1066,TRGP,Targa Resources Inc. Common Stock,1,Strong Buy
1067,CUBE,CubeSmart Common Shares,1,Buy
1068,PEN,Penumbra Inc. Common Stock,1,Strong Buy
1069,BWA,BorgWarner Inc. Common Stock,1,Strong Buy
1070,EWBC,East West Bancorp Inc. Common Stock,1,Strong Buy
1071,CF,CF Industries Holdings Inc. Common Stock,1,Strong Buy
1072,HUBB,Hubbell Inc Common Stock,1,Strong Buy
1073,WAL,Western Alliance Bancorporation Common Stock (DE),1,Strong Buy
1074,SCI,Service Corporation International Common Stock,1,Strong Buy
1075,MANH,Manhattan Associates Inc. Common Stock,1,Strong Buy
1076,FIVE,Five Below Inc. Common Stock,1,Strong Buy
1077,DOX,Amdocs Limited Ordinary Shares,1,Strong Buy
1078,OPEN,Opendoor Technologies Inc Common Stock,1,Strong Buy
1079,RPM,RPM International Inc. Common Stock,1,Buy
1080,CSL,Carlisle Companies Incorporated Common Stock,1,Strong Buy
1081,TAP,Molson Coors Beverage Company Class B Common Stock,1,Buy
1082,RE,Everest Re Group Ltd. Common Stock,1,Strong Buy
1083,CREE,Cree Inc. Common Stock,1,Buy
1084,WYNN,Wynn Resorts Limited Common stock,1,Buy
1085,GWRE,Guidewire Software Inc. Common Stock,1,Buy
1086,MRO,Marathon Oil Corporation Common Stock,1,Strong Buy
1087,HRC,Hill-Rom Holdings Inc Common Stock,1,Buy
1088,AGCO,AGCO Corporation Common Stock,1,Strong Buy
1089,CMA,Comerica Incorporated Common Stock,1,Buy
1090,LAD,Lithia Motors Inc. Common Stock,1,Strong Buy
1091,OC,Owens Corning Inc Common Stock New,1,Buy
1092,LSI,Life Storage Inc. Common Stock,1,Strong Buy
1093,DBX,Dropbox Inc. Class A Common Stock,1,Strong Buy
1094,TPL,Texas Pacific Land Corporation Common Stock,1,Buy
1095,MIDD,Middleby Corporation (The) Common Stock,1,Strong Buy
1096,SYNH,Syneos Health Inc. Class A Common Stock,1,Strong Buy
1097,AA,Alcoa Corporation Common Stock ,1,Strong Buy
1098,AIZ,Assurant Inc. Common Stock,1,Strong Buy
1099,LAMR,Lamar Advertising Company Class A Common Stock,1,Buy
1100,LEA,Lear Corporation Common Stock,1,Strong Buy
1101,ACM,AECOM Common Stock,1,Strong Buy
1102,RS,Reliance Steel & Aluminum Co. Common Stock (DE),1,Strong Buy
1103,PLAN,Anaplan Inc. Common Stock,1,Strong Buy
1104,XPO,XPO Logistics Inc.,1,Strong Buy
1105,CONE,CyrusOne Inc Common Stock,1,Strong Buy
1106,NI,NiSource Inc Common Stock,1,Strong Buy
1107,G,Genpact Limited Common Stock,1,Strong Buy
1108,ZION,Zions Bancorporation N.A. Common Stock,1,Buy
1109,TPX,Tempur Sealy International Inc. Common Stock,1,Strong Buy
1110,GL,Globe Life Inc. Common Stock,1,Buy
1111,FRT,Federal Realty Investment Trust Common Stock,1,Buy
1112,STOR,STORE Capital Corporation Common Stock,1,Buy
1113,OLED,Universal Display Corporation Common Stock,1,Strong Buy
1114,COLD,Americold Realty Trust Common Shares,1,Buy
1115,IPGP,IPG Photonics Corporation Common Stock,1,Strong Buy
1116,UTHR,United Therapeutics Corporation Common Stock,1,Strong Buy
1117,SMAR,Smartsheet Inc. Class A Common Stock,1,Strong Buy
1118,JBL,Jabil Inc. Common Stock,1,Strong Buy
1119,UGI,UGI Corporation Common Stock,1,Strong Buy
1120,UAA,Under Armour Inc. Class A Common Stock,1,Buy
1121,JNPR,Juniper Networks Inc. Common Stock,1,Buy
1122,GXO,GXO Logistics Inc. Common Stock ,1,Strong Buy
1123,NBIX,Neurocrine Biosciences Inc. Common Stock,1,Strong Buy
1124,ST,Sensata Technologies Holding plc Ordinary Shares,1,Strong Buy
1125,JEF,Jefferies Financial Group Inc. Common Stock,1,Strong Buy
1126,DXC,DXC Technology Company Common Stock ,1,Strong Buy
1127,CNXC,Concentrix Corporation Common Stock,1,Strong Buy
1128,TW,Tradeweb Markets Inc. Class A Common Stock,1,Buy
1129,GPS,Gap Inc. (The) Common Stock,1,Buy
1130,SITE,SiteOne Landscape Supply Inc. Common Stock,1,Buy
1131,YETI,YETI Holdings Inc. Common Stock,1,Strong Buy
1132,LW,Lamb Weston Holdings Inc. Common Stock ,1,Strong Buy
1133,RUN,Sunrun Inc. Common Stock,1,Strong Buy
1134,ZNGA,Zynga Inc. Class A Common Stock,1,Strong Buy
1135,KNX,Knight-Swift Transportation Holdings Inc.,1,Strong Buy
1136,NTNX,Nutanix Inc. Class A Common Stock,1,Strong Buy
1137,SEE,Sealed Air Corporation Common Stock,1,Strong Buy
1138,Y,Alleghany Corporation Common Stock,1,Strong Buy
1139,MRTX,Mirati Therapeutics Inc. Common Stock,1,Buy
1140,DKS,Dick's Sporting Goods Inc Common Stock,1,Strong Buy
1141,AZPN,Aspen Technology Inc. Common Stock,1,Buy
1142,BERY,Berry Global Group Inc. Common Stock,1,Strong Buy
1143,VST,Vistra Corp. Common Stock,1,Strong Buy
1144,OGN,Organon & Co. Common Stock ,1,Strong Buy
1145,FHN,First Horizon Corporation Common Stock,1,Strong Buy
1146,BFAM,Bright Horizons Family Solutions Inc. Common Stock,1,Buy
1147,CHDN,Churchill Downs Incorporated Common Stock,1,Strong Buy
1148,WU,Western Union Company (The) Common Stock,1,Buy
1149,SEIC,SEI Investments Company Common Stock,1,Buy
1150,MKSI,MKS Instruments Inc. Common Stock,1,Strong Buy
1151,AGNC,AGNC Investment Corp. Common Stock,1,Strong Buy
1152,ERIE,Erie Indemnity Company Class A Common Stock,1,Buy
1153,REXR,Rexford Industrial Realty Inc. Common Stock,1,Strong Buy
1154,VRT,Vertiv Holdings LLC Class A Common Stock,1,Strong Buy
1155,NYT,New York Times Company (The) Common Stock,1,Strong Buy
1156,CIEN,Ciena Corporation Common Stock,1,Buy
1157,XEC,Cimarex Energy Co Common Stock,1,Strong Buy
1158,ATR,AptarGroup Inc. Common Stock,1,Buy
1159,ARMK,Aramark Common Stock,1,Buy
1160,RL,Ralph Lauren Corporation Common Stock,1,Buy
1161,GMED,Globus Medical Inc. Class A Common Stock,1,Buy
1162,JAZZ,Jazz Pharmaceuticals plc Common Stock (Ireland),1,Strong Buy
1163,XLRN,Acceleron Pharma Inc. Common Stock,1,Strong Buy
1164,SMG,Scotts Miracle-Gro Company (The) Common Stock,1,Strong Buy
1165,HII,Huntington Ingalls Industries Inc. Common Stock,1,Buy
1166,COG,Cabot Oil & Gas Corporation Common Stock,1,Buy
1167,LECO,Lincoln Electric Holdings Inc. Common Shares,1,Buy
1168,OLN,Olin Corporation Common Stock,1,Strong Buy
1169,NNN,National Retail Properties Common Stock,1,Strong Buy
1170,AN,AutoNation Inc. Common Stock,1,Buy
1171,KSS,Kohl's Corporation Common Stock,1,Buy
1172,CPRI,Capri Holdings Limited Ordinary Shares,1,Strong Buy
1173,AIRC,Apartment Income REIT Corp. Common Stock,1,Buy
1174,ITT,ITT Inc. Common Stock ,1,Strong Buy
1175,PVH,PVH Corp. Common Stock,1,Buy
1176,APA,APA Corporation Common Stock,1,Strong Buy
1177,WWD,Woodward Inc. Common Stock,1,Buy
1178,EQT,EQT Corporation Common Stock,1,Strong Buy
1179,TNDM,Tandem Diabetes Care Inc. Common Stock,1,Buy
1180,SBNY,Signature Bank Common Stock,1,Strong Buy
1181,RGA,Reinsurance Group of America Incorporated Common Stock,1,Buy
1182,OHI,Omega Healthcare Investors Inc. Common Stock,1,Buy
1183,WEX,WEX Inc. common stock,1,Buy
1184,GNTX,Gentex Corporation Common Stock,1,Strong Buy
1185,EHC,Encompass Health Corporation Common Stock,1,Strong Buy
1186,KRC,Kilroy Realty Corporation Common Stock,1,Buy
1187,PSTG,Pure Storage Inc. Class A Common Stock,1,Strong Buy
1188,DCI,Donaldson Company Inc. Common Stock,1,Buy
1189,BC,Brunswick Corporation Common Stock,1,Strong Buy
1190,OSK,Oshkosh Corporation (Holding Company)Common Stock,1,Strong Buy
1191,CHE,Chemed Corp,1,Strong Buy
1192,FAF,First American Corporation (New) Common Stock,1,Strong Buy
1193,DNB,Dun & Bradstreet Holdings Inc. Common Stock,1,Strong Buy
1194,WMS,Advanced Drainage Systems Inc. Common Stock,1,Buy
1195,OMF,OneMain Holdings Inc. Common Stock,1,Strong Buy
1196,TSP,TuSimple Holdings Inc. Class A Common Stock,1,Strong Buy
1197,PII,Polaris Inc. Common Stock,1,Buy
1198,USFD,US Foods Holding Corp. Common Stock,1,Strong Buy
1199,PAG,Penske Automotive Group Inc. Common Stock,1,Strong Buy
1200,TOL,Toll Brothers Inc. Common Stock,1,Buy
1201,NCNO,nCino Inc. Common Stock,1,Strong Buy
1202,BLD,TopBuild Corp. Common Stock,1,Strong Buy
1203,FCNCA,First Citizens BancShares Inc. Class A Common Stock,1,Strong Buy
1204,NLSN,Nielsen N.V. Ordinary Shares,1,Buy
1205,IAA,IAA Inc. Common Stock ,1,Strong Buy
1206,RGLD,Royal Gold Inc. Common Stock,1,Buy
1207,MAT,Mattel Inc. Common Stock,1,Strong Buy
1208,BEPC,Brookfield Renewable Corporation Class A Subordinate Voting Shares ,1,Buy
1209,ORI,Old Republic International Corporation Common Stock,1,Buy
1210,STWD,STARWOOD PROPERTY TRUST INC. Starwood Property Trust Inc.,1,Strong Buy
1211,VOYA,Voya Financial Inc. Common Stock,1,Buy
1212,CASY,Casey's General Stores Inc. Common Stock,1,Buy
1213,ALK,Alaska Air Group Inc. Common Stock,1,Strong Buy
1214,SHC,Sotera Health Company Common Stock,1,Strong Buy
1215,NVST,Envista Holdings Corporation Common Stock,1,Strong Buy
1216,BYND,Beyond Meat Inc. Common Stock,1,Buy
1217,FR,First Industrial Realty Trust Inc. Common Stock,1,Strong Buy
1218,PNFP,Pinnacle Financial Partners Inc. Common Stock,1,Strong Buy
1219,SF,Stifel Financial Corporation Common Stock,1,Buy
1220,BRX,Brixmor Property Group Inc. Common Stock,1,Buy
1221,OGE,OGE Energy Corp Common Stock,1,Buy
1222,X,United States Steel Corporation Common Stock,1,Buy
1223,ALGM,Allegro MicroSystems Inc. Common Stock,1,Strong Buy
1224,ACC,American Campus Communities Inc Common Stock,1,Strong Buy
1225,MTZ,MasTec Inc. Common Stock,1,Strong Buy
1226,POST,Post Holdings Inc. Common Stock,1,Strong Buy
1227,BRKS,Brooks Automation Inc.,1,Strong Buy
1228,PPC,Pilgrim's Pride Corporation Common Stock,1,Strong Buy
1229,WH,Wyndham Hotels & Resorts Inc. Common Stock ,1,Strong Buy
1230,EEFT,Euronet Worldwide Inc. Common Stock,1,Strong Buy
1231,CFX,Colfax Corporation Common Stock,1,Strong Buy
1232,SRPT,Sarepta Therapeutics Inc. Common Stock (DE),1,Strong Buy
1233,AXTA,Axalta Coating Systems Ltd. Common Shares,1,Buy
1234,CHNG,Change Healthcare Inc. Common Stock,1,Buy
1235,HTA,Healthcare Trust of America Inc. Class A Common Stock,1,Buy
1236,LFUS,Littelfuse Inc. Common Stock,1,Strong Buy
1237,HBI,Hanesbrands Inc. Common Stock,1,Strong Buy
1238,BYD,Boyd Gaming Corporation Common Stock,1,Strong Buy
1239,COLM,Columbia Sportswear Company Common Stock,1,Strong Buy
1240,AMG,Affiliated Managers Group Inc. Common Stock,1,Strong Buy
1241,CHPT,ChargePoint Holdings Inc. Common Stock,1,Strong Buy
1242,VAC,Marriott Vacations Worldwide Corporation Common Stock,1,Strong Buy
1243,RARE,Ultragenyx Pharmaceutical Inc. Common Stock,1,Strong Buy
1244,DCT,Duck Creek Technologies Inc. Common Stock,1,Strong Buy
1245,PLNT,Planet Fitness Inc. Common Stock,1,Buy
1246,MAN,ManpowerGroup Common Stock,1,Strong Buy
1247,EXEL,Exelixis Inc. Common Stock,1,Strong Buy
1248,COTY,Coty Inc. Class A Common Stock,1,Buy
1249,SRCL,Stericycle Inc. Common Stock,1,Buy
1250,MDU,MDU Resources Group Inc. Common Stock (Holding Company),1,Strong Buy
1251,LITE,Lumentum Holdings Inc. Common Stock,1,Strong Buy
1252,LEG,Leggett & Platt Incorporated Common Stock,1,Buy
1253,DLB,Dolby Laboratories Common Stock,1,Strong Buy
1254,NXST,Nexstar Media Group Inc. Class A Common Stock,1,Strong Buy
1255,SNX,Synnex Corporation Common Stock,1,Strong Buy
1256,VNT,Vontier Corporation Common Stock ,1,Strong Buy
1257,PB,Prosperity Bancshares Inc. Common Stock,1,Buy
1258,SPCE,Virgin Galactic Holdings Inc. Common Stock,1,Buy
1259,SKX,Skechers U.S.A. Inc. Common Stock,1,Strong Buy
1260,QDEL,Quidel Corporation Common Stock,1,Buy
1261,EVBG,Everbridge Inc. Common Stock,1,Strong Buy
1262,THO,Thor Industries Inc. Common Stock,1,Buy
1263,AYI,Acuity Brands Inc. ,1,Buy
1264,RBC,Regal Beloit Corporation Common Stock,1,Strong Buy
1265,MSA,MSA Safety Incorporated Common Stock,1,Buy
1266,HUN,Huntsman Corporation Common Stock,1,Strong Buy
1267,IBKR,Interactive Brokers Group Inc. Class A Common Stock,1,Strong Buy
1268,PRGO,Perrigo Company plc Ordinary Shares,1,Buy
1269,GPK,Graphic Packaging Holding Company,1,Buy
1270,EXP,Eagle Materials Inc Common Stock,1,Strong Buy
1271,NYCB,New York Community Bancorp Inc. Common Stock,1,Buy
1272,HOG,Harley-Davidson Inc. Common Stock,1,Buy
1273,CACI,CACI International Inc. Class A Common Stock,1,Strong Buy
1274,SRC,Spirit Realty Capital Inc. Common Stock,1,Strong Buy
1275,BPOP,Popular Inc. Common Stock,1,Strong Buy
1276,FRPT,Freshpet Inc. Common Stock,1,Strong Buy
1277,PRI,Primerica Inc. Common Stock,1,Buy
1278,NFE,New Fortress Energy Inc. Class A Common Stock,1,Buy
1279,AZEK,The AZEK Company Inc. Class A Common Stock,1,Strong Buy
1280,BOKF,BOK Financial Corporation Common Stock,1,Buy
1281,IART,Integra LifeSciences Holdings Corporation Common Stock,1,Buy
1282,REYN,Reynolds Consumer Products Inc. Common Stock,1,Strong Buy
1283,VVV,Valvoline Inc. Common Stock,1,Strong Buy
1284,LPX,Louisiana-Pacific Corporation Common Stock,1,Strong Buy
1285,DEI,Douglas Emmett Inc. Common Stock,1,Buy
1286,SNV,Synovus Financial Corp. Common Stock,1,Strong Buy
1287,DV,DoubleVerify Holdings Inc. Common Stock,1,Strong Buy
1288,ASH,Ashland Global Holdings Inc. Common Stock,1,Strong Buy
1289,CR,Crane Co. Common Stock,1,Strong Buy
1290,TDC,Teradata Corporation Common Stock,1,Strong Buy
1291,CUZ,Cousins Properties Incorporated Common Stock,1,Strong Buy
1292,NVT,nVent Electric plc Ordinary Shares ,1,Strong Buy
1293,EVR,Evercore Inc. Class A Common Stock,1,Strong Buy
1294,AMED,Amedisys Inc Common Stock,1,Strong Buy
1295,CERT,Certara Inc. Common Stock,1,Strong Buy
1296,MRVI,Maravai LifeSciences Holdings Inc. Class A Common Stock,1,Strong Buy
1297,CLH,Clean Harbors Inc. Common Stock,1,Strong Buy
1298,SLM,SLM Corporation Common Stock,1,Strong Buy
1299,NOV,NOV Inc. Common Stock,1,Strong Buy
1300,SAM,Boston Beer Company Inc. (The) Common Stock,1,Buy
1301,VSCO,Victorias Secret & Co. Common Stock ,1,Strong Buy
1302,NCLH,Norwegian Cruise Line Holdings Ltd. Ordinary Shares,1,Buy
1303,TKR,Timken Company (The) Common Stock,1,Strong Buy
1304,ESI,Element Solutions Inc. Common Stock,1,Strong Buy
1305,ACHC,Acadia Healthcare Company Inc. Common Stock,1,Buy
1306,TMX,Terminix Global Holdings Inc. Common Stock,1,Strong Buy
1307,LAZ,Lazard LTD. Lazard LTD. Class A Common Stock,1,Strong Buy
1308,UNM,Unum Group Common Stock,1,Buy
1309,VMEO,Vimeo Inc. Common Stock,1,Strong Buy
1310,VMI,Valmont Industries Inc. Common Stock,1,Strong Buy
1311,TFSL,TFS Financial Corporation Common Stock,1,Strong Buy
1312,IDA,IDACORP Inc. Common Stock,1,Buy
1313,IONS,Ionis Pharmaceuticals Inc. Common Stock,1,Buy
1314,CC,Chemours Company (The) Common Stock,1,Buy
1315,BWXT,BWX Technologies Inc. Common Stock,1,Strong Buy
1316,NCR,NCR Corporation Common Stock,1,Strong Buy
1317,ICUI,ICU Medical Inc. Common Stock,1,Strong Buy
1318,FL,Foot Locker Inc.,1,Strong Buy
1319,ADPT,Adaptive Biotechnologies Corporation Common Stock,1,Strong Buy
1320,CDK,CDK Global Inc. Common Stock,1,Strong Buy
1321,NRZ,New Residential Investment Corp. Common Stock,1,Strong Buy
1322,MTG,MGIC Investment Corporation Common Stock,1,Strong Buy
1323,WOOF,Petco Health and Wellness Company Inc. Class A Common Stock,1,Buy
1324,CRUS,Cirrus Logic Inc. Common Stock,1,Strong Buy
1325,HFC,HollyFrontier Corporation Common Stock,1,Buy
1326,OZK,Bank OZK Common Stock,1,Buy
1327,DRVN,Driven Brands Holdings Inc. Common Stock,1,Strong Buy
1328,WEN,Wendy's Company (The) Common Stock,1,Strong Buy
1329,AI,C3.ai Inc. Class A Common Stock,1,Buy
1330,NEWR,New Relic Inc. Common Stock,1,Buy
1331,SAIC,SCIENCE APPLICATIONS INTERNATIONAL CORPORATION Common Stock,1,Strong Buy
1332,PACW,PacWest Bancorp Common Stock,1,Strong Buy
1333,GTES,Gates Industrial Corporation plc Ordinary Shares,1,Strong Buy
1334,HHC,Howard Hughes Corporation (The) Common Stock,1,Strong Buy
1335,HLF,Herbalife Nutrition Ltd. Common Stock,1,Strong Buy
1336,TNL,Travel   Leisure Co. Common  Stock,1,Strong Buy
1337,PINC,Premier Inc. Class A Common Stock,1,Buy
1338,ADS,Alliance Data Systems Corporation Common Stock,1,Strong Buy
1339,NFG,National Fuel Gas Company Common Stock,1,Buy
1340,SLG,SL Green Realty Corp Common Stock,1,Buy
1341,JBLU,JetBlue Airways Corporation Common Stock,1,Strong Buy
1342,THG,Hanover Insurance Group Inc,1,Strong Buy
1343,DSEY,Diversey Holdings Ltd. Ordinary Shares,1,Strong Buy
1344,CW,Curtiss-Wright Corporation Common Stock,1,Strong Buy
1345,FLS,Flowserve Corporation Common Stock,1,Buy
1346,HIW,Highwoods Properties Inc. Common Stock,1,Strong Buy
1347,DTM,DT Midstream Inc. Common Stock ,1,Buy
1348,FCN,FTI Consulting Inc. Common Stock,1,Strong Buy
1349,HAYW,Hayward Holdings Inc. Common Stock,1,Strong Buy
1350,PK,Park Hotels & Resorts Inc. Common Stock ,1,Buy
1351,SLGN,Silgan Holdings Inc. Common Stock,1,Strong Buy
1352,HRB,H&R Block Inc. Common Stock,1,Buy
1353,OLLI,Ollie's Bargain Outlet Holdings Inc. Common Stock,1,Buy
1354,JAMF,Jamf Holding Corp. Common Stock,1,Strong Buy
1355,LMND,Lemonade Inc. Common Stock,1,Buy
1356,WBS,Webster Financial Corporation Common Stock,1,Strong Buy
1357,AL,Air Lease Corporation Class A Common Stock,1,Strong Buy
