Ticker,Headline
CME,CME Group profit drops 25% in first quarter
CME,CME to permanently close most physical trading pits
CME,UPDATE 2-CME Group beats profit estimates on lower expenses
CME,CME profits rise as micro futures lure retail investors
CME,CME denies media report of $16 billion takeover bid for rival Cboe
CME,UPDATE 2-CME profits rise as micro futures lure retail investors
CME,Exchange operator CME Group's profit rises in second quarter
CME,"CME Group, IHS Markit venture secures EU antitrust approval"
CME,UPDATE 1-CME calls time on most of its physical trading pits
CME,"CME Group Inc. Announces Third-Quarter 2021 Earnings Release, Conference Call"
CME,CME Group Reports August 2021 Monthly Market Statistics
CME,"CME Group and IHS Markit Complete Joint Venture and Launch OSTTRA, a New Post-Trade Services Company"
CME,CME Group Micro Futures and Options Surpass 1 Billion Contracts Traded
CME,Cboe stock spikes up after FT report of CME buyout bid
CME,"CME denies report of buyout bid for Cboe, saying 'inaccurate' report needed 'correction'"
CME,"CME Group Inc. Cl A stock rises Monday, still underperforms market"
CME,CME in $16bn bid for Chicago exchange rival Cboe
CME,"CME Group, IHS Markit Form JV To Launch OSTTRA - Quick Facts"
CME,CME Group Denies Media Report On Takeover Offer For CBOE
CME,"What Did the Stock Market Do Today, Aug. 18? 3 Big Stories to Catch Up On."
CMPI,Checkmate Pharmaceuticals to Present at the Cantor Virtual Global Healthcare Conference
CMPI,Checkmate Pharmaceuticals to Present at the H.C. Wainwright 23rd Annual Global Investment Conference
CMPI,Checkmate Pharmaceuticals Announces Second Quarter 2021 Financial Results and Provides Business Update
CMPI,Checkmate Pharmaceuticals to Present at the BTIG Virtual Biotechnology Conference
CMPI,"Dow Jones Falls 325 Points, But Microsoft Stock Stands Tall; Footwear Maker Surges After Investor Day"
CNSL,Consolidated Communications Reaches Tentative Agreements with Unions in Northern New England
CNSL,Consolidated Communications Reports Second Quarter 2021 Results
CNSL,"Consolidated Communications Delivers Gigabit Internet to 122,000 Homes and Small Businesses in First Half of 2021"
CNSL,Consolidated Communications to Present at Cowen’s 7th Annual Communications Infrastructure Summit
CNSL,Consolidated Communications Partners with DZS in Initiative to Bring Gigabit Fiber Network to 1.6M Locations
CNSL,Consolidated Communications Receives All State PUC Regulatory Approvals for Searchlight Capital Partners Investment
CNSL,"Consolidated Communications Delivering New Fiber Internet to 30,000 Vermont Residents"
CNSL,Consolidated Communications Launches ProConnect with Webex
CNSL,Consolidated Communications Announces Promotions of Greg Flanagan and Travis Graham to Vice President Roles
CNSL,"Dow Jones Falls 325 Points, But Microsoft Stock Stands Tall; Footwear Maker Surges After Investor Day"
CNSL,MicroStrategy's Bitcoin Pile Dwarfs Most S&P 500 Cash Holdings
CNSL,Consolidated Communications Reaches Tentative Deals With Unions In Northern New England
CNSL,"Consolidated Communications Holdings, inc (CNSL) Q2 2021 Earnings Call Transcript"
CNSL,"Consolidated Communications Stock Sheds On Q2 Revenue, EBITDA Decline"
CODX,"Thinking about buying stock in Boxlight, Pilgrim's Pride, Co-Diagnostics, Sesen Bio, or Aethlon Medical?"
CODX,"Dow Jones Falls 325 Points, But Microsoft Stock Stands Tall; Footwear Maker Surges After Investor Day"
CONN,"Dow Jones Falls 325 Points, But Microsoft Stock Stands Tall; Footwear Maker Surges After Investor Day"
CONN,"When insiders sell shares, it indicates their concern in the company’s prospects or that they view the stock as being overpriced. Either way, this signals an opportunity to go short on the stock. Insider sales should not be taken as the only indicator for making an investment or trading decision. At best, it can lend conviction to a selling decision."
CONN,Conn's Stock Gains As Q2 Earnings Smashes Estimates
CONN,Is Conn's (CONN) Stock a Solid Choice Right Now?
CONN,Conn's (CONN) Q2 2022 Earnings Call Transcript
CONN,Why Conn's Stock Rocked 8% Higher Today
CONN,Conn's (CONN) Q2 Earnings and Revenues Surpass Estimates
COOP,BRIEF-Ryder Enters Announces Launch COOP By Ryder
COOP,Mr. Cooper Group Inc. to Present at the Barclays Global Financial Services Conference
COOP,Mr. Cooper Group Announces Executive Leadership Promotions
COOP,Mr. Cooper Announces Sale of Xome Valuations
COOP,Mr. Cooper Group Reports Second Quarter 2021 Net Income of $439 Million
COOP,Mr. Cooper Group Announces Two Executive Appointments
COOP,"Mr. Cooper Group Inc. to Discuss Second Quarter 2021 Financial Results on July 29, 2021"
COOP,Mr. Cooper Announces Sale of Reverse Servicing Portfolio
COOP,Mr. Cooper Group Completes Sale of Title365 for $500 million
COOP,Mr. Cooper Announces Promotion of Chris Marshall to President
COOP,"Dow Jones Falls 325 Points, But Microsoft Stock Stands Tall; Footwear Maker Surges After Investor Day"
COOP,Mr. Cooper Group to sell Xome Valuations
COOP,Is Mr. Cooper Group (COOP) Stock a Solid Choice Right Now?
CORT,"Corcept Announces Presentation of Positive Results From Randomized, Controlled, Phase 2 Trial of Relacorilant in Patients With Recurrent Platinum-Resistant Ovarian Cancer at ESMO 2021"
CORT,"SHAREHOLDER ALERT: Morris Kandinov Investigating ODT, AYTU, EAR, and CORT; Shareholders are Encouraged to Contact the Firm"
CORT,William Guyer to join Corcept as Chief Development Officer
CORT,Corcept Therapeutics Announces Second Quarter Financial Results and Provides Corporate Update
CORT,"Corcept Therapeutics To Announce Second Quarter Financial Results, Provide Corporate Update and Host Conference Call"
CORT,Former Gilead Sciences Executive Amy E. Flood Joins Corcept Therapeutics as Chief Human Resources and Communications Officer
CORT,"SHAREHOLDER ALERT: Barr Law Group Investigating CORT, SEMMX, MSEIX, and MIMFX; Shareholders are Encouraged to Contact the Firm"
CORT,"Dow Jones Falls 325 Points, But Microsoft Stock Stands Tall; Footwear Maker Surges After Investor Day"
CORT,Corcept Therapeutics Incorporated (CORT) Q2 2021 Earnings Call Transcript
CORT,Corcept Therapeutics (CORT) Q2 Earnings and Revenues Surpass Estimates
CORT,"Corcept Therapeutics EPS beats by $0.13, beats on revenue"
COUP,"Thinking about buying stock in Kadmon Holdings, ADMA Biologics, National CineMedia, Coupa Software, or Gain Therapeutics?"
COUP,Coupa Software shares jump 12% on strong Q3 revenue guidance
COUP,Coupa Software Reports Second Quarter Fiscal 2022 Financial Results
COUP,"Businesses Surge Ahead Despite Rising Delta Variant Concerns, According to Coupa Business Spend Index"
COUP,Coupa Launches First Business Spend Management App Marketplace
COUP,Coupa Software Announces Date of Fiscal Second Quarter 2022 Financial Results Conference Call
COUP,Coupa ESG Report Highlights How It Empowers Organizations to Maximize ESG Impact with Business Spend Management
COUP,Coupa Surpasses 100 Issued and Pending U.S. Patents
COUP,Vertex Announces Certified Integration for Coupa Business Spend Management Platform
COUP,Coupa Software to Host Virtual Financial Analyst Day
COUP,Coupa beats Q2 estimates with record quarterly revenues
COUP,Coupa Software (COUP) Beats Q2 Earnings and Revenue Estimates
COUP,Coupa Software Incorporated (COUP) Q2 2022 Earnings Call Transcript
COUP,"COUP, FLXN, CYXT and MGNX among after hours movers"
COUP,"Coupa Stock Pops As Earnings, Guidance Top Views Amid Acquisition Spree"
COUP,Analyst Ratings For Coupa Software
COUP,Coupa Software (NASDAQ:COUP) has observed the following analyst ratings within the last quarter:
COUP,Coupa Software (COUP) Q2 Earnings & Revenues Top Estimates
COUP,RBC Capital raised Coupa Software Incorporated (NASDAQ: COUP) price target from $210 to $270. Coupa Software shares gained 5.6% to $277.95 in pre-market trading.
COUP,Why Are Coupa Software Shares Trading Higher Today?
COUP,Only 1 of These 2 Nasdaq Stock Favorites Is Winning Today
CPSI,BRIEF-CPSI Announces Refinancing Of Credit Facilities To Create Flexibility For More Opportunistic Future Uses Of Capital
CPSI,BRIEF-CPSI Reports Q1 EPS $0.29
CPSI,BRIEF-CPSI Reports Q4 GAAP Loss Per Share $1.57
CPSI,BRIEF-CPSI Q2 non-GAAP earnings per share $0.43
CPSI,BRIEF-CPSI Reports Q4 Non-Gaap Earnings Per Share $0.78
CPSI,BRIEF-CPSI Inc reports Q1 non-GAAP earnings per share $0.29
CPSI,BRIEF-CPSI Q4 non-gaap earnings per share $0.35
CPSI,BRIEF-CPSI reports Q2 GAAP earnings per share $0.15
CPSI,BRIEF-CPSI Q1 GAAP loss per share $0.07
CPSI,CPSI Announces Second Quarter 2021 Results
CPSI,CPSI and Medicomp Systems Announce Licensing Partnership to Integrate Quippe Clinical Data Engine Into Acute and Post-Acute EHR Platforms
CPSI,CPSI to Webcast Its Second Quarter 2021 Conference Call
CPSI,"Dow Jones Falls 325 Points, But Microsoft Stock Stands Tall; Footwear Maker Surges After Investor Day"
CPSI,Should Value Investors Buy Computer Programs and Systems (CPSI) Stock?
CPSI,Is Computer Programs and Systems (CPSI) a Great Value Stock Right Now?
CPSI,Computer Programs And Systems Inc (CPSI) Q2 2021 Earnings Call Transcript
CPSI,Computer Programs and Systems (CPSI) Q2 Earnings and Revenues Beat Estimates
CRAI,Charles River Associates (CRA) Declares Quarterly Cash Dividend of $0.26 Per Common Share
CRAI,"Is CRA International, Inc. (CRAI) The Right Choice in Consulting Services?"
CRAI,CRA International (CRAI) is a Top-Ranked Value Stock: Should You Buy?
CRAI,Time to Focus on CRA International (CRAI) for Strong Earnings Growth Potential
CRAI,CRA International (CRAI) Tops Q2 Earnings and Revenue Estimates
CRAI,CRA International declares $0.26 dividend
CRAI,"CRA International EPS beats by $0.60, beats on revenue"
CRAI,Why Charles River (CRAI) Stock Might be a Great Pick
CRAI,6 Reasons Why You Should Bet on Charles River (CRAI) Stock
CRBP,Corbus Pharmaceuticals Reports Second Quarter 2021 Financial Results and Provides Corporate Updates
CRBP,"Thinking about buying stock in Aravive, Marin Software, Staffing 360 Solutions, Corbus Pharmaceuticals, or Globalstar?"
CRBP,Corbus Pharmaceuticals Announces Topline Results from DETERMINE Phase 3 Study of Lenabasum for Treatment of Dermatomyositis
CRBP,"Corbus Pharmaceuticals Holdings Inc. stock falls Monday, underperforms market"
CRBP,Corbus Pharmaceuticals Holdings Inc (CRBP) Stock Decreases -7.38% This Week; Should You Buy?
CRBP,"Corbus Pharmaceuticals (CRBP) Reports Q2 Loss, Lags Revenue Estimates"
CRBP,"Corbus Pharmaceuticals EPS misses by $0.03, misses on revenue"
CRBP,"Intec Pharma, GreenTree & MedMen Among Top Cannabis Stock Movers On July 29, 2021"
CRBP,GAINERS: Intec Pharma (NASDAQ: NTEC) shares closed up 48.09% at $13.55
CRBP,Corbus Pharmaceuticals (CRBP) May Report Negative Earnings: Know the Trend Ahead of Q2 Release
CRBP,"Bullish Sentiment Pushing Cannabis Stocks Up, Check Out Top Movers For July 28, 2021"
CRBP,GAINERS: Tilray (NASDAQ: TLRY) shares closed up 25.77% at $16.01
CRCT,BRIEF-Capitaland Retail China Trust says HSBC Institutional Trust Services as trustee of CRCT entered into facility agreements
CRCT,Cricut to Present at Upcoming Investor Conference
CRCT,"Cricut to Announce Second Quarter 2021 Financial Results on August 12, 2021"
CRCT,Cricut (CRCT) falls 0.89% to Close at $34.63 on September 13
CRCT,"When insiders purchase shares, it indicates their confidence in the company's prospects or that they view the stock as a bargain. Either way, this signals an opportunity to go long on the stock. Insider purchases should not be taken as the only indicator for making an investment or trading decision. At best, it can lend conviction to a buying decision."
CREE,BRIEF-Cree Inc says will be reintegrating Wolfspeed business into Cree
CREE,"Cree results, forecast disappoint; stock slides"
CREE,"Cree to restructure LED business, cuts revenue forecast"
CREE,BRIEF-- Charles Swoboda would resign as CEO of Cree
CREE,Cree | Wolfspeed and STMicroelectronics Expand Existing 150mm Silicon Carbide Wafer Supply Agreement
CREE,Cree Reports Financial Results for the Fourth Quarter of Fiscal Year 2021
CREE,MaxLinear Linearization and Cree GaN on SiC Power Amplifiers Combine to Efficiently Power New Ultra-Wideband 5G
CREE,Cree stock surges after BofA says buy the chip maker that's 'turbocharging EVs'
CREE,Cree completes $500 million at-the-market equity offering
CREE,Cree stock pulls back from a record after filing for the ATM sale of up to $500 million in stock
CREE,Canadian network kicks off 6 NHL broadcasts in Plains Cree
CREE,9% Drop In Cree Stock A Buying Opportunity?
CREE,Cree | Wolfspeed and ST expand 150mm SiC wafer supply agreement to over $800m
CREE,QuickLogic and Verb Technology tops tech gainer charts; Cree and Kubient among losers
CRMT,"Dow Jones Falls 325 Points, But Microsoft Stock Stands Tall; Footwear Maker Surges After Investor Day"
CRTX,Cortexyme Expands Proprietary Development Pipeline with Initiation of Phase 1 Clinical Trial of COR588
CRTX,Cortexyme to Present at H.C. Wainwright 23rd Annual Global Investment Conference on September 13th
CRTX,Cortexyme Presents New Data Demonstrating Evidence of P. Gingivalis Infection of the Central Nervous System in Alzheimer’s Disease at Annual Biomarkers for Alzheimer’s Disease Summit
CRTX,Cortexyme to Present at Annual Biomarkers for Alzheimer’s Disease Summit
CRTX,Cortexyme Provides Business Update and Reports Second Quarter 2021 Results
CRTX,Cortexyme to Present at Canaccord Genuity' s 41st Annual Growth Conference on August 11th
CRTX,Cortexyme Presents Data Linking P. Gingivalis to Elevated Levels of Phospho-tau217 Reinforcing Evidence of Pathogen as Causative Agent of Alzheimer’s Disease at AAIC 2021
CRTX,Cortexyme Announces Lead 3CLpro Inhibitor for the Treatment of Coronavirus Infection
CRTX,Cortexyme to Present New Data at AAIC 2021
CRTX,Cortexyme Presents New Data Demonstrating Atuzaginstat Disrupts Biofilms and is Efficacious in Preclinical Models of Periodontal Disease at IADR 2021
CRTX,Cortexyme (CRTX) falls 4.27% for September 13
CRTX,Cortexyme gets dosing underway in early-stage COR588 trial
CRTX,"Fulcrum stock leads weekly healthcare gainers; Axsome, Sesen Bio among laggards"
CSGS,France considering raising CSG social charge-Hollande
CSGS,"MIDCAP-Australian Pharma, CSG attractive on earnings yield"
CSGS,BRIEF-CSG Ltd says CSG Services has been referred to adversely in an anti-corruption report
CSGS,TEXT-S&P rates CSG Systems
CSGS,"CSG Systems International, Inc. (CSGS) Ex-Dividend Date Scheduled for September 14, 2021"
CSGS,"CSG SYSTEMS INTERNATIONAL INC : Entry into a Material Definitive Agreement, Creation of a Direct Financial Obligation or an Obligation under an Off-Balance Sheet Arrangement of a Registrant (form 8-K)"
CSGS,CSG : CSG Systems International Approves Quarterly Dividend
CSGS,Csg Systems International Inc (CSGS) Q2 2021 Earnings Call Transcript
CSGS,"CSG Systems International EPS beats by $0.03, beats on revenue"
CSGS,Here's what to expect from CSG Systems International's earnings
CSGS,CSG : CSG Systems International to Hold Second Quarter 2021 Earnings Conference Call on August 4
CSII,"First Patients in Canada Treated With Cardiovascular Systems, Inc. Diamondback 360® Coronary Orbital Atherectomy System"
CSII,"Cardiovascular Systems, Inc. Reports Fiscal 2021 Fourth Quarter and Full Year Financial Results"
CSII,"Cardiovascular Systems, Inc. to Attend Three Investor Conferences in August"
CSII,"Cardiovascular Systems stock drops after CMS proposes payment cuts, but Needham says buy on weakness"
CSII,"Cardiovascular Systems, Inc. to Webcast Fiscal 2021 Fourth-Quarter Earnings Conference Call Wednesday, August 4"
CSII,CSII: 2 Beaten-Up Stocks for Bargain Hunters
CSII,Cardiovascular Systems (CSII) Down 6.6% Since Last Earnings Report: Can It Rebound?
CSII,Cardiovascular Systems (CSII) Introduces Diamondback in Canada
CSII,FDA OKs expanded labelling or Lilly's Lyumjev 100 units/ml in insulin pumps
CSII,Cardiovascular Systems (CSII) Q4 Loss Narrower Than Expected
CSII,"Cardiovascular Systems, inc (CSII) Q4 2021 Earnings Call Transcript"
CSII,2 Beaten-Up Stocks for Bargain Hunters
CSOD,"SHAREHOLDER INVESTIGATION: Halper Sadeh LLP Investigates ACBI, MSON, VICI, CSOD; Shareholders are Encouraged to Contact the Firm"
CSOD,"INVESTIGATION: Halper Sadeh LLP Investigates ECHO, ACBI, MSON, VICI, CSOD; Shareholders are Encouraged to Contact the Firm"
CSOD,"Lifshitz Law Firm, P.C. Announces Investigation of BCML, CSOD, CLDB, and JAX"
CSOD,"SHAREHOLDER INVESTIGATION: Halper Sadeh LLP Investigates RFL, CSOD, VICI, SIC; Shareholders are Encouraged to Contact the Firm"
CSOD,"Moore Kuehn Encourages FTAA, MGP, GCAC, and CSOD Investors to Contact Law Firm"
CSOD,"Lifshitz Law Firm, P.C. Announces Investigation of CSOD, RYFL, SIC, and VICI"
CSOD,"SHAREHOLDER ALERT: Rigrodsky Law, P.A. Reminds Investors of Investigation of XONE, SAFM, XENT, and CSOD Buyouts"
CSOD,"INVESTIGATION: Halper Sadeh LLP Investigates NLOK, XONE, IEC, CSOD, XENT; Shareholders are Encouraged to Contact the Firm"
CSOD,"SHAREHOLDER ALERT: WeissLaw LLP Reminds CSOD, XENT, MSON, and NWHM Shareholders About Its Ongoing Investigations"
CSOD,"Dow Jones Falls 325 Points, But Microsoft Stock Stands Tall; Footwear Maker Surges After Investor Day"
CSOD,"Cornerstone OnDemand, Inc. (Clearlake) -- Moody's assigns B3 CFR to Cornerstone following Clearlake buyout; outlook stable"
CTBI,BRIEF-Community Trust Bancorp Q4 earnings per share $0.67
CTBI,"Community Trust Bancorp, Inc. Announces CEO Retirement and Succession Plan"
CTBI,"Community Trust Bancorp, Inc. Increases Its Cash Dividend"
CTBI,"Community Trust Bancorp, Inc. Reports Record Earnings for the Second Consecutive Quarter 2021"
CTBI,Community Trust Bancorp's (NASDAQ:CTBI) Shareholders Will Receive A Bigger Dividend Than Last Year
CTBI,Community Trust Bancorp raises dividend by ~4%
CTBI,Community Trust Bancorp (CTBI) Surpasses Q2 Earnings and Revenue Estimates
CTBI,Community Trust Bancorp (CTBI) Expected to Beat Earnings Estimates: Can the Stock Move Higher?
CTBI,Community Trust Bancorp declares $0.385 dividend
CTBI,Community Trust Bancorp (CTBI) Q1 Earnings and Revenues Surpass Estimates
CTBI,4 Reasons to Add First Bancorp (FBNC) Stock to Your Portfolio
CTBI,"Credit Acceptance (CACC) Settles Auto-Loan Lawsuit, To Pay $27.2M"
CTKB,Cytek Biosciences to Present at the Morgan Stanley 19th Annual Global Healthcare Conference
CTKB,Cytek Biosciences Reports Second Quarter 2021 Financial Results
CTKB,Cytek Biosciences Announces Full Exercise of Underwriters’ Option to Purchase Additional Shares
CTKB,Cytek Biosciences Announces Closing of Its Initial Public Offering
CTKB,"Dow Jones Falls 325 Points, But Microsoft Stock Stands Tall; Footwear Maker Surges After Investor Day"
CTXS,BRIEF-Morpho detection awarded Cardiff Airport contract for CTX 9800 hold baggage explosives detection systems
CTXS,"Thinking about trading options or stock in Citrix Systems, AMC Entertainment, Ollie's Bargain Outlet, Alibaba, or Draftkings?"
CTXS,Citrix Reports Second Quarter 2021 Financial Results
CTXS,Citrix Systems Inc. stock outperforms market on strong trading day
CTXS,Citrix Goes From Covid Winner to One of S&P 500’s Worst
CVBF,BRIEF-CVB Financial And Community Bank Announce Agreement To Merge
CVBF,Fitch Affirms CVB Financial Corp's L-T IDR at 'BBB'; Outlook Stable
CVBF,BRIEF-CVB Financial and Valley Commerce Bancorp announce merger
CVBF,CVB Financial Corp. and Suncrest Bank Announce Agreement to Merge
CVBF,CVB Financial Corp. Reports Earnings for the Second Quarter of 2021
CVBF,CVB Financial Corp. Announces 127th Consecutive Cash Dividend
CVBF,"Dow Jones Falls 325 Points, But Microsoft Stock Stands Tall; Footwear Maker Surges After Investor Day"
CVBF,CVB Financial Corp (CVBF) Q2 2021 Earnings Call Transcript
CVBF,CVB Financial (CVBF) Tops Q2 Earnings Estimates
CVBF,CVB Financial (CVBF) Earnings Expected to Grow: What to Know Ahead of Q2 Release
CVBF,"CVB Financial EPS beats by $0.03, beats on revenue"
CVCO,Cavco Industries Introduces New Brand Refresh
CVCO,Cavco Industries Comments on SEC Complaint
CVCO,Cavco Industries Names Allison K. Aden as Chief Financial Officer
CVCO,Cavco Industries Reports Record Fiscal 2022 First Quarter Results and Provides Further Business Updates
CVCO,"Webcast Alert: Cavco Industries, Inc. Announces Fiscal 2022 First Quarter Earnings Release and Conference Call Webcast"
CVCO,Cavco Industries Announces Planned Acquisition of Manufactured and Modular Home Builder the Commodore Corporation
CVCO,"Cavco Industries Announces Major Expansion to Fort Worth, Texas Production Facility"
CVCO,"Dow Jones Falls 325 Points, But Microsoft Stock Stands Tall; Footwear Maker Surges After Investor Day"
CVCO,How Cavco Industries (CVCO) Stock Stands Out in a Strong Industry
CVCO,Cavco Industries Appoints Allison Aden As CFO
CVCO,"Cavco Industries Inc (NASDAQ: CVCO) has appointed Allison K. Aden as its Executive Vice President and Chief Financial Officer, effective August 30, 2021."
CVCO,"Cavco Industries, inc (CVCO) Q1 2022 Earnings Call Transcript"
CVCO,Cavco Industries IncShs hosts conference call for investors
CVCO,"Cavco EPS beats by $0.81, beats on revenue"
CVGW,"Calavo Growers, Inc. Announces Third Quarter 2021 Financial Results"
CVGW,Calavo Growers Announces Retirement of James Gibson and Appointment of Steven Hollister as Interim CEO
CVGW,"Calavo Growers, Inc. Announces Preliminary Third Quarter 2021 Results"
CVGW,Calavo Growers Publishes Annual Sustainability Report
CVGW,Calavo Growers Announces Departure of CFO and Appointment of Interim CFO
CVGW,"What Type Of Shareholders Make Up Calavo Growers, Inc.'s (NASDAQ:CVGW) Share Registry?"
CVGW,"Hot Stocks: Box office excitement; ITMR, TROX rise on M&A; MDXG failed trials; CVGW continues slide"
CVGW,"The Cautious Bridge to Investing, and Watching Calavo Growers"
CVGW,"Calavo Growers (CVGW) Reports Q3 Loss, Tops Revenue Estimates"
CVGW,Inflation Affects Calavo Growers' Q3 Earnings; CEO Retires
CVGW,Calavo Growers Inc (CVGW) Q3 2021 Earnings Call Transcript
CVGW,Analysts Estimate Calavo Growers (CVGW) to Report a Decline in Earnings: What to Look Out for
CYBE,CyberOptics Receives $1.7 Million of New Orders for 3D MX3000™ Systems
CYBE,CyberOptics to Showcase High-Precision Inspection and Metrology Solutions at the SEMI Connecting Heterogeneous Systems Summit
CYBE,CyberOptics Reports Record Second Quarter Sales
CYBE,CyberOptics Second Quarter 2021 Earnings Conference Call Scheduled for July 28
CYBE,CyberOptics Receives Orders Valued at $2.4 Million for Printer Cartridge Inspection and Metrology
CYBE,Cyberoptics (CYBE) falls 2.03% for September 13
CYBE,"CyberOptics EPS beats by $0.12, beats on revenue"
CYBE,CyberOptics earnings: here's what Wall Street expects
CYBE,"Zacks Industry Outlook Highlights: IPG Photonics, Cutera and CyberOptics"
CZWI,"Dow Jones Falls 325 Points, But Microsoft Stock Stands Tall; Footwear Maker Surges After Investor Day"
CZWI,MicroStrategy's Bitcoin Pile Dwarfs Most S&P 500 Cash Holdings
CZWI,Blinken to host event marking anniversary of Israel-Arab normalization deals
CZWI,Does SPAR Group (NASDAQ:SGRP) Have A Healthy Balance Sheet?
CZWI,"US STOCKS-Financials drag Dow, S&P lower as data shows cooling inflation"
CZWI,Why small caps could present the best opportunity as S&P 500 sits near records
CZWI,"Citizens Community Bancorp, Inc. (CZWI) Q2 Earnings and Revenues Surpass Estimates"
CZWI,"Citizens Community Bancorp EPS beats by $0.10, beats on revenue"
CZWI,"Citizens Community Bancorp, Inc. (CZWI) Earnings Expected to Grow: Should You Buy?"
CZWI,Citizens Community Bancorp (CZWI) Sees Hammer Chart Pattern: Time to Buy?
CZWI,"What Makes Citizens Community Bancorp, Inc. (CZWI) a New Strong Buy Stock"
DGICA,Donegal Group Inc. Announces Second Quarter and First Half 2021 Results
DGICA,Donegal Group Inc. Announces Quarterly Dividend
DGICA,Donegal Group Inc. Announces Second Quarter 2021 Conference Call and Webcast
DGICA,"Dow Jones Falls 325 Points, But Microsoft Stock Stands Tall; Footwear Maker Surges After Investor Day"
DGICA,"Donegal Group EPS beats by $0.18, beats on revenue"
DGICA,Donegal Group A earnings preview: what Wall Street is expecting
DGICA,According to Benzinga Pro following are the gainers and losers in Insurance industry for today's Intraday session. Gainers Tiptree (NASDAQ: TIPT) stock increased by 4.57% to $11.66 during Monday's regular session. As of
DGICA,Here's what Wall Street expects from Donegal Group A's earnings report
DGICA,Donegal Group Inc. (A) hosts conference call for investors
DISCA,Discovery President And CEO David Zaslav To Present At The Goldman Sachs 30th Annual Communacopia Conference
DISCA,"Discovery Chief Financial Officer Gunnar Wiedenfels To Present At The Bank Of America Securities 2021 Media, Communications & Entertainment Conference"
DISCA,"Discovery To Report Second-Quarter 2021 Results On Tuesday, August 3"
DISCA,"INVESTIGATION ALERT: Halper Sadeh LLP Investigates STMP, JAX, RIVE, DISCA, CLDR; Shareholders are Encouraged to Contact the Firm"
DISCA,"SHAREHOLDER ALERT: WeissLaw LLP Reminds SLCT, DISCA, LORL, SBBP Shareholders About Its Ongoing Investigations"
DISCA,Discovery reportedly top bidder for Scripps as Viacom drops outMike Snider
DISCA,Cable TV network merger: Discovery to acquire Scripps Networks for $11.9BNathan Bomey and Mike Snider
DISCA,Discovery Inc. Series A stock outperforms market on strong trading day
DISCA,First Week of January 2024 Options Trading For Discovery (DISCA)
DISCA,Discovery CFO Talks Streaming Strategy After WarnerMedia Deal
DISCA,Discovery: My Favorite Media Stock For The Next 5 Years
DISCA,"Any Decision About AT&T Stock Should Rely on Prudence, Not Emotion"
DISCA,Is AT&T Stock a Buy?
DISCA,Why Is Discovery (DISCA) Up 0.3% Since Last Earnings Report?
DISH,Dish Network taps Dell for 5G network infrastructure
DISH,"Dish gets Amazon on board to build 5G network, to launch in Las Vegas"
