Ticker,Headline
FHB,BRIEF-Hungarian Takarekbank makes buyout offer for FHB Bank shares
FHB,"First Hawaiian, Inc. Reports Second Quarter 2021 Financial Results and Declares Dividend"
FHB,"First Hawaiian Appoints James S. Moffatt and Kelly A. Thompson to the First Hawaiian, Inc. Board of Directors"
FHB,First Hawaiian to Report Second Quarter 2021 Financial Results on July 23
FHB,"Dow Jones Falls 325 Points, But Microsoft Stock Stands Tall; Footwear Maker Surges After Investor Day"
FHB,"First Hawaiian, inc (FHB) Q2 2021 Earnings Call Transcript"
FHB,First Hawaiian (FHB) Beats Q2 Earnings and Revenue Estimates
FHB,"First Hawaiian EPS beats by $0.21, misses on revenue"
FHB,Here's what Wall Street expects from First Hawaiian's earnings
FLNT,BRIEF-Cogint Announces Corporate Name Change To Fluent Inc
FLNT,"Health, Pharma and Wellness Brands to Benefit from Fyllo and Fluent Audiences"
FLNT,"Lilium closes business combination with Qell Acquisition Corp., will begin trading on Nasdaq under the symbol ""LILM"" on September 15"
FLNT,How to Tackle Tax Surprises on Cryptocurrency and NFT Investments
FLNT,"Notable Tuesday Option Activity: NSSC, FROG, HCA"
FLNT,"Dow Jones Falls 325 Points, But Microsoft Stock Stands Tall; Footwear Maker Surges After Investor Day"
FLNT,MicroStrategy's Bitcoin Pile Dwarfs Most S&P 500 Cash Holdings
FLNT,"US STOCKS-Financials drag Dow, S&P lower as data shows cooling inflation"
FLNT,Fluent Trade Technologies Ltd : Fluent Enhances National Australia Bank's Global FX Capabilities
FLNT,"Fluent, Inc (FLNT) Q2 2021 Earnings Call Transcript"
FLNT,"Fluent (FLNT) Reports Q2 Loss, Tops Revenue Estimates"
FLNT,Fluent is about to announce its earnings — here's what to expect
FLNT,Earnings Preview: Fluent (FLNT) Q2 Earnings Expected to Decline
FMAO,"Farmers & Merchants Bancorp, Inc. Announces Completion of Subordinated Note Offering"
FMAO,"Farmers & Merchants Bancorp, Inc. Reports 2021 Second-Quarter and Year-to-Date Financial Results"
FMAO,"SHAREHOLDER ALERT: Rigrodsky Law, P.A. Announces Investigation of Perpetual Savings Bank of Urbana Merger"
FMAO,"Farmers & Merchants Bancorp, Inc. Declares 2021 Second-Quarter Cash Dividend"
FMAO,This is Why Farmers & Merchants Bancorp Inc. (FMAO) is a Great Dividend Stock
FMAO,Farmers & Merchants Bancorp declares $0.17 dividend
FMAO,"ASPS leads financial gainers, XYF and FNHC among losers"
FMAO,"Farmers & Merchants Bancorp EPS misses by $0.01, beats on revenue"
FMAO,Farmers & Merchants Bancorp acquires of Ossian Financial Services
FNWB,"Lilium closes business combination with Qell Acquisition Corp., will begin trading on Nasdaq under the symbol ""LILM"" on September 15"
FNWB,How to Tackle Tax Surprises on Cryptocurrency and NFT Investments
FNWB,"Notable Tuesday Option Activity: NSSC, FROG, HCA"
FNWB,"Dow Jones Falls 325 Points, But Microsoft Stock Stands Tall; Footwear Maker Surges After Investor Day"
FNWB,MicroStrategy's Bitcoin Pile Dwarfs Most S&P 500 Cash Holdings
FNWB,"US STOCKS-Financials drag Dow, S&P lower as data shows cooling inflation"
FNWB,"Benzinga's Top Ratings Upgrades, Downgrades For September 1, 2021"
FNWB,
FNWB,First Northwest Bancorp declares $0.06 dividend
FNWB,First Northwest Bancorp reports Q1 results
FNWB,"First Northwest Bancorp to purchase Bellevue, WA branch from Sterling Bank"
FRBK,"Lilium closes business combination with Qell Acquisition Corp., will begin trading on Nasdaq under the symbol ""LILM"" on September 15"
FRBK,How to Tackle Tax Surprises on Cryptocurrency and NFT Investments
FRBK,"Notable Tuesday Option Activity: NSSC, FROG, HCA"
FRBK,"Dow Jones Falls 325 Points, But Microsoft Stock Stands Tall; Footwear Maker Surges After Investor Day"
FRBK,MicroStrategy's Bitcoin Pile Dwarfs Most S&P 500 Cash Holdings
FRBK,"US STOCKS-Financials drag Dow, S&P lower as data shows cooling inflation"
FRBK,Republic First Bancorp earnings preview: what Wall Street is expecting
FRBK,"United Insurance, Republic First Bancorp may fall out of Russell 2000, KBW says"
FRBK,Stocks That Hit 52-Week Highs On Monday
FRBK,This morning 792 companies reached new 52-week highs.
FRBK,"TBBK, NUVA, IRBT and FRBK among after-hours movers"
FRBK,"EBSB leads financial gainers, XYF and GROW the only losers"
FTEK,Fuel Tech to Present at H.C. Wainwright 23rd Annual Global Investment Conference
FTEK,Fuel Tech Reports 2021 Second Quarter Financial Results
FTEK,Fuel Tech Schedules Second Quarter 2021 Financial Results and Conference Call
FTEK,"Thinking about buying stock in Exela Technologies, JAKKS Pacific, Fuel Tech, electroCore, or APi Group?"
FTEK,Fuel Tech Awarded Air Pollution Control Orders Totaling $4.5 Million
FTEK,Fuel Tech Announces Inclusion in Russell Microcap® Index
FTEK,"FUEL TECH, INC. : Regulation FD Disclosure, Financial Statements and Exhibits (form 8-K)"
FTEK,Fuel Tech (FTEK) Sees Hammer Chart Pattern: Time to Buy?
FTEK,"Fuel Tech, Inc. (FTEK) Reports Q2 Loss, Tops Revenue Estimates"
FTEK,Fuel Tech IncShs hosts conference call for investors
FTEK,Fuel Tech earnings: here's what Wall Street expects
FTEK,"Green light on fossil fuel tech, for now"
FULT,Fitch Affirms Fulton Financial's Ratings at 'BBB+/F2'; Outlook Stable
FULT,Fitch Affirms Fulton Financial's Ratings at 'BBB+/F2' Following Peer Review; Outlook Stable
FULT,TEXT-Fitch affirms Fulton Financial Corp
FULT,TEXT-Fitch Downgrades Fulton Financial Corp's Rtgs to 'BBB+/F2' Following Mid-Tier Regional Peer Review
FULT,Fulton Financial Announces Second Quarter 2021 Results
FULT,Fulton Financial Corporation Announces Dates for Second Quarter 2021 Earnings Release and Webcast
FULT,"Dow Jones Falls 325 Points, But Microsoft Stock Stands Tall; Footwear Maker Surges After Investor Day"
FULT,Fulton Financial Corporation (FULT) Q2 2021 Earnings Call Transcript
FULT,Fulton Financial (FULT) Tops Q2 Earnings Estimates
FULT,"Fulton Financial EPS beats by $0.05, misses on revenue"
FULT,Is a Surprise Coming for Fulton Financial (FULT) This Earnings Season?
GABC,BRIEF-German American Bancorp announces three-for-two stock split
GABC,BRIEF-German American Bancorp Reports Q1 EPS Of $0.51
GABC,BRIEF-German American Bancorp Q1 earnings per share $0.37
GABC,BRIEF-German American Bancorp reports Q4 earnings per share $0.66
GABC,BRIEF-German American Bancorp posts Q2 earnings per share $0.43
GABC,BRIEF-German American Bancorp reports Q3 earnings per share $0.42
GABC,BRIEF-German American Bancorp Q3 earnings per share $0.67
GABC,BRIEF-German American Bancorp reports Q1 earnings per share $0.42
GABC,BRIEF-German American Bancorp reports Q4 EPS $0.51
GABC,"German American Bancorp, Inc. (GABC) Posts Strong Second Quarter Performance"
GABC,"German American Bancorp, Inc. (GABC) Announces Next Steps in Executive Management Succession Plan"
GABC,"German American Bancorp, Inc. (GABC) Appoints Dr. Sue Ellspermann to Corporate Board of Directors"
GABC,"Dow Jones Falls 325 Points, But Microsoft Stock Stands Tall; Footwear Maker Surges After Investor Day"
GABC,All You Need to Know About German American Bancorp (GABC) Rating Upgrade to Strong Buy
GABC,German American Bancorp goes ex-dividend on Monday
GABC,German American Bancorp (GABC) Q2 Earnings and Revenues Surpass Estimates
GABC,"German American Bancorp EPS beats by $0.27, beats on revenue"
GABC,Is a Surprise Coming for German American Bancorp (GABC) This Earnings Season?
GAIN,Gladstone Investment Corporation Acquires Utah Pacific
GAIN,Gladstone Investment Corporation Prices Public Offering of 4.875% Notes due 2028
GAIN,Gladstone Investment Announces Intent to Redeem All Outstanding Shares of Existing Series E Term Preferred Stock
GAIN,Gladstone Investment Corporation Announces Notes Offering
GAIN,"Gladstone Investment Supports Add-on Acquisition for Portfolio Company Nocturne Villa Rentals, Inc."
GAIN,Gladstone Investment Corporation Earnings Call and Webcast Information
GAIN,"Nocturne Luxury Villas, Backed by Gladstone Investment Corporation, Announces Second in a Series of Investments in the Luxury Vacation Rental Sector with the Acquisition of St. Barth Properties"
GAIN,"Gladstone Investment Announces Monthly Cash Distributions for July, August and September 2021, a Supplemental Distribution to Common Stockholders and First Fiscal Quarter Earnings Release and Conference Call Dates"
GAIN,Gladstone Investment Corporation Exits its Investment in Head Country Barbecue Sauce
GAIN,"Lilium closes business combination with Qell Acquisition Corp., will begin trading on Nasdaq under the symbol ""LILM"" on September 15"
GAIN,Gladstone Investment (GAIN) Upgraded to Strong Buy: What Does It Mean for the Stock?
GAIN,Gladstone Investment goes ex-dividend tomorrow
GAIN,Gladstone Investment Corporation (GAIN) Q1 2022 Earnings Call Transcript
GAIN,Gladstone Investment (GAIN) Beats Q1 Earnings and Revenue Estimates
GAIN,"Gladstone Investment NII misses by $0.05, beats on total investment income"
GBDC,LPC: BDC sector splitting into ‘haves’ and ‘have nots’
GBDC,BDCs win leverage cap increase after US$1.3trn budget signed
GBDC,BDC leverage differentiation is focus in 2019 – Fitch
GBDC,LPC: Qlik Technologies cuts borrowing costs with traditional banks
GBDC,"Golub Capital BDC, Inc. Announces Fiscal Year 2021 Third Quarter Financial Results and Declares Fiscal Year 2021 Fourth Quarter Distribution of $0.29 Per Share"
GBDC,"Golub Capital BDC, Inc. Prices Public Offering of $350 Million 2.050% Notes Due 2027"
GBDC,"Golub Capital BDC, Inc. Schedules Release of Fiscal Year 2021 Third Quarter Results"
GBDC,"Golub Capital BDC, Inc. Announces $614.7 Million In New Middle-Market Originations For Its Fiscal Year 2021 Third Quarter"
GBDC,Safe stocks yielding 5% (or more) do exist: Here are 5 of themBrian Feroldi
GBDC,Golub Capital board appoints Christopher Ericson to serve as CFO
GBDC,Golub Capital BDC : Announces Chief Financial Officer Transition (Form 8-K)
GBDC,5 High Dividend Stocks With an Insider Edge
GECC,New Issue-GECC sells $825 mln in notes
GECC,New Issue- GECC sells $1 bln in notes
GECC,BRIEF-Moody's assigns A1 rating to GECC notes due 2019
GECC,New Issue-GECC/LJ VP Holdings sells $700 mln notes
GECC,New Issue- GECC sells $3.1 bln of 2-part notes
GECC,New Issue - GECC sells $1.7 bln in 3 parts
GECC,Fitch: Hyundai Capital's Ratings Unaffected by GECC's Divestment
GECC,New Issue- GECC prices multi tranche deal
GECC,New Issue-GECC prices NZ$300 mln 2018 bond
GECC,New Issue- GECC prices dual tranche deal
GECC,Is Great Elm Capital Corp (GECC) Stock a Smart Investment Tuesday?
GECC,Great Elm Capital (GECC) Upgraded to Buy: What Does It Mean for the Stock?
GECC,Great Elm Capital (GECC) Beats Q2 Earnings Estimates
GECC,"Great Elm Capital EPS beats by $0.04, beats on total investment income"
GECC,Great Elm Capital earnings: here's what Wall Street expects
GECC,Earnings Preview: Great Elm Capital (GECC) Q2 Earnings Expected to Decline
GLAD,"Gladstone Capital Corporation Reports Financial Results for its Third Quarter Ended June 30, 2021"
GLAD,Gladstone Capital Corporation Earnings Call and Webcast Information
GLAD,"Gladstone Capital Announces Monthly Cash Distributions for July, August and September 2021 and Conference Call Date"
GLAD,"Dow Jones Falls 325 Points, But Microsoft Stock Stands Tall; Footwear Maker Surges After Investor Day"
GLAD,Gladstone Capital CorpShs hosts conference call for investors
GLAD,Gladstone Capital (GLAD) Misses Q3 Earnings and Revenue Estimates
GLAD,"Gladstone Capital NII beats by $0.01, misses on total investment income"
GLAD,Gladstone Capital is about to announce its earnings — here's what to expect
GLAD,Gladstone Capital (GLAD) Earnings Expected to Grow: Should You Buy?
GRPN,"GROUPON ALERT: Bragar Eagel & Squire, P.C. is Investigating Groupon, Inc. on Behalf of Long-Term Stockholders and Encourages Investors to Contact the Firm"
GRPN,Groupon to Participate in the Wolfe Research Inaugural TMT Conference
GRPN,"GROUPON ALERT: Bragar Eagel & Squire, P.C. is Investigating Groupon, Inc. on Behalf of Groupon Stockholders and Encourages Investors to Contact the Firm"
GRPN,"SHAREHOLDER ALERT: Pomerantz Law Firm Investigates Claims On Behalf of Investors of Groupon, Inc. - GRPN"
GRPN,"Thinking about trading options or stock in Groupon, Plug Power, Vir Biotechnology, Albemarle Corp, or Paycom Software?"
GRPN,Groupon Announces Second Quarter 2021 Results
GRPN,Adventure Is Calling Again: New Groupon Brand Campaign Encourages People to Get Out and Grab Life by the Groupon™
GRPN,Groupon shares surge on talk it's looking for a buyerMike Snider
GRPN,Tech Five: Groupon earnings arrive this weekBrett Molina
GRPN,Groupon shares sink 15% after earnings disappointNancy Blair
GRPN,"Tech Five: Shares of LinkedIn, Groupon surgingBrett Molina"
GRPN,Tech Five: Groupon to report earningsBrett Molina
GRPN,Groupon investors offered little hope after three hard yearsJohn Shinal
GRPN,Tech stock gyrations suggest boom's end is nearJohn Shinal
GRPN,Groupon and Zynga were worst big Internet IPOsJohn Shinal
GRPN,Tech Five: Groupon shares slammed off earningsBrett Molina
GRPN,"Dow Jones Falls 325 Points, But Microsoft Stock Stands Tall; Footwear Maker Surges After Investor Day"
HA,Hawaiian Airlines Welcomes Guests to Travel Responsibly with New In-flight Video
HA,"Ready, Set, Holoholo! Registration Begins for Hawaiian Airlines' Second Annual Virtual Fitness Challenge"
HA,Hawaiian Holdings Reports 2021 Second Quarter Financial Results
HA,Hawaiian Holdings Announces 2021 Second Quarter Results Conference Call
HA,"Hawaiian Airlines 2021 Corporate Kuleana Report: Persevering Through the COVID-19 Pandemic, Emerging Stronger"
HA,"Hawaiian Airlines parent raises revenue outlook, citing 'strong demand' in North America"
HA,"Multiple insiders sold Hawaiian Holdings, Inc. (NASDAQ:HA) stock in the last year, which isn't a good sign for investors"
HA,Hawaiian Holdings' (HA) Q3 View Dims on Delta Variant-Led Woes
HA,Hawaiian Holdings (HA) Down 3.2% Since Last Earnings Report: Can It Rebound?
HMHC,Textbook publisher Houghton Mifflin Harcourt prices IPO at $12 a share
HMHC,Fitch Affirms Houghton Mifflin Harcourt's IDR at 'B+'; Withdraws Ratings
HMHC,Publisher Houghton Mifflin announces IPO at $14-$16/share
HMHC,Publisher Houghton Mifflin announces IPO at $14 to $16 per share
HMHC,Houghton Mifflin Harcourt to Present at BMO 2021 Technology Summit
HMHC,Houghton Mifflin Harcourt Announces Strong Second Quarter 2021 Results; Delivers Billings Growth of 25%; Raises Full Year Guidance
HMHC,Houghton Mifflin Harcourt Appoints Chris Symanoskie as Vice President of Investor Relations
HMHC,Houghton Mifflin Harcourt Schedules Conference Call to Discuss Second Quarter 2021 Results
HMHC,Houghton Mifflin Harcourt selling consumer publishing unit to News Corp. for $349 million
HMHC,"Dow Jones Falls 325 Points, But Microsoft Stock Stands Tall; Footwear Maker Surges After Investor Day"
HOPE,WORLD NEEDS THE OLYMPICS NOW AS A CELEBRATION OF HOPE-WHO HEAD TEDROS
HOPE,Fear and hope on Libya's reopened highway
HOPE,Australia's New Hope to lay off up to 75% of HQ staff
HOPE,Republicans hope to unveil infrastructure counterproposal Thursday -Wicker
HOPE,Hope Bancorp Appoints Technology Intrapreneur Mary (“Mimi”) Thigpen to Board of Directors
HOPE,Hope Bancorp Announces New $50 Million Stock Repurchase Program
HOPE,Hope Bancorp Declares Quarterly Cash Dividend of $0.14 Per Share
HOPE,Hope Bancorp Reports 2021 Second Quarter Financial Results
HOPE,"Hope Bancorp to Report 2021 Second Quarter Financial Results on Tuesday, July 20, 2021"
HOPE,Jimmy Fallon feels Met Gala signifies new hope after COVID
HOPE,Column: NFL season opens with hope and COVID-19 still in air
HOPE,Vikings hope family reunion on defense sparks resurgence
HOPE,'I hope they never doubted my commitment': Rodgers' message to fans after summer drama
HOPE,"Dow Jones Falls 325 Points, But Microsoft Stock Stands Tall; Footwear Maker Surges After Investor Day"
HOPE,Hope Well Capital Corp.* and Forward Water Technologies Inc. Announce Closing of Second Tranche and Completion of $6.5 Million Financing
HOPE,"Hope Bancorp, inc (HOPE) Q2 2021 Earnings Call Transcript"
HOPE,Hope Bancorp (HOPE) Tops Q2 Earnings and Revenue Estimates
HOPE,"Hope Bancorp EPS beats by $0.05, beats on revenue"
HRZN,Horizon Technology Finance and Trinity Capital Provide $40 Million Venture Loan to Nexii
HRZN,Horizon Technology Finance Leads $15 Million Growth Capital to Nogin
HRZN,Cerecor Announces Drawdown of $10 Million Tranche under its Debt Financing Agreement with Horizon Technology Finance
HRZN,"Horizon Technology Finance Announces Monthly Distributions for October, November and December 2021 Totaling $0.30 per Share"
HRZN,Horizon Technology Finance Announces Second Quarter 2021 Financial Results
HRZN,Horizon Technology Finance to Announce Second Quarter 2021 Financial Results
HRZN,Horizon Technology Finance Provides Second Quarter 2021 Portfolio Update
HRZN,Horizon Technology Finance Leads $10 Million Venture Loan to RepTrak
HRZN,Horizon Technology Finance Corporation Leads $8 Million Venture Loan Facility for LiquiGlide
HRZN,Horizon Technology Finance and Trinity Capital provide $40M venture loan to Nexii
HRZN,Trinity Capital : Horizon Technology Finance and Trinity Capital Provide $40 Million Venture Loan to Nexii
HRZN,Cerecor avails $10M under debt financing deal with Horizon Technology
HRZN,Horizon Technology Finance (HRZN) Q2 2021 Earnings Call Transcript
HTBI,"HomeTrust Bancshares, Inc. Announces Date of Annual Meeting of Stockholders"
HTBI,"HomeTrust Bancshares, Inc. Announces Fourth Quarter and Fiscal Year 2021 Financial Results and Quarterly Dividend"
HTBI,"HomeTrust Bancshares, Inc. Announces Completion of Previous Stock Repurchase Program and Authorization of New Stock Repurchase Program"
HTBI,"C. Hunter Westbrook Promoted to Chief Executive Officer of HomeTrust Bank and President of HomeTrust Bancshares, Inc."
HTBI,"Dow Jones Falls 325 Points, But Microsoft Stock Stands Tall; Footwear Maker Surges After Investor Day"
HTBI,"HomeTrust Bancshares EPS beats by $0.25, beats on revenue"
HTBI,"HomeTrust Bancshares announces new stock repurchase program, closes previous"
HTBI,Why HomeTrust Bancshares (HTBI) Might Surprise This Earnings Season
HTBI,HomeTrust Bancshares (HTBI) Earnings Expected to Grow: Should You Buy?
HTBI,Why You Shouldn't Bet Against HomeTrust Bancshares (HTBI) Stock
ICMB,"Investcorp Credit Management BDC, Inc. Schedules Earnings Release of Fourth Quarter Ended June 30, 2021"
ICMB,"Investcorp Credit Management BDC, Inc. Announces Preliminary Financial Results for the Quarter Ended June 30, 2021 and Quarterly Distribution"
ICMB,INVESTCORP CREDIT MANAGEMENT BDC : Management's Discussion and Analysis of Financial Condition and Results of Operations (form 10-K)
IDRA,BRIEF-Idera Pharmaceuticals Reports Q4 Loss Per Share $0.08
IDRA,Idera Pharmaceuticals Reports Second Quarter 2021 Financial Results and Provides Corporate Update
IDRA,"Thinking about buying stock in Entera Bio, Torchlight Energy, Idera Pharmaceuticals, Nikola Corp, or Orphazyme?"
IDRA,"Thinking about buying stock in Biocept, Histogen, Idera Pharmaceuticals, Satsuma Pharmaceuticals, or Clover Health Investments?"
IDRA,"Idera Pharmaceuticals stock plunges after disappointing trial results, prompting analyst downgrade"
IDRA,"Dow Jones Falls 325 Points, But Microsoft Stock Stands Tall; Footwear Maker Surges After Investor Day"
IDRA,Idera Pharmaceuticals up 22% following insider share purchase
IDRA,"Idera Pharmaceuticals, Beyond Air leads healthcare gainers; Mereo BioPharma, Portage Biotech among major losers"
INFN,GÉANT Delivers 800G Transmission on Research & Education Network with Infinera ICE6
INFN,Infinera Corporation Reports Second Quarter 2021 Financial Results
INFN,"Infinera to Announce Fiscal Second Quarter 2021 Financial Results on August 3, 2021"
INFN,"Dow Jones Falls 325 Points, But Microsoft Stock Stands Tall; Footwear Maker Surges After Investor Day"
INFN,Infinera (INFN) Q2 2021 Earnings Call Transcript
INFN,"Infinera (INFN) Reports Q2 Loss, Lags Revenue Estimates"
INFN,Infinera Corp. Q2 adjusted earnings Beat Estimates
INFN,"Infinera EPS beats by $0.02, misses on revenue"
INFN,Infinera Q2 2021 Earnings Preview
INGN,Short seller Carson Block targets medical device company Inogen
INGN,UPDATE 2-Short seller Carson Block targets medical device company Inogen
INGN,"Inogen (INGN) Shareholder Litigation Alert: Should Inogen Management be Held Accountable for Investors Losses? Contact Johnson Fistel, LLP Regarding Pending Derivative Case"
INGN,"Inogen stock suffers record plunge as chip shortage to hurt sales, margins for another year"
INGN,Inogen Announces Second Quarter 2021 Financial Results
INGN,"Inogen to Announce Second Quarter 2021 Financial Results on August 4, 2021"
INGN,Inogen Announces Appointment of General Counsel
INGN,"Dow Jones Falls 325 Points, But Microsoft Stock Stands Tall; Footwear Maker Surges After Investor Day"
INGN,Inogen (INGN) Stock Loses 26.7% In Spite of Q2 Earnings Beat
INGN,Inogen Stock Plunges As Supply Chain Constraints Pile Up To Hit 2H FY21; Analysts Downgrade Stock
INOV,Analytics-based tech firm Inovalon files for IPO
INOV,UPDATE 1-Analytics-based U.S. tech firm Inovalon files for IPO
INOV,Analytics-based U.S. tech firm Inovalon files for IPO
INOV,"SHAREHOLDER ALERT: Monteverde & Associates PC Announces an Investigation of Inovalon Holdings, Inc. - INOV"
INOV,"Lifshitz Law Firm, P.C. Announces Investigation of INOV, XENT, LMRK, and GTS"
INOV,"SHAREHOLDER INVESTIGATION: Halper Sadeh LLP Investigates CXP, ECHO, INOV, TRIL; Shareholders are Encouraged to Contact the Firm"
INOV,"SHAREHOLDER ALERT: WeissLaw LLP Reminds INOV, XONE, STMP, and NLOK Shareholders About Its Ongoing Investigations"
INOV,"INVESTIGATION: Halper Sadeh LLP Investigates INOV, SAFM, LMRK, AVCO, TRIL, XENT; Shareholders are Encouraged to Contact the Firm"
INOV,"Kaskela Law LLC Announces Shareholder Investigation of Inovalon Holdings, Inc. – INOV"
INOV,"SHAREHOLDER ALERT: Levi & Korsinsky, LLP Reminds Investors of an Investigation into the Fairness of the Merger of Inovalon with Nordic Capital"
INOV,"INOVALON MERGER INVESTIGATION ALERT - Andrews & Springer LLC Is Seeking More Cash for Shareholders of Inovalon Holdings, Inc. - INOV"
INOV,"MERGER ALERT - INOV, and SC: Levi & Korsinsky, LLP Reminds Investors of Investigations Concerning the Mergers of these Companies"
INOV,"SHAREHOLDER ALERT: WeissLaw LLP Reminds INOV, XONE, RAVN, and STMP Shareholders About Its Ongoing Investigations"
INOV,"SHAREHOLDER INVESTIGATION: Halper Sadeh LLP Investigates CXP, ECHO, INOV, HRC; Shareholders are Encouraged to Contact the Firm"
INOV,"SHAREHOLDER INVESTIGATION: Halper Sadeh LLP Investigates CXP, ECHO, INOV, TRIL; Shareholders are ..."
INOV,"Inovalon Holdings, Inc. -- Moody's says Inovalon's ratings are unaffected by the go-private transaction at this time"
INOV,"SHAREHOLDER ALERT: WeissLaw LLP Investigates Inovalon Holdings, Inc."
INOV,ASGN or INOV: Which Is the Better Value Stock Right Now?
INTC,"Thinking about trading options or stock in Affirm Holdings, American Airlines, Nio, Pfizer, or Intel Corp?"
INTC,Intel CEO Predicts Chips Will Be More Than 20% of Premium Vehicle BOM by 2030
INTC,Intel Names Bruce Andrews as Government Affairs Chief
INTC,Intel Appoints Bruce H. Andrews as Corporate Vice President and Chief Government Affairs Officer
INTC,Media Alert: Intel to Keynote at IAA Mobility
INTC,Intel to Provide Foundry Services in First Phase of U.S. Defense Department Program
INTC,Intel Wins US Government Project to Develop Leading-Edge Foundry Ecosystem
INTC,"Digital payments, chips: Where tech stock investors can find big opportunities after US-China trade war truceAdam Shell"
INTC,Intel tells companies to stop installing patch for security flaw as earnings loomElizabeth Weise
INTC,Intel chip design flaw that could let hackers access passwords prompts industrywide updatesElizabeth Weise
INTC,AMD is big winner from chip flaw fiasco as Intel stock value tanksTae Kim
INTC,Tech Five: GoPro stock surge continuesBrett Molina
INTC,Tech Five: Intel kicks off big earnings weekBrett Molina
INTC,Intel Corp. stock outperforms competitors on strong trading day
INTC,"Intel CEO says ‘big, honkin’ fab’ planned for Europe will be world’s most advanced"
INTC,"Dow's 140-point jump led by gains in shares of UnitedHealth, Intel"
INTC,Intel could cut server CPU prices to recapture market share from AMD
INTC,"Intel Brings NIO-Based Robotaxis To Europe, $115B Opportunity"
INTC,Chip Production Ramp-Up Will Boost Intel Stock
INTC,Micron Technology Stock Is Absolutely a Buy Now With These Massive Tailwinds
INTC,Buy Intel Before It Brings Chip Production to America
INTC,Why Nvidia Stock Dropped This Morning
INTC,Taiwan Semiconductor vs. Intel: Which Semiconductor Stock is a Better Buy?
INTC,Is Ambarella Stock a Buy?
INTC,"Stock Market News for Sep 10, 2021"
INTC,Intel (INTC) Dips More Than Broader Markets: What You Should Know
INTC,Juniper (JNPR) and Intel Ink Deal to Boost ORAN Ecosystem
INTC,Intel (INTC) Stock Moves -0.32%: What You Should Know
INTC,"Top Stock Reports for Abbott, Intel & QUALCOMM"
INTZ,INTZ seeks investors in pursuit of CBLoL franchise
INTZ,INTRUSION to Participate at the H.C. Wainwright Global Investment Conference on September 14
INTZ,Independent Product Testing Firm Ten Mile Square Technologies Confirms INTRUSION Shield’s Cyber Defense Capabilities
INTZ,INTRUSION Reports Second Quarter 2021 Results
INTZ,INTRUSION Research Shows Confidence in Teams and Technologies to Thwart Cyberattacks Yet Cyber Breaches Still Commonplace Suggesting False Sense of Security
INTZ,INTRUSION Announces It Has Discovered a Popular Mobile Gaming Site Directing Traffic to a Search Site Known for Malware Distribution
INTZ,"INTRUSION Announces Strategic Actions, Preliminary 2Q Revenues & Organizational Changes"
