Ticker,Headline
HFWA,Bryan D. McDonald Named President and Chief Operating Officer of Heritage Bank
HFWA,Democrats' tax plan would cut bills for most Americans -congressional estimate
HFWA,Generali says majority of directors back keeping Donnet as CEO
HFWA,Dow ends nearly 300 points lower despite cooler-than-expected inflation data
HFWA,"Dow Jones Falls 325 Points, But Microsoft Stock Stands Tall; Footwear Maker Surges After Investor Day"
HFWA,MicroStrategy's Bitcoin Pile Dwarfs Most S&P 500 Cash Holdings
HFWA,"US STOCKS-Financials drag Dow, S&P lower as data shows cooling inflation"
HFWA,Heritage Financial Corporation (HFWA) Q2 2021 Earnings Call Transcript
HFWA,Heritage Financial (HFWA) Q2 Earnings and Revenues Top Estimates
HFWA,"Heritage Financial EPS beats by $0.39, beats on revenue"
HFWA,Heritage Financial declares $0.20 dividend
HLBZ,Helbiz to Participate in the 6th Annual Colliers Securities Virtual Institutional Investor Conference
HLBZ,"Helbiz Partners With VOX to Launch a New Experiential Service to Explore the History of Washington, D.C."
HLBZ,Helbiz to Compete in First International eSkootr Championship
HLBZ,"Dow Jones Falls 325 Points, But Microsoft Stock Stands Tall; Footwear Maker Surges After Investor Day"
HLBZ,HLBZ Stock: What Is Going on With Red-Hot Helbiz Today?
HLBZ,"Pre-market Movers: HGEN, PMCB, CRDF, HLBZ, LULU…"
HLIO,Helios Technologies to Webcast Fireside Chat at the Morgan Stanley Virtual 9th Annual Laguna Conference
HLIO,Helios Technologies Appoints New Managing Director for Balboa Water Group
HLIO,Helios Technologies Second Quarter 2021 Revenue Grew 87% with Strong Organic Growth; Executing on Strategy to Achieve Accelerated Goals
HLIO,Helios Technologies Furthers ESG Program with Giving Initiative
HLIO,Helios Technologies Schedules Second Quarter 2021 Financial Results Release and Conference Call
HLIO,Helios Technologies Completes Acquisition of NEM S.r.l.
HLIO,"Dow Jones Falls 325 Points, But Microsoft Stock Stands Tall; Footwear Maker Surges After Investor Day"
HLIO,What Makes Helios Technologies (HLIO) a New Strong Buy Stock
HLIO,"Helios Technologies, inc (HLIO) Q2 2021 Earnings Call Transcript"
HLIO,Helios Technologies (HLIO) Q2 Earnings and Revenues Beat Estimates
HLIO,Helios Technologies earnings preview: what Wall Street is expecting
HLIO,Helios (HLIO) Stock Rises 14% in 3 Months: What's Driving It?
HLIT,ICCDS Gears Up for 10G with Converged FTTH and HFC Solution from Harmonic
HLIT,Harmonic ACHIEVE 2021 Summit Spotlights Success in Video Streaming
HLIT,Harmonic to Participate in Upcoming 2021 Virtual Investor Conferences
HLIT,Harmonic Appoints Dan Whalen to its Board of Directors
HLIT,"Thinking about buying stock in Autoweb, Processa Pharmaceuticals, Harmonic, Galmed Pharmaceuticals, or Sigma Labs?"
HLIT,Harmonic Announces Second Quarter 2021 Results
HLIT,Harmonic Announces Reporting Date for Second Quarter 2021 Results
HLIT,Harmonic Accelerates the UHD HDR Live Delivery Revolution with Public Cloud Support for Dolby Vision
HLIT,Claro Perú on Fast Track for Next-Gen Broadband with Harmonic
HLIT,What Did This CEO Just Do with Personal Shares of Harmonic (NASDAQ: HLIT)?
HLIT,Harmonic (HLIT) Enhances Parasat Cable TV's Broadband Capacity
HLIT,"Harmonic Inc (HLIT) President and CEO Patrick Harshman Sold $896,000 of Shares"
HLNE,Hamilton Lane Announces Pricing of Public Offering of Class A Common Stock
HLNE,Hamilton Lane Announces Public Offering of Class A Common Stock
HLNE,The Jordan Company Announces Successful Closing of $1.3 billion Continuation Fund Led by Hamilton Lane
HLNE,Hamilton Lane Announces Plan to Offset its Emissions through Projects that Cut Carbon and Improve Lives
HLNE,"Hamilton Lane to Participate at UBS Financial Services Virtual Conference on August 10, 2021"
HLNE,"Hamilton Lane Incorporated Reports First Quarter Fiscal 2022 Results, With Management & Advisory Fees Growing By 10% And Assets Under Management Growing By 34% Year-Over-Year"
HLNE,Hamilton Lane Impact Fund II Announces First Close on $149 Million
HLNE,"Hamilton Lane Incorporated to Announce First Quarter Fiscal 2022 Results on August 3, 2021"
HLNE,Hamilton Lane Commemorates 30-Year Anniversary
HLNE,"Hamilton Lane Incorporated (HLNE) Ex-Dividend Date Scheduled for September 14, 2021"
HLNE,Hamilton Lane Incorporated (HLNE) Q1 2022 Earnings Call Transcript
HLNE,Hamilton Lane (HLNE) Surpasses Q1 Earnings Estimates
HMPT,"FINAL DEADLINE TOMORROW: ROSEN, A TOP RANKED LAW FIRM, Encourages Home Point Capital Inc. Investors With Losses Exceeding $100K to Secure Counsel Before Important August 20 Deadline in Securities Class Action - HMPT"
HMPT,The Law Offices of Frank R. Cruz Reminds Investors of Looming Deadline in the Class Action Lawsuit Against Home Point Capital Inc. (HMPT)
HMPT,"Home Point Capital, Inc. Investors: Last Days to Participate Actively in the Class Action Lawsuit; Portnoy Law Firm"
HMPT,"FRIDAY DEADLINE: Investors with Substantial Losses Have Opportunity to Lead the Home Point Capital, Inc. Class Action Lawsuit – HMPT"
HMPT,"HMPT FRIDAY DEADLINE ALERT: ROSEN, TOP RANKED INVESTOR COUNSEL, Encourages Home Point Capital Inc. Investors to Secure Counsel Before Important August 20 Deadline in Securities Class Action – HMPT"
HMPT,"DEADLINE ALERT for OCGN, HMPT, TEDU, and ATHA: The Law Offices of Frank R. Cruz Reminds Investors of Class Actions on Behalf of Shareholders"
HMPT,"HMPT Deadline Alert: Bronstein, Gewirtz & Grossman, LLC Reminds Home Point Capital Inc. Investors of Class Action and Lead Plaintiff Deadline: August 20, 2021"
HMPT,"DEADLINE ALERT: Bragar Eagel & Squire, P.C. Reminds Investors That a Class Action Lawsuit Has Been Filed Against Home Point Capital, Inc. and Encourages Investors to Contact the Firm"
HMPT,"ROSEN, RESPECTED INVESTOR COUNSEL, Encourages Home Point Capital Inc. Investors With Losses to Secure Counsel Before Important August 20 Deadline in Securities Class Action - HMPT"
HMPT,"Dow Jones Falls 325 Points, But Microsoft Stock Stands Tall; Footwear Maker Surges After Investor Day"
HMPT,"FINAL DEADLINE TOMORROW: ROSEN, A TOP RANKED LAW FIRM, Encourages Home Point Capital Inc. Investors With Losses Exceeding $100K to Secure Counsel Before Important August 20 Deadline in Securities ..."
HMPT,Home Point Capital Inc. -- Moody's downgrades Home Point's senior unsecured debt rating to B3 from B2 and places ratings on review for downgrade
HMPT,Home Point Capital Inc. (HMPT) Q2 2021 Earnings Call Transcript
HMST,HomeStreet prices IPO at $44/share-source
HMST,"HomeStreet Bank President & CEO, Mark Mason, Rings Nasdaq Opening Bell in Honor of 100 Year Milestone"
HMST,HomeStreet Announces a $15 Million Expansion of Our Share Repurchase Program and Common Stock Dividend of $0.25 Per Share
HMST,HomeStreet Reports Second Quarter 2021 Results
HMST,Miss HomeStreet Hydroplane Comes in Third at the 2021 HAPO Columbia Cup
HMST,HomeStreet Reaches 100 Year Milestone
HMST,"HomeStreet Schedules Second Quarter 2021 Earnings Call for Tuesday, July 27, 2021"
HMST,"Dow Jones Falls 325 Points, But Microsoft Stock Stands Tall; Footwear Maker Surges After Investor Day"
HMST,How HomeStreet (HMST) Stock Stands Out in a Strong Industry
HMST,HomeStreet declares $0.25 dividend
HMST,HomeStreet (HMST) Q2 2021 Earnings Call Transcript
HMST,HomeStreet (HMST) Q2 Earnings and Revenues Top Estimates
HONE,"HarborOne Bank Earns Highest Possible Rating for Community Service, Lending, Investment"
HONE,"HarborOne Bancorp, Inc. Announces 2021 Second Quarter Earnings"
HONE,HarborOne Mortgage’s Camille Madden Named Mortgage Banker’s 2021 Powerful Women of Mortgage Banking
HONE,"HarborOne Bancorp, Inc. Declares Second Quarter Cash Dividend"
HONE,"Dow Jones Falls 325 Points, But Microsoft Stock Stands Tall; Footwear Maker Surges After Investor Day"
HONE,Why HarborOne Bancorp's Stock Is Trading Higher Today
HONE,HarborOne Bancorp (NASDAQ: HONE) shares are trading higher Thursday after the company reported fourth-quarter EPS results up from last year.
HOOD,"Don't expect major SEC attack on Robinhood business model, experts say"
HOOD,Robinhood discloses SEC is reviewing registration of stock sales by selling stockholders
HOOD,"Robinhood Markets, Inc. Files Amendment to Resale Registration Statement"
HOOD,A MemeMarkets Investigation: Is Robinhood a meme stock?
HOOD,Stock market pulls back from records at start of August's final trading day
HOOD,Robinhood stock drops after SEC chair tells Barron's banning PFOF is being considered
HOOD,"Robinhood Markets, Inc. Announces Partial Exercise of IPO Underwriters’ Over-Allotment Option to Purchase Additional Shares"
HOOD,Why Robinhood may be more than a 'meme stock phenomenon'
HOOD,3 Robinhood Stocks to Buy and Hold Forever
HOOD,79% of Robinhood Revenue Might Be Eliminated by the SEC
HOOD,4 Cheap Penny Stocks To Buy On Robinhood For Under $1 Right Now
HOOD,Robinhood Legal Chief Whistling Past Graveyard Of 80% Of Its Revenue
HOOD,1 Robinhood Stock That Could Crush the Market in the Long Run
HOOD,4 Reasons to Avoid Robinhood
HOOD,3 Top Robinhood Stocks Wall Street Loves
HOOD,Why Robinhood Stock Jumped in August
HOOD,Could Robinhood Lose Its Main Source of Revenue?
HOOD,What Will PayPal's New Stock Trading Platform Mean to Investors?
HOOD,PayPal's About to Take On Robinhood
HOOD,3 Robinhood Stocks to Buy Right Now
HOOD,The Top 50 Robinhood Stocks in September
BANX,"Dow Jones Falls 325 Points, But Microsoft Stock Stands Tall; Footwear Maker Surges After Investor Day"
BANX,"StoneCastle Financial NII misses by $0.02, misses on total investment income"
BANX,StoneCastle Financial shares drop on launch of $10.8M direct offering
BANX,StoneCastle Financial Corp hosts conference call for investors
BANX,StoneCastle Financial goes ex-dividend tomorrow
BANX,Here's what Wall Street expects from StoneCastle Financial's earnings
BELFB,"Bel to Participate in 10th Annual Needham Virtual Industrial Tech, Robotics, & Clean Tech 1x1 Conference on August 6, 2021"
BELFB,Bel Fuse Inc. Announces Regular Quarterly Cash Dividend on its Class A and Class B Shares
BELFB,Bel Reports Second Quarter 2021 Results
BELFB,"Bel Will Report Second Quarter 2021 Results on July 30, 2021"
BELFB,"Dow Jones Falls 325 Points, But Microsoft Stock Stands Tall; Footwear Maker Surges After Investor Day"
BELFB,Bel Fuse Inc Class B (BELFB) Q2 2021 Earnings Call Transcript
BELFB,"Bel Fuse EPS beats by $0.63, beats on revenue"
CCLP,CSI Compressco LP Announces Second Quarter 2021 Results
CCLP,CSI Compressco LP Announces Quarterly Distribution and Schedule for Second Quarter 2021 Earnings Release Conference Call and Webcast
CCLP,"KLX Energy Services, Gevo lead energy/material gainers; Loop Industries, CSI Compressco among major losers"
CCLP,"CSI Compressco EPS beats by $0.07, misses on revenue"
CCLP,Compressco Partners LP Partnership Units is about to announce its earnings — here's what Wall Street expects
CPIX,Cumberland Pharmaceuticals Reports Second Quarter 2021 Financial Results & Company Update
CPIX,Cumberland Pharmaceuticals To Announce Second Quarter 2021 Financial Results
CPIX,"Cumberland Pharmaceuticals Reports 2.5M Patient Doses Delivered, No Product Recalls, No FDA Issues in 2020"
CPIX,"Dow Jones Falls 325 Points, But Microsoft Stock Stands Tall; Footwear Maker Surges After Investor Day"
CPIX,Cumberland Pharmaceuticals (CPIX) Reports Break-Even Earnings for Q2
CPIX,"Cumberland Pharmaceuticals EPS beats by $0.18, beats on revenue"
CPIX,Cumberland Pharmaceuticals Inc hosts conference call for investors
DYAI,Dyadic to Present at H.C. Wainwright 23rd Annual Global Investment Conference
DYAI,Dyadic Reports Second Quarter 2021 Financial Results and Highlights Recent Company Progress
DYAI,"Thinking about buying stock in Dyadic Int, Seanergy Maritime, Cleveland-Cliffs, United States Steel, or Lightning Emotors?"
DYAI,Sorrento and Dyadic Announce Binding Term Sheet to License Dyadic’s Lead COVID-19 Vaccine Candidate “DYAI-100” and C1 Technology for Protein-Based Coronavirus Vaccines and Therapeutics
DYAI,Dyadic and Sorrento Announce Binding Term Sheet to License Dyadic’s Lead COVID-19 Vaccine Candidate “DYAI-100” and C1 Technology for Protein-Based Coronavirus Vaccines and Therapeutics
DYAI,Dyadic to Report Second Quarter 2021 Financial Results
DYAI,"Thinking about buying stock in Tyme Technologies, New Oriental Education, Dyadic International, KE Holdings, or Iterum Therapeutics?"
DYAI,Dyadic Announces Technology Transfer and Licensing Agreement With South Africa’s Rubic Consortium Aiming to Develop and Commercialize Vaccines for Distribution Throughout the African Continent
DYAI,"Dow Jones Falls 325 Points, But Microsoft Stock Stands Tall; Footwear Maker Surges After Investor Day"
EBIX,Judge tosses Indian booking site Yatra's suit over Ebix merger
EBIX,BRIEF-Vara and Ebix form JV
EBIX,India's Yatra scraps merger deal with U.S. firm Ebix
EBIX,Indian travel firm Yatra scraps merger deal with U.S.-based Ebix
EBIX,Goldman comes to aid of Ebix with buyout offer
EBIX,"Ebix Declares 7.5 Cent Quarterly Dividend, Payable September 15, 2021, to Shareholders of Record September 3, 2021"
EBIX,Ebix Announces Second Quarter Fiscal Year 2021 Financial Results
EBIX,"Ebix Hosts Q2 Investor Call Monday, August 9th at 11:00 a.m. ET"
EBIX,"Shareholder Alert: Robbins LLP is Investigating EBIX, Inc. (EBIX) for Shareholders"
EBIX,DTCC Partners With Ebix to Deliver New Solution to Address Increasing Challenges of Annuity Compliance
EBIX,"Lifshitz Law Firm, P.C. Announces Investigations of Athenex, Inc. (NasdaqGS:ATNX), Canoo, Inc. (NasdaqGS: GOEV), Ebix, Inc. (NasdaqGS: EBIX), and Intrusion, Inc. (NasdaqCM: INTZ)"
EBIX,"Goldman Sachs, Ebix call off deal amid probe"
EBIX,"Dow Jones Falls 325 Points, But Microsoft Stock Stands Tall; Footwear Maker Surges After Investor Day"
EVOK,Resurgent stock market evokes memories of long-gone bubble on Tokyo's 'Wall Street'
EVOK,"Resurgent stock market evokes memories of long-gone bubble on Tokyo's ""Wall Street"""
EVOK,Massive first day IPO gains evoke 'bubble' risk in Asian capital markets
EVOK,Evoke Pharma to Participate in the H.C. Wainwright 23rd Annual Global Investment Conference
EVOK,Evoke Pharma Reports Second Quarter 2021 Financial Results
EVOK,"Evoke Pharma to Report Second Quarter 2021 Financial Results on August 12, 2021"
EVOK,Evoke Pharma and EVERSANA Announce Support of The International Foundation for Gastrointestinal Disorders’ (IFFGD) August Gastroparesis Awareness Month
EVOK,Evoke Pharma Launches Gimoti® Patient and Physician Experience Program
EVOK,"Evoke Pharma, EVERSANA and The International Foundation for Gastrointestinal Disorders Announce Membership into IFFGD’s Industry Council"
EVOK,"Dow Jones Falls 325 Points, But Microsoft Stock Stands Tall; Footwear Maker Surges After Investor Day"
EVOK,Today’s Biggest Pre-Market Stock Movers: 10 Top Gainers and Losers on Monday
FCAP,"BRIEF-Karyopharm appoints Humphrey A.R.Gardner as senior VP, clinical development"
FCAP,"First Capital, Inc. (FCAP) Ex-Dividend Date Scheduled for September 15, 2021"
FCAP,"Why You Might Be Interested In First Capital, Inc. (NASDAQ:FCAP) For Its Upcoming Dividend"
FCAP,Clarify Pharma PLC : Clarify Pharma Makes First Capital Investment
FCAP,First Capital reports Q2 results
FCAP,First Capital declares $0.26 dividend
FCAP,Dispersion Holdings : Dispersion - First Capital Investment
FCAP,First Capital reports Q1 results
FLDM,Fluidigm to Participate in the Cantor Virtual Global Healthcare Conference
FLDM,Fluidigm to Participate in UBS Genomics 2.0 and MedTech Innovations Summit
FLDM,Fluidigm Announces Second Quarter 2021 Financial Results with Total Revenue of $31.0 Million
FLDM,Ultivue Announces Co-Marketing Agreement with Fluidigm for Biomarker Imaging Solutions for Precision Medicine
FLDM,Fluidigm Announces Collaboration Agreement with Imaging CRO ImaBiotech to Increase Biopharma Access to Imaging Mass Cytometry
FLDM,Fluidigm Announces Co-Marketing Agreement with Ultivue for Biomarker Imaging Solutions for Precision Medicine
FLDM,"Thinking about buying stock in Infinity Pharmaceuticals, US Well Services, Constellium, Fluidigm, or TAL Education?"
FLDM,Fluidigm Announces Conference Call and Webcast of Second Quarter 2021 Financial Results
FLDM,"Dow Jones Falls 325 Points, But Microsoft Stock Stands Tall; Footwear Maker Surges After Investor Day"
FLDM,"Fluidigm Q2 Earnings Ahead Of Street Expectations, But Sees Lower Revenues From COVID-19 Products"
FLDM,"Fluidigm EPS misses by $0.03, revenue in-line"
FLDM,Fluidigm and Ultivue ink co-marketing agreement
FLDM,Fluidigm earnings preview: what Wall Street is expecting
HJLI,BRIEF-Hancock Jaffe Laboratories prices IPO between $6 and $8 per share
HJLI,Hancock Jaffe Laboratories Announces $20 Million Registered Direct Offering Priced At-the-Market Under NASDAQ Rules
HJLI,Hancock Jaffe Presents New Positive Two-Year VenoValve Data at the Society for Vascular Surgery Annual Meeting
HJLI,"Thinking about buying stock in Hancock Jaffe Laboratories, Nikola Corp, New Oriental Education, Allied Healthcare, or American Airlines?"
HJLI,Hancock Jaffe Laboratories Gets Breakthrough Device Designation for VenoValve
HJLI,FDA Grants Breakthrough Device Designation Status for Hancock Jaffe's VenoValve
HJLI,Hancock Jaffe to Present at the Ladenburg Thalmann 2021 Healthcare Conference
HJLI,Hancock Jaffe Laboratories (HJLI) Stock Jumps 34% Within Month: Should You Bet On Them? – Own Snap
IBRX,"ImmunityBio Announces Positive Durable Responses in BCG Unresponsive Bladder Cancer Patients with a Complete Response Rate of 72%, Median Duration of Complete Response of 19.9 Months, and 85% Remaining Cystectomy-free in Phase 2/3 Trial"
IBRX,ImmunityBio Builds Commercial Team with the Appointment of Seasoned Marketing and Reimbursement Executives
IBRX,ImmunityBio Announces Oral Presentation of Phase 2/3 Clinical Trial Results of Patients with BCG-Unresponsive Bladder Cancer Carcinoma at the Upcoming American Urological Association’s Annual Meeting
IBRX,ImmunityBio Appoints Dr. Patrick Soon-Shiong to Global Chief Scientific and Medical Officer; Newly Created Role Will Lead Company’s Scientific Strategy and Global Expansion
IBRX,ImmunityBio Announces Authorization to Proceed with Phase 1/2/3 Randomized Trial in South Africa of Their Dual-Antigen T-Cell Vaccine as a Universal Boost in Previously Vaccinated Participants Against COVID-19
IBRX,ImmunityBio and NantOmics Announce Clinical Validation of a Proprietary Method to Identify Unique Targets for Immunotherapy in Individual Breast Cancer Patients
IBRX,ImmunityBio Gets FDA Authorization for Breast-Cancer Study
IBRX,"Dow Jones Falls 325 Points, But Microsoft Stock Stands Tall; Footwear Maker Surges After Investor Day"
JBSS,BRIEF-John B. Sanfilippo & Son Strategically Expands Its Branded Product Portfolio With The Acquisition Of Squirrel Brand LP
JBSS,"John B. Sanfilippo & Son, Inc. Announces Elevation of Frank S. Pellegrino to Chief Financial Officer"
JBSS,"John B. Sanfilippo & Son, Inc. Fourth Quarter Diluted EPS Increased 20.0% to a Fourth Quarter Record $1.07 per Share"
JBSS,"John B. Sanfilippo & Son, Inc. 4th Quarter and Fiscal 2021 Year-End Operating Results Conference Call"
JBSS,"John B. Sanfilippo & Son, Inc. Board Declares Special Cash Dividend of $2.30 per share of Common Stock and Class A Common Stock and Regular Annual Cash Dividend of $0.70 per share of Common Stock and Class A Common Stock"
JBSS,"Dow Jones Falls 325 Points, But Microsoft Stock Stands Tall; Footwear Maker Surges After Investor Day"
JBSS,John B. Sanfilippo & Son Posts Mixed Q4 Results
JBSS,John B. Sanfilippo & Son Declares Special Cash Dividend Of $2.30 Per Share
JBSS,John B San Filippo So earnings preview: what to expect
JBSS,"John B. Sanfilippo & Son EPS beats by $0.29, misses on revenue"
JBSS,Here's what Wall Street expects from John B San Filippo So's earnings report
JCS,Communications Systems Declares Special Dividend
JCS,"Communications Systems, Inc. Reports Second Quarter 2021 Financial Results"
JCS,Communications Systems Closes the Sale of its Transition Networks and Net2Edge Businesses to Lantronix
JCS,"Lantronix Completes Acquisition of Electronics and Software Reportable Business Segment from Communications Systems, Inc."
JCS,Communications Systems’ Special Meeting of Shareholders Approved the Sale of Its Transition Networks and Net2Edge Businesses to Lantronix
JCS,"INVESTIGATION ALERT: Halper Sadeh LLP Investigates AMRB, JCS, CADE, STL, EBSB, MNR; Shareholders are Encouraged to Contact the Firm"
JCS,"INVESTIGATION ALERT: Halper Sadeh LLP Investigates AMRB, NCBS, JCS, KSU, CADE, MRLN; Shareholders are Encouraged to Contact the Firm"
JCS,"Communications Systems, Inc. Announces $25.0 Million Equity Financing to Close Concurrently With CSI–Pineapple Merger and Fund Growth Initiatives"
JCS,"INVESTIGATION ALERT: Halper Sadeh LLP Investigates ATH, JCS, MX, CADE, KNL; Shareholders are Encouraged to Contact the Firm"
JCS,Communications Systems Shares Rise 19% on Special Dividend
JCS,Communications Systems Adds 16%; Sets Special Dividend
JCS,Mid-Afternoon Market Update: Dow Tumbles 300 Points; Communications Systems Shares Climb
JOUT,Johnson Outdoors Reports Fiscal Third Quarter Results
JOUT,"JOHNSON OUTDOORS to Release Fiscal 2021 Third Quarter Results on August 9, 2021"
JOUT,"Dow Jones Falls 325 Points, But Microsoft Stock Stands Tall; Footwear Maker Surges After Investor Day"
JOUT,Johnson Outdoors Stock Gains As Q3 Earnings Smashes Estimates On Strong Demand
JOUT,Johnson Outdoors inc (JOUT) Q3 2021 Earnings Call Transcript
JOUT,Johnson Outdoors is about to announce its earnings — here's what to expect
JOUT,Winnebago's purchase of pontoon boat maker contributes to broad rally in outdoors stocks
MARK,"IOC'S MARK ADAMS: RISING COVID-19 CASES UNFORTUNATELY NOT UNIQUE TO JAPAN, GREAT DEAL OF SYMPATHY FOR JAPANESE"
MARK,TEAM GB CHIEF MARK ENGLAND SAYS 'HUGELY CONFIDENT' TOKYO OLYMPICS WILL GO AHEAD THIS SUMMER
MARK,Remark Holdings to Participate in Upcoming Investor Conferences
MARK,Remark Holdings Announces Fiscal Second Quarter 2021 Financial Results
MARK,"Remark Holdings Sets Second Quarter 2021 Financial Results Call for August 23, 2021 at 4:30 p.m. ET"
MARK,Remark AI Finishes in Top 5 in Recent NIST Computer Vision Test
MARK,Remark Holdings Inc (MARK) Down 0.81% in Premarket Trading
MARK,Eamonn Holmes’ cheeky ‘hamster’ remark gets This Morning viewers fuming again
MARK,Who believes Taliban's remark it will ensure women's rights in Afghanistan?
MARK,"Remark Holdings (MARK) Reports Q2 Loss, Lags Revenue Estimates"
MMAT,"Shares of Meta Material, formerly Torchlight, reverse to trade down 20%"
MMAT,"Shares of Meta Material, formerly Torchlight, rise 6%"
MMAT,"UPDATE 1-Shares of Meta Material, formerly Torchlight, reverse to trade down 20%"
MMAT,"Thinking about buying stock in Meta Materials, Cellect Biotechnology, Forte Biosciences, Camber Energy, or Denison Mines?"
MMAT,"Thinking about buying stock in Meten Edtechx Education, Vinco Ventures, Lucid Group, Meta Materials, or Sundial Growers?"
MMAT,"Thinking about buying stock in Globalstar, New Oriental Education, Sundial Growers, Naked Brand, or Meta Materials?"
MMAT,"Thinking about buying stock in TAL Education, Newegg, Meta Materials, Zomedica, or Senseonics?"
MMAT,META Announces Renowned Scientists to Join New Scientific Advisory Board
MMAT,META Announces Second Quarter and H1 2021 Results
MMAT,META to Report Q2 2021 Results on August 12th
MMAT,META Announces Agreement to Acquire Nanotech Security Corp. for C$90.8 Million
MMAT,Dr. Hai Sun Joins META as Director of Lithography Manufacturing and Operations
MMAT,META Appoints Darren Ihmels as Vice President of Business Development Ophthalmics
MMAT,Meta Materials Inc (MMAT) has fallen 1.50% Tuesday In Premarket Trading
MMAT,Why Meta Materials Stock Soared on Monday
MMAT,MMAT Stock: One Big Reason Reddit Favorite Meta Materials Is Surging Today
MMAT,MMAT Stock: 5 Things to Know About Short-Squeeze Target Meta Materials as Shares Surge
MMAT,MMAT Stock: The Big Science News Lifting Meta Materials Higher Today
MMAT,Meta Materials Stock Has Catalysts But Has A Bloated Valuation
MMAT,Here's Why Meta Materials Stock Soared 32.9% Last Month
MMAT,"Meta Materials Stock Bounces, Tries To Push Higher: What's Next?"
MMAT,"Meta Materials Inc. (NASDAQ: MMAT) shares spiked higher Friday but pared those gains as the day went on, experiencing high volatility as Reddit and retail traders are trying to push the stock higher. The stock looked to have bounced near support and is heading back toward resistance."
NCSM,BRIEF-NCS Multistage Holdings files for IPO of up to $100 mln
NCSM,"NCS Multistage Holdings, Inc. To Participate in Upcoming Investor Conference"
NCSM,"NCS Multistage Holdings, Inc. Announces Second Quarter 2021 Results"
NCSM,"NCS Multistage Holdings, Inc. Schedules Second Quarter 2021 Earnings Release and Conference Call"
NCSM,"Dow Jones Falls 325 Points, But Microsoft Stock Stands Tall; Footwear Maker Surges After Investor Day"
NCSM,Democrats' tax plan would cut bills for most Americans -congressional estimate
NCSM,Generali says majority of directors back keeping Donnet as CEO
NCSM,MicroStrategy's Bitcoin Pile Dwarfs Most S&P 500 Cash Holdings
NCSM,"US STOCKS-Financials drag Dow, S&P lower as data shows cooling inflation"
NCSM,Why small caps could present the best opportunity as S&P 500 sits near records
NCSM,NCS Multistage earnings preview: what Wall Street is expecting
NCSM,51 Biggest Movers From Friday
NCSM,Gainers
NWS,BRIEF-NWS Holdings Expects Significant Reduction In Group's Profit Attributable For Financial Year Ending 30 June 2020
NWS,Hong Kong's NWS Holdings to buy FTLife Insurance for $2.8 billion
NWS,Hong Kong's NWS Holdings JV to buy Ireland's Sky Aviation
NWS,Hong Kong's NWS Holdings to buy FTLife Insurance for $2.75 bln
