Ticker,Headline
AAL,New American Airlines to trade under symbol 'AAL' on Nasdaq
AAL,"UPDATE 2-European stocks close higher on Wall St, airlines bounce"
AAL,"Thinking about trading options or stock in Affirm Holdings, American Airlines, Nio, Pfizer, or Intel Corp?"
AAL,"Thinking about trading options or stock in Affirm, Zscaler, BioNTech, Lululemon Athletica, or American Airlines?"
AAL,"Thinking about trading options or stock in Ford, AMC Entertainment, Apple, Nio, or American Airlines?"
AAL,"American Airlines stock drops after revenue warning, as rise in COVID-19 cases hurt bookings"
AAL,American Airlines to Webcast Remarks at Cowen Global Transportation & Sustainable Mobility Conference
AAL,"Thinking about trading options or stock in Anaplan, AMC Entertainment, Sunrun, American Airlines, or Alibaba?"
AAL,"Thinking about trading options or stock in Advanced Micro Devices, Palantir Technologies, American Airlines, Uber, or Pfizer?"
AAL,Warren Buffett & Berkshire Hathaway make key changes to 2019 stock picksJon C. Ogg
AAL,American announces record Q3 earningsBart Jansen
AAL,American Airlines posts record quarterly profitCharisse Jones
AAL,American reports record profits in the second quarterCharisse Jones
AAL,The 'new' American will trade on Nasdaq under 'AAL'Ben Mutzbaugh
AAL,American Airlines Group stock is no sure thingAdam Levine-Weinberg
AAL,"American Airlines Group Inc. stock rises Monday, outperforms market"
AAL,American Airlines (AAL) Outpaces Stock Market Gains: What You Should Know
AAL,American Airlines (AAL) Issues Profit Warning Due to Delta Variant
AAL,American Airlines says August revenue weaker than expected because of rise in Covid cases
AAL,What 5 Analyst Ratings Have To Say About American Airlines Group
AAL,"Within the last quarter, American Airlines Group (NASDAQ:AAL) has observed the following analyst ratings:"
AAL,Strength Seen in American Airlines (AAL): Can Its 5.6% Jump Turn into More Strength?
AAL,American Airlines Group Inc Ranked Among Today’s Top Shorts As COVID-19 Concerns Continue To Rise
AAL,Delta Variant-Led Drop in Travel Throws US Airlines Off Course
AAL,American Airlines (AAL) to End Unvaccinated Staff Special Leaves
AAL,American Airlines (AAL) Dips More Than Broader Markets: What You Should Know
AAL,3 Ways You Can Beat Warren Buffett in the Stock Market
AAL,Here's Why You Should Retain American Airlines (AAL) Now
AAL,American Airlines (AAL) Pilots to Picket Over Work Conditions
AAL,Airlines were counting on a post-Labor Day surge in business travel. It looks like that won't happen
AAL,Air-Traffic Recovery Adds Stimulus to Latin American Carriers
AAOI,9 tech companies are dangerously burning cashMatt Krantz
AAOI,"Dow Jones Falls 325 Points, But Microsoft Stock Stands Tall; Footwear Maker Surges After Investor Day"
AAOI,MicroStrategy's Bitcoin Pile Dwarfs Most S&P 500 Cash Holdings
AAOI,Blinken to host event marking anniversary of Israel-Arab normalization deals
AAOI,Does SPAR Group (NASDAQ:SGRP) Have A Healthy Balance Sheet?
AAOI,"US STOCKS-Financials drag Dow, S&P lower as data shows cooling inflation"
AAOI,Why small caps could present the best opportunity as S&P 500 sits near records
AAOI,"Applied Optoelectronics, inc (AAOI) Q2 2021 Earnings Call Transcript"
AAOI,"Applied Optoelectronics (AAOI) Reports Q2 Loss, Misses Revenue Estimates"
AAOI,"Applied Optoelectronics EPS beats by $0.03, beats on revenue"
AAOI,What Wall Street expects from Applied Optoelectronics's earnings
AAOI,Applied Optoelectronics (AAOI) May Report Negative Earnings: Know the Trend Ahead of Next Week's Release
ABSI,SHAREHOLDER ALERT: Pomerantz Law Firm Investigates Claims On Behalf of Investors of Absci Corporation - ABSI
ABSI,"Dow Jones Falls 325 Points, But Microsoft Stock Stands Tall; Footwear Maker Surges After Investor Day"
ACAD,Acadia Pharmaceuticals to Present at Upcoming Investor Conferences
ACAD,Acadia Pharmaceuticals Announces Executive Leadership Change
ACAD,"Lifshitz Law Firm, P.C. Announces Investigations of 3D Systems Corp. (NYSE: DDD), Acadia Pharmaceuticals, Inc. (NasdaqGS: ACAD), ChemoCentryx, Inc. (NasdaqGS: CCXI), and Peloton Interactive, Inc (NasdaqGS: PTON)"
ACAD,"Acadia Pharmaceuticals to Present at the Canaccord Genuity 41st Annual Growth Conference on August 12, 2021"
ACAD,Acadia Pharmaceuticals Reports Second Quarter 2021 Financial Results
ACAD,"Acadia Pharmaceuticals to Announce Second Quarter 2021 Financial Results on August 4, 2021"
ACAD,Acadia Pharmaceuticals to Present New Scientific Data on Pimavanserin in Neurodegenerative Diseases at the Alzheimer’s Association International Conference 2021 (AAIC)
ACAD,SHAREHOLDER ALERT: Pomerantz Law Firm Reminds Shareholders with Losses on their Investment in Acadia Pharmaceuticals Inc. of Class Action Lawsuit and Upcoming Deadline – ACAD
ACAD,"DEADLINE TOMORROW: The Schall Law Firm Reminds Investors of a Class Action Lawsuit Against ACADIA Pharmaceuticals Inc. and Encourages Investors with Losses in Excess of $100,000 to Contact the Firm"
ACAD,ACADIA Pharmaceuticals Inc. (ACAD) Stock: Do Analysts Think You Should Accumulate?
ACAD,"UNAM, GDS, CRWD and ACAD among after hours movers"
ACAD,Acadia (ACAD) Down 10.8% Since Last Earnings Report: Can It Rebound?
ACBI,"SHAREHOLDER INVESTIGATION: Halper Sadeh LLP Investigates ACBI, MSON, VICI, CSOD; Shareholders are Encouraged to Contact the Firm"
ACBI,"INVESTIGATION: Halper Sadeh LLP Investigates ECHO, ACBI, MSON, VICI, CSOD; Shareholders are Encouraged to Contact the Firm"
ACBI,"Lifshitz Law Firm, P.C. Announces Investigation of ACBI, GPX, HBMD, and QADA"
ACBI,"SHAREHOLDER INVESTIGATION: Halper Sadeh LLP Investigates VNE, MSON, ACBI, SBKK; Shareholders are Encouraged to Contact the Firm"
ACBI,"INVESTIGATION: Halper Sadeh LLP Investigates MSON, ACBI, SBKK, XONE, NWHM; Shareholders are Encouraged to Contact the Firm"
ACBI,"INVESTIGATION: Halper Sadeh LLP Investigates STFC, JAX, GPX, VNE, ACBI; Shareholders are Encouraged to Contact the Firm"
ACBI,"SHAREHOLDER INVESTIGATION: Halper Sadeh LLP Investigates ACBI, NLOK, XONE, IEC; Shareholders are Encouraged to Contact the Firm"
ACBI,"Lifshitz Law Firm, P.C. Announces Investigation of ACBI, FFWM, JAX, and VNE"
ACBI,"SHAREHOLDER ALERT: Rigrodsky Law, P.A. Reminds Investors of Investigation of MDLA, CMO, RPAI, and ACBI Mergers"
ACBI,"INVESTIGATION: Halper Sadeh LLP Investigates GPX, VNE, NWHM, ACBI; Shareholders are Encouraged to Contact the Firm"
ACBI,"Dow Jones Falls 325 Points, But Microsoft Stock Stands Tall; Footwear Maker Surges After Investor Day"
ACBI,"Moore Kuehn Encourages BTNB, DGNS, NWHM, and ACBI Investors to Contact Law Firm"
ACBI,"SHAREHOLDER ALERT: WeissLaw LLP Reminds MSON, VNE, ACBI, and NWHM Shareholders About Its Ongoing Investigations"
ACBI,"SHAREHOLDER ALERT: Monteverde & Associates PC Announces an Investigation of Atlantic Capital Bancshares, Inc. - ACBI"
ACER,Taiwan's Acer sees global chip shortage gradually easing
ACER,BRIEF-Acer Therapeutics Inc Anticipates Submitting ACER-001 NDA In H1 2021
ACER,Acer slates Microsoft's hardware push
ACER,Acer cancels smartphone launch with Alibaba at last minute
ACER,Acer upbeat on outlook despite challenges ahead
ACER,BRIEF-Taiwan's Acer says elects chairman
ACER,BRIEF-ACER unit ITS to merge with PKL
ACER,"The Rosen Law Firm, P.A. Announces Proposed Class Action Settlement on Behalf of Purchasers of Acer Therapeutics Inc. common stock – ACER"
ACER,Acer Therapeutics to Participate in H.C. Wainwright 23rd Annual Global Investment Conference
ACER,Acer Therapeutics Reports Q2 2021 Financial Results and Provides Corporate Update
ACER,Acer Therapeutics and Relief Therapeutics Announce Submission of a New Drug Application to the U.S. FDA for ACER-001 for Treatment of Urea Cycle Disorders
ACER,RELIEF THERAPEUTICS Holdings AG: Acer Therapeutics and Relief Therapeutics Announce Submission of a New Drug Application to the U.S. FDA for ACER-001 for Treatment of Urea Cycle Disorders
ACER,"Thinking about buying stock in NanoVibronix, TAL Education, Cleveland-Cliffs, Nikola Corp, or Acer Therapeutics?"
ACER,"This Acer Nitro 5 Packs a Punch, But That's About It"
ACER,"This Acer Predator Helios 300 gaming laptop proves 2021 is really, really strange"
ACER,"Dow Jones Falls 325 Points, But Microsoft Stock Stands Tall; Footwear Maker Surges After Investor Day"
ACER,"Acer, Relief Therapeutics submit ACER-001 NDA in U.S. for urea cycle disorders"
ACER,RELIEF THERAPEUTICS Holdings A : Acer Therapeutics and Relief Therapeutics Announce Submission of a New Drug Application to the U.S. FDA for ACER-001 for Treatment of Urea Cycle Disorders
ACHC,"Lutheran Health Network of Indiana, LLC and Acadia Healthcare Hold Groundbreaking Ceremony for New Behavioral Health Hospital in Fort Wayne"
ACHC,Acadia Healthcare Reports Second Quarter 2021 Results and Increases 2021 Guidance
ACHC,Acadia Healthcare Announces Date for Second Quarter 2021 Earnings Release
ACHC,Bronson Healthcare Partners With Acadia Healthcare to Build New Behavioral Health Hospital to Serve Southwest Michigan
ACHC,Acadia Healthcare Forms Joint Venture with Bronson Health to Build a New Behavioral Health Facility in Southwest Michigan
ACHC,Acadia Healthcare to sell UK operations for about $1.47 billion
ACHC,"Dow Jones Falls 325 Points, But Microsoft Stock Stands Tall; Footwear Maker Surges After Investor Day"
ACHC,"Acadia Healthcare (ACHC) Soars to 52-Week High, Time to Cash Out?"
ACHC,Why Is Acadia Healthcare (ACHC) Up 3.9% Since Last Earnings Report?
ACHC,Why Acadia Healthcare (ACHC) Stock Might be a Great Pick
ACHC,UHS vs. ACHC: Which Stock Should Value Investors Buy Now?
ACHC,Tenet Healthcare (THC) Expands Its Relationship With Cigna
ADV,"BRIEF-Cboe Global Markets Says June 2020 Options ADV Up 50%, U.S. Equities ADV Up 83% & Global FX Up 5% Over June 2019"
ADV,BRIEF-Cboe Global Markets Reports May Options ADV Up 21% Over May 2018
ADV,"BRIEF-Cboe Global Markets Reports November Total ADV For Options 7.2 Mln, Down 6.2%"
ADV,BRIEF-CBOE Global Markets Says Feb Options Total ADV Of 10.2 Mln Contracts​
ADV,BRIEF-CME Group March 2017 average daily volume (ADV) reaches 16.9 mln contracts
ADV,BRIEF-Triboo Media sets up new unit MOBOO ADV
ADV,BRIEF-Intercontinental Exchange's total futures & options contract ADV for April was 5.9
ADV,BRIEF-CBOE Holdings reports total March ADV of 4.3 mln contracts
ADV,Advantage Solutions to Participate at Upcoming Barclays Global Consumer Staples Conference
ADV,"Advantage Acquires Strong Analytics, Provider of AI and Machine Learning Solutions"
ADV,Advantage Solutions Reports Solid Second Quarter 2021 Financial Results and Raises 2021 Outlook
ADV,Advantage Solutions and Eversight Partner to Reinvent Trade Promotion
ADV,Advantage Solutions Announces Second Quarter 2021 Earnings Release Date and Conference Call
ADV,401(k) investors shouldn't let fear or politics keep them out of the stock marketNancy Tengler
ADV,"Dow Jones Falls 325 Points, But Microsoft Stock Stands Tall; Footwear Maker Surges After Investor Day"
ADV,Advantage Solutions Inc (ADV) Q2 2021 Earnings Call Transcript
ADV,Advantage Solutions Inc Registered Shs -A- hosts conference call for investors
ADV,Here's what Wall Street expects from Advantage Solutions A's earnings report
ADV,"HEAR, ISRG, NFLX and ADV among after-hours movers"
ADVM,BRIEF-Adverum Biotech Announces New Mid-Stage Trial For ADVM-022 In Diabetic Macular Edema
ADVM,BRIEF-Adverum Biotechnologies Doses First Patient In Cohort 4 Of OPTIC Phase 1 Clinical Trial Of ADVM-022
ADVM,BRIEF-Adverum Biotechnologies Announces Long-Term Preclinical Efficacy Data On ADVM-022 Gene Therapy In Wet AMD
ADVM,BRIEF-Adverum Biotechnologies Reports New Interim Data From Cohorts 1 & 2 Of Optic Phase 1 Trial Of ADVM-022
ADVM,BRIEF-Adverum Biotechnologies provides update on Alpha-1 antitrypsin deficiency program
ADVM,BRIEF-Adverum Biotechnologies announces data on gene therapy candidates for treatment of wet AMD
ADVM,BRIEF-Adverum Biotechnologies Provides 2018 Outlook
ADVM,BRIEF-Adverum Biotechnologies says delivered notice to Regenxbio
ADVM,BRIEF-Adverum Biotechnologies Announces Completion Of Dosing Of First Cohort
ADVM,Is Adverum Biotechnologies Inc (ADVM) Stock a Attractive Value?
ADVM,Adverum Biotechnologies EPS misses by $0.07
AEIS,Advanced Energy Names Eduardo Bernal as Chief Operations Officer
AEIS,Advanced Energy to Participate at Upcoming Investor Conferences
AEIS,Advanced Energy Announces Second Quarter 2021 Results and $200 Million Share Repurchase Authorization
AEIS,Advanced Energy Launches Programmable DC Power Supplies for the Test and Measurement Market
AEIS,Advanced Energy Declares Quarterly Cash Dividend
AEIS,Advanced Energy to Announce Second Quarter 2021 Results on August 4
AEIS,"Dow Jones Falls 325 Points, But Microsoft Stock Stands Tall; Footwear Maker Surges After Investor Day"
AEIS,Advanced Energy Says Eduardo Bernal Joined As COO - Quick Facts
AEIS,"Advanced Energy Industries, inc (AEIS) Q2 2021 Earnings Call Transcript"
AEIS,Advanced Energy Industries (AEIS) Q2 Earnings and Revenues Lag Estimates
AEIS,Advanced Energy (AEIS) Down 2.3% Since Last Earnings Report: Can It Rebound?
AFIB,"Alcohol, caffeine are common triggers of irregular heart rhythm"
AFIB,Acutus Medical Appoints Niamh Pellegrini to Board of Directors
AFIB,Acutus Medical Reports Second Quarter 2021 Financial Results
AFIB,"AcQMap 8, Acutus Medical’s Innovative Suite of Software Upgrades, Receives FDA Clearance and CE Mark"
AFIB,Acutus Medical to Participate at the 6th Annual Needham Virtual Med Tech & Diagnostics 1x1 Conference
AFIB,Acutus Medical to Announce Second Quarter 2021 Financial Results
AFIB,HRS 2021: EP Experts to Demonstrate the Benefits of Acutus Medical’s Complete Suite of EP Technologies
AFIB,AliveCor and Acutus Medical Partner to Evaluate Management and Treatment of Cardiac Arrhythmias
AFIB,"Acutus Medical, Inc. Announces Full Exercise of Underwriter’s Option to Purchase Additional Shares"
AFIB,"Thinking about buying stock in Veoneer, Abeona Therapeutics, ConforMIS, Neurobo Pharmaceuticals, or Acutus Medical?"
AFIB,"Thinking about buying stock in Xeris Pharmaceuticals, Acutus Medical, Vascular Biogenics, Nokia, or TAL Education Group?"
AFIB,"Dow Jones Falls 325 Points, But Microsoft Stock Stands Tall; Footwear Maker Surges After Investor Day"
AFIB,"Acutus Medical, Inc. (AFIB) Q2 2021 Earnings Call Transcript"
AFIB,"Acutus Medical, Inc. (AFIB) Reports Q2 Loss, Tops Revenue Estimates"
AFIB,Acutus Medical Inc Registered Shs hosts conference call for investors
AFIB,Here's what Wall Street expects from Acutus Medical's earnings
AFIN,"BRIEF-American Finance Trust, Inc. to acquire American Realty Capital"
AFIN,American Finance Trust Announces Second Quarter 2021 Results
AFIN,American Finance Trust Announces Release Date For Second Quarter 2021 Results
AFIN,American Finance Trust Announces Common Stock Dividend for Third Quarter 2021
AFIN,American Finance Trust Announces Preferred Stock Dividends
AFIN,American Finance Trust: 7.375% Shares Are Still Attractive Thanks To Superior Dividend And Asset Coverage Ratio
AFIN,"American Finance Trust, Inc. (AFIN) Q2 2021 Earnings Call Transcript"
AFIN,American Finance Trust (AFIN) Surpasses Q2 FFO and Revenue Estimates
AFIN,"American Finance Trust FFO in-line, beats on revenue"
AFIN,American Finance Trust Inc Registered Shs hosts conference call for investors
AFRM,"Thinking about trading options or stock in Affirm Holdings, American Airlines, Nio, Pfizer, or Intel Corp?"
AFRM,"Thinking about trading options or stock in Affirm, Zscaler, BioNTech, Lululemon Athletica, or American Airlines?"
AFRM,Affirm stock surges 20% after revenue beat and positive outlook
AFRM,Affirm Reports Fourth Quarter and Fiscal Year 2021 Results
AFRM,Affirm to Participate in the Deutsche Bank Technology Conference
AFRM,Affirm stock rockets as Amazon BNPL deal may tell a bigger story
AFRM,"Thinking about trading options or stock in Affirm, Apple, Ford, Workday, or Nio?"
AFRM,"Affirm stock skyrockets 40% on news Amazon to partner with buy now, pay later fintech company"
AFRM,Why Is Affirm Plunging on Monday?
AFRM,"Affirm Stock Takes Breather After Breathtaking Post-IPO Share Price Rise; Inked Deals With Walmart, Peloton, Amazon ..."
AFRM,Up 70% This Month! Is Affirm Still a Buy Right Now?
AFRM,Analyst Ratings For Affirm Holdings
AFRM,Affirm Holdings (NASDAQ:AFRM) has observed the following analyst ratings within the last quarter:
AFRM,Buy SoFi Stock While It Is Still a Hidden Gem
AFRM,Historic September Markets Pervade; AFRM Jumps 17%
AFRM,What Will PayPal's New Stock Trading Platform Mean to Investors?
AFRM,Affirm Soars on Amazon Partnership
AFRM,"This Growth Stock Is Buy Now, Pay Later's New Most Valuable Player"
AFRM,Here's Why the Market Cheered Affirm and Bill.com
AFRM,2 Yellow Flags Affirm Investors Should Keep an Eye on After Strong Earnings
AFRM,Why Affirm Stock Soared 34% Today
AFRM,New Deal With Amazon Could Make Affirm Unstoppable
AFRM,"Affirm's (AFRM) Q4 Earnings Miss, Revenues Beat, Stock Gains"
AFRM,"3 Reasons to Buy Affirm Holdings, and 1 Reason to Sell"
AINV,TEXT-S&P revises Apollo Investment Corp outlook to stable
AINV,"Apollo Investment Corporation Reports Financial Results for the Quarter Ended June 30, 2021"
AINV,Apollo Investment Corporation Prices Public Offering of $125 Million 4.500% Unsecured Notes Due 2026
AINV,Apollo Investment Corporation Schedules Earnings Release and Conference Call for First Quarter Fiscal Year 2022
AINV,Apollo (AINV) falls 0.29% for September 13
AINV,"Apollo Investment NII in-line, misses on total investment income"
AINV,Apollo Investment FQ1 2022 Earnings Preview
AINV,Apollo Investment prices $125 notes
AKBA,Akebia Therapeutics Reports Inducement Grants Under Nasdaq Listing Rule 5635(c)(4)
AKBA,Akebia Therapeutics Announces September 2021 Investor Conference Schedule
AKBA,Akebia Therapeutics Reports Second Quarter 2021 Financial Results and Highlights Recent Company Milestones
AKBA,"INVESTIGATION ALERT: The Schall Law Firm Announces it is Investigating Claims Against Akebia Therapeutics, Inc. and Encourages Investors who Formerly Held Shares of Keryx Biopharmaceuticals (KERX) to Contact the Firm"
AKBA,"SHAREHOLDER ALERT: Robbins LLP Announces that Akebia Therapeutics, Inc. (AKBA) is Being Sued for Misleading Keryx Biopharmaceuticals, Inc. (KERX) Shareholders Ahead of Merger"
AKBA,Akebia Therapeutics to Report Second Quarter 2021 Financial Results and Discuss Recent Business Highlights
AKBA,"Thinking about buying stock in Ion Geophysical, Moneygram International, Akebia Therapeutics, iBio, or Exela Technologies?"
AKBA,Biotech IPO Akebia Therapeutics gains 24% in first dayMatt Krantz
AKBA,"Dow Jones Falls 325 Points, But Microsoft Stock Stands Tall; Footwear Maker Surges After Investor Day"
AKBA,"Akebia Therapeutics, inc (AKBA) Q2 2021 Earnings Call Transcript"
AKBA,Why Akebia Therapeutics Stock Is Soaring Today
AKBA,"Akebia Therapeutics (AKBA) Reports Q2 Loss, Misses Revenue Estimates"
AMAL,"Dow Jones Falls 325 Points, But Microsoft Stock Stands Tall; Footwear Maker Surges After Investor Day"
AMAL,Amalgamated Financial (AMAL) Q2 Earnings and Revenues Lag Estimates
AMAL,Here's what Wall Street expects from Amalgamated Financial's earnings report
AMAL,Amalgamated Financial (AMAL) Earnings Expected to Grow: Should You Buy?
AMAL,Amalgamated Financial (AMAL) Q1 Earnings Beat Estimates
AMEH,"Apollo Medical Holdings, Inc. to Participate in Upcoming Investor Conferences"
AMEH,"Apollo Medical Holdings, Inc. Announces Closing of CAIPA MSO Strategic Investment"
AMEH,"Apollo Medical Holdings, Inc. Reports Second Quarter 2021 Results, Raises Full-Year 2021 Guidance"
AMEH,"Apollo Medical Holdings, Inc. Schedules 2021 Second Quarter Financial Results Release and Conference Call"
AMEH,"Apollo Medical Holdings, Inc. Announces Affiliate's Entry into Agreement to Acquire a Controlling Stake in Access Primary Care Medical Group"
AMEH,"Apollo Medical Holdings, Inc. Affiliate Allied Pacific of California IPA to Partner with Shriners Children's Southern California in Opening a New Specialty Pediatric Satellite Clinic"
AMEH,"Apollo Medical Holdings, Inc. Announces Successful Completion of Debt Refinancing, Reducing Annual Interest Rate Spread by 50 Basis Points"
AMEH,"Dow Jones Falls 325 Points, But Microsoft Stock Stands Tall; Footwear Maker Surges After Investor Day"
AMEH,MicroStrategy's Bitcoin Pile Dwarfs Most S&P 500 Cash Holdings
AMGN,Amgen And The Lundquist Institute Announce That Diadem Therapeuctics Will Receive The First Amgen Golden Ticket To BioLabs LA
AMGN,Amgen To Present At The 2021 Bank of America Merrill Lynch Global Healthcare Conference
AMGN,Amgen To Webcast Investor Call At ESMO 2021
AMGN,Amgen To Showcase New Data From Inflammation Portfolio At EADV Virtual Congress 2021
AMGN,Amgen Lung Cancer Treatment to Be Used by UK National Health Service
AMGN,Amgen to Present at the 19th Annual Morgan Stanley Global Healthcare Conference
AMGN,Amgen Presents New Data From Thoracic Oncology Portfolio At WCLC21
AMGN,Moderna stock extends rally after price target gets a 77% boost at Morgan Stanley
AMGN,Amgen to Present at the 16th Annual Citi BioPharma Conference
AMGN,Amgen Inc. stock outperforms competitors on strong trading day
AMGN,These Promising Clinical Results Could Be Huge for Amgen Investors
AMGN,"IBB, AMGN, GILD, REGN: ETF Outflow Alert"
AMGN,Amgen (AMGN) Outpaces Stock Market Gains: What You Should Know
AMGN,"Stock Market News for Sep 10, 2021"
AMGN,Amgen (AMGN) Down 2.2% Since Last Earnings Report: Can It Rebound?
AMNB,American National Bankshares Reports Second Quarter Earnings of $10.8 Million ($.99 Per Share)
AMNB,American National Bankshares Inc. Declares Quarterly Dividend
AMNB,"Dow Jones Falls 325 Points, But Microsoft Stock Stands Tall; Footwear Maker Surges After Investor Day"
AMNB,Earnings Estimates Rising for American National Bankshares (AMNB): Will It Gain?
AMNB,American National Bankshares (AMNB) Q2 Earnings and Revenues Beat Estimates
AMNB,"American National Bankshares EPS beats by $0.22, beats on revenue"
AMNB,American National Bankshares declares $0.27 dividend
AMNB,American National Bankshares (AMNB) Earnings Expected to Grow: Should You Buy?
AMNB,4 Reasons to Add First Bancorp (FBNC) Stock to Your Portfolio
AMPH,Amphastar Pharmaceuticals to Present at the Wells Fargo 2021 Virtual Healthcare Conference
AMPH,"Amphastar Pharmaceuticals Reports Financial Results for the Three Months Ended June 30, 2021"
AMPH,"Amphastar Pharmaceuticals to Release Second Quarter Earnings and Hold Conference Call on August 9th, 2021"
AMPH,"Dow Jones Falls 325 Points, But Microsoft Stock Stands Tall; Footwear Maker Surges After Investor Day"
AMPH,"Amphastar Pharmaceuticals, inc (AMPH) Q2 2021 Earnings Call Transcript"
AMPH,Amphastar Pharmaceuticals (AMPH) Meets Q2 Earnings Estimates
AMPH,Amphastar Pharmaceuticals earnings preview: what to expect
AMTB,"Amerant Announces Planned Clean-Up Merger to Simplify Its Capital Structure, As Well as the Approval of a Class A Common Stock Repurchase Program"
AMTB,Amerant Bank Selects Alloy to Automate Identity Verification in Customer Onboarding
AMTB,"Amerant Reports Second Quarter 2021 Net Income of $16.0 Million, Diluted Earnings Per Share of $0.42"
AMTB,Zimmerman Tapped As Amerant Bank's Agency Of Record New Marketing Strategy Will Be Tailored to Fulfill Business Growth Goals
AMTB,"Amerant Bancorp Inc. to Announce Second Quarter 2021 Financial Results and Host Conference Call July 22, 2021"
AMTB,Amerant Names Christine Esteve as Chief Marketing Officer
AMTB,"AMERANT BANCORP INC. : Other Events, Financial Statements and Exhibits (form 8-K)"
AMTB,"Amerant Bancorp : ANNOUNCES PLANNED CLEAN-UP MERGER TO SIMPLIFY ITS CAPITAL STRUCTURE, AS WELL AS THE APPROVAL OF A CLASS A COMMON STOCK REPURCHASE PROGRAM (Form 8-K)"
AMTB,Amerant Bancorp (AMTB) Q2 2021 Earnings Call Transcript
AMTB,"Amerant Bancorp EPS beats by $0.08, beats on revenue"
AMTB,Amerant Bancorp Inc. (AMTB) Beats Q2 Earnings and Revenue Estimates
ANAB,AnaptysBio to Participate in the H.C. Wainwright 23rd Annual Global Investment Conference
ANAB,AnaptysBio Up 10% on GSK Drug Indication Approval
ANAB,AnaptysBio Announces Second Quarter 2021 Financial Results and Provides Pipeline Updates
ANAB,AnaptysBio Says EC Approval of Jemperli Triggers Milestone Payment
ANAB,AnaptysBio Says JEMPERLI Drug Gets FDA Approval
ANAB,"Dow Jones Falls 325 Points, But Microsoft Stock Stands Tall; Footwear Maker Surges After Investor Day"
ANAB,"AnaptysBio, Inc. (ANAB) Reports Q2 Loss, Tops Revenue Estimates"
ANAB,AnaptysBio gains after report the company received a takeover offer
ANDE,"Dow Jones Falls 325 Points, But Microsoft Stock Stands Tall; Footwear Maker Surges After Investor Day"
ANDE,The Andersons declares $100M buyback
ANGO,AngioDynamics to Present at the Canaccord Genuity Virtual Growth Conference
ANGO,AngioDynamics Reports Fiscal 2021 Fourth Quarter and Full-Year Financial Results
ANGO,"AngioDynamics Announces Details for Investor & Technology Day on July 13, 2021"
ANGO,"AngioDynamics to Report Fiscal 2021 Fourth Quarter and Full-Year Financial Results and Host Investor & Technology Day on July 13, 2021"
ANGO,AngioDynamics' (NASDAQ:ANGO) investors will be pleased with their stellar 194% return over the last year
ANGO,Why Is AngioDynamics (ANGO) Up 2.3% Since Last Earnings Report?
ANGO,"AngioDynamics (ANGO) Q4 Earnings Match Estimates, Revenues Top"
ANGO,Angiodynamics Inc (ANGO) Q4 2021 Earnings Call Transcript
ANIK,Anika to Participate in the Morgan Stanley 19th Annual Global Healthcare Conference
ANIK,Anika to Debut Joint Preservation Portfolio at the 2021 AAOS Annual Meeting
ANIK,Anika Reports Second Quarter 2021 Financial Results
ANIK,"Anika to Issue Second Quarter 2021 Financial Results on Thursday, August 5, 2021"
ANIK,First Anika WristMotion® Total Wrist Arthroplasty Surgery Performed
