Symbol,Name,Last Sale,Net Change,% Change,Market Cap,Country,IPO Year,Volume,Sector,Industry
OMIC,Singular Genomics Systems Inc. Common Stock,$14.88,-2.03,-12.005%,1064753667.00,United States,2021,136714,Health Care,Medical/Dental Instruments
ON,ON Semiconductor Corporation Common Stock,$47.64,0.75,1.599%,20510554532.00,United States,,5017792,Technology,Semiconductors
ONCR,Oncorus Inc. Common Stock,$10.15,-0.02,-0.197%,261354431.00,United States,2020,60364,Consumer Durables,Specialty Chemicals
ONCS,OncoSec Medical Incorporated Common Stock,$2.06,-0.04,-1.905%,80721617.00,United States,,106802,Health Care,Biotechnology: In Vitro & In Vivo Diagnostic Substances
ONCT,Oncternal Therapeutics Inc. Common Stock,$4.25,0.02,0.473%,209887300.00,United States,,395340,Health Care,Biotechnology: Pharmaceutical Preparations
ONDS,Ondas Holdings Inc. Common Stock,$7.50,0.09,1.215%,297501645.00,United States,,435502,Capital Goods,Telecommunications Equipment
ONEM,1Life Healthcare Inc. Common Stock,$24.95,0.74,3.057%,4837865953.00,United States,2020,3004919,Technology,Computer Software: Prepackaged Software
ONEW,OneWater Marine Inc. Class A Common Stock,$37.85,-0.22,-0.578%,569227058.00,United States,2020,61308,Basic Industries,Homebuilding
OPBK,OP Bancorp Common Stock,$9.92,-0.04,-0.402%,150123397.00,United States,2018,13132,Finance,Commercial Banks
OPCH,Option Care Health Inc. Common Stock,$25.45,-0.54,-2.078%,4577662996.00,United States,,1095688,Health Care,Medical/Nursing Services
OPEN,Opendoor Technologies Inc Common Stock,$17.76,-0.99,-5.28%,10738426966.00,United States,,11897693,Finance,Real Estate
OPGN,OpGen Inc. Common Stock,$3.00,-0.25,-7.692%,114810750.00,United States,2015,3149758,Health Care,Medical Specialities
OPK,OPKO Health Inc. Common Stock,$3.58,0.02,0.562%,2438562176.00,United States,,3436083,Health Care,Biotechnology: In Vitro & In Vivo Diagnostic Substances
OPNT,Opiant Pharmaceuticals Inc. Common Stock,$18.27,0.21,1.163%,80382062.00,United States,,27940,Health Care,Biotechnology: Pharmaceutical Preparations
OPRT,Oportun Financial Corporation Common Stock,$24.45,0.30,1.242%,685753869.00,United States,2019,35455,Finance,Finance Companies
OPRX,OptimizeRx Corporation Common Stock,$65.65,-3.20,-4.648%,1156661550.00,United States,,186409,Health Care,Managed Health Care
OPTN,OptiNose Inc. Common Stock,$2.76,-0.12,-4.167%,147132873.00,United States,2017,157632,Health Care,Biotechnology: Pharmaceutical Preparations
ORGO,Organogenesis Holdings Inc. Class A Common Stock,$15.38,-1.35,-8.069%,1977618859.00,United States,2016,2723694,Health Care,Biotechnology: Pharmaceutical Preparations
ORGS,Orgenesis Inc. Common Stock,$5.02,-0.04,-0.791%,110914239.00,United States,,118291,Health Care,Biotechnology: Pharmaceutical Preparations
ORIC,Oric Pharmaceuticals Inc. Common Stock,$24.35,-0.53,-2.13%,957385654.00,United States,2020,188176,Health Care,Biotechnology: Pharmaceutical Preparations
ORLY,O'Reilly Automotive Inc. Common Stock,$587.38,-4.98,-0.841%,40500872454.00,United States,1993,377268,Consumer Services,Other Specialty Stores
OSBC,Old Second Bancorp Inc. Common Stock,$12.15,0.27,2.273%,348799005.00,United States,,164322,Finance,Major Banks
OSIS,OSI Systems Inc. Common Stock (DE),$94.44,-0.57,-0.60%,1689701120.00,United States,1997,136830,Capital Goods,Industrial Machinery/Components
OSMT,Osmotica Pharmaceuticals plc Ordinary Shares,$3.06,-0.08,-2.548%,192428629.00,United States,2018,105479,Health Care,Biotechnology: Pharmaceutical Preparations
OSPN,OneSpan Inc. Common Stock,$19.99,0.96,5.045%,803809054.00,United States,,772482,Technology,EDP Services
OSS,One Stop Systems Inc. Common Stock,$5.68,-0.13,-2.238%,105811987.00,United States,2018,118897,Technology,Computer Manufacturing
OSTK,Overstock.com Inc. Common Stock,$70.76,1.90,2.759%,3043614740.00,United States,2002,858837,Consumer Services,Catalog/Specialty Distribution
OTIC,Otonomy Inc. Common Stock,$1.53,0.05,3.378%,86722412.00,United States,2014,705768,Health Care,Biotechnology: Pharmaceutical Preparations
OTLK,Outlook Therapeutics Inc. Common Stock,$2.52,0.03,1.205%,441859756.00,United States,2016,592175,Health Care,Biotechnology: Pharmaceutical Preparations
OTTR,Otter Tail Corporation Common Stock,$56.54,-1.19,-2.061%,2348633944.00,United States,,133783,Public Utilities,Electric Utilities: Central
OXLC,Oxford Lane Capital Corp. Common Stock,$7.18,0.04,0.56%,826418000.00,United States,2011,1108028,Finance,Investment Managers
OYST,Oyster Point Pharma Inc. Common Stock,$14.06,-0.36,-2.497%,365765571.00,United States,2019,62623,Health Care,Biotechnology: Pharmaceutical Preparations
PAA,Plains All American Pipeline L.P. Common Units representing Limited Partner Interests,$9.93,0.26,2.689%,7123499750.00,United States,1998,4284754,Energy,Oil & Gas Production
PACW,PacWest Bancorp Common Stock,$42.34,0.58,1.389%,5061661770.00,United States,,623470,Finance,Major Banks
PAGP,Plains GP Holdings L.P. Class A Units representing Limited Partner Interests,$10.34,0.29,2.886%,2007240805.00,United States,,1105738,Energy,Oil & Gas Production
PALI,Palisade Bio Inc. Common Stock,$2.89,-0.11,-3.667%,32942237.00,United States,,325626,Health Care,Biotechnology: Pharmaceutical Preparations
PANL,Pangaea Logistics Solutions Ltd. Common Shares,$5.60,0.22,4.089%,255437504.00,United States,1996,532526,Transportation,Marine Transportation
PASG,Passage Bio Inc. Common Stock,$10.82,-0.36,-3.22%,585292503.00,United States,2020,274255,Health Care,Biotechnology: Pharmaceutical Preparations
PATK,Patrick Industries Inc. Common Stock,$81.16,1.86,2.346%,1921125212.00,United States,,102485,Consumer Services,Other Specialty Stores
PAVM,PAVmed Inc. Common Stock,$7.88,-0.22,-2.716%,667968633.00,United States,2016,1963945,Health Care,Industrial Specialties
PAYA,Paya Holdings Inc. Class A Common Stock,$10.97,0.04,0.366%,1397362812.00,United States,,1340730,Technology,Computer Software: Prepackaged Software
PAYO,Payoneer Global Inc. Common Stock,$9.57,-0.22,-2.247%,3240727437.00,United States,,1458032,Technology,EDP Services
PAYS,Paysign Inc. Common Stock,$2.96,-0.36,-10.843%,151291319.00,United States,,942669,Finance,Investment Bankers/Brokers/Service
PBLA,Panbela Therapeutics Inc. Common Stock,$2.26,-0.15,-6.224%,30348991.00,United States,,72982,Health Care,Biotechnology: Pharmaceutical Preparations
PCB,PCB Bancorp Common Stock,$19.94,-0.06,-0.30%,295597679.00,United States,2018,96712,Finance,Major Banks
PCRX,Pacira BioSciences Inc. Common Stock,$55.54,0.14,0.253%,2469019148.00,United States,2011,216996,Health Care,Biotechnology: Pharmaceutical Preparations
PCSA,Processa Pharmaceuticals Inc. Common Stock,$7.00,-0.44,-5.914%,109232235.00,United States,,83057,Health Care,Biotechnology: Pharmaceutical Preparations
PCSB,PCSB Financial Corporation Common Stock,$17.55,-0.20,-1.127%,276774820.00,United States,2017,21572,Finance,Banks
PCT,PureCycle Technologies Inc. Common stock,$12.90,0.38,3.035%,1513901753.00,United States,,1300996,Public Utilities,Environmental Services
PCTY,Paylocity Holding Corporation Common Stock,$257.20,-8.48,-3.192%,14043488825.00,United States,2014,319076,Technology,Computer Software: Prepackaged Software
PCVX,Vaxcyte Inc. Common Stock,$26.59,0.43,1.644%,1387713195.00,United States,2020,160731,Health Care,Biotechnology: Pharmaceutical Preparations
PCYG,Park City Group Inc. Common Stock,$5.38,0.07,1.318%,104692314.00,United States,,5834,Technology,EDP Services
PDCE,PDC Energy Inc. Common Stock (Delaware),$42.88,0.99,2.363%,4230523133.00,United States,,723064,Energy,Oil & Gas Production
PDFS,PDF Solutions Inc. Common Stock,$22.72,0.08,0.353%,845874529.00,United States,2001,70715,Technology,EDP Services
PDSB,PDS Biotechnology Corporation Common Stock,$14.99,-0.31,-2.026%,426073497.00,United States,2015,356300,Health Care,Biotechnology: Pharmaceutical Preparations
PECO,Phillips Edison & Company Inc. Common Stock,$29.27,0.38,1.315%,3316291000.00,United States,2021,196949,Consumer Services,Real Estate Investment Trusts
PEGA,Pegasystems Inc. Common Stock,$132.47,-0.84,-0.63%,10790432870.00,United States,1996,126499,Technology,EDP Services
PETQ,PetIQ Inc. Class A Common Stock,$28.28,0.44,1.58%,829615576.00,United States,2017,327748,Health Care,Biotechnology: Pharmaceutical Preparations
PFMT,Performant Financial Corporation Common Stock,$4.53,0.03,0.667%,303191333.00,United States,2012,219032,Miscellaneous,Business Services
PGC,Peapack-Gladstone Financial Corporation Common Stock,$33.05,0.73,2.259%,622327435.00,United States,,51878,Finance,Commercial Banks
PGEN,Precigen Inc. Common Stock,$5.89,-0.29,-4.693%,1217129791.00,United States,,1220364,Health Care,Biotechnology: Commercial Physical & Biological Resarch
PGNY,Progyny Inc. Common Stock,$57.76,-0.56,-0.96%,5163381729.00,United States,2019,629614,Health Care,Managed Health Care
PHAS,PhaseBio Pharmaceuticals Inc. Common Stock,$2.85,-0.13,-4.362%,136921077.00,United States,2018,275339,Health Care,Biotechnology: Pharmaceutical Preparations
PHAT,Phathom Pharmaceuticals Inc. Common Stock,$33.61,0.23,0.689%,1053890789.00,United States,2019,49622,Health Care,Biotechnology: Pharmaceutical Preparations
PHIO,Phio Pharmaceuticals Corp. Common Stock,$2.03,-0.02,-0.976%,27474810.00,United States,,36624,Health Care,Biotechnology: Pharmaceutical Preparations
PI,Impinj Inc. Common Stock,$52.87,-0.22,-0.414%,1284234347.00,United States,2016,191941,Public Utilities,Telecommunications Equipment
PLAB,Photronics Inc. Common Stock,$14.12,0.11,0.785%,875143480.00,United States,1987,478324,Technology,Semiconductors
PLBY,PLBY Group Inc. Common Stock,$23.96,-0.19,-0.787%,977532252.00,United States,2020,562734,Consumer Non-Durables,Recreational Products/Toys
PLCE,Children's Place Inc. (The) Common Stock,$77.87,-2.17,-2.711%,1146340467.00,United States,1997,499573,Consumer Services,Clothing/Shoe/Accessory Stores
PLL,Piedmont Lithium Inc. Common Stock,$56.20,1.05,1.904%,884923683.00,United States,,292345,Basic Industries,Precious Metals
PLMR,Palomar Holdings Inc. Common stock,$87.85,-1.54,-1.723%,2229220369.00,United States,2019,68417,Finance,Property-Casualty Insurers
PLRX,Pliant Therapeutics Inc. Common Stock,$18.86,0.31,1.671%,677789492.00,United States,2020,85356,Consumer Durables,Specialty Chemicals
PLSE,Pulse Biosciences Inc Common Stock (DE),$20.75,-0.01,-0.048%,614323048.00,United States,2016,65582,Health Care,Medical/Dental Instruments
PLUS,ePlus inc. Common Stock,$107.24,-0.32,-0.298%,1448314163.00,United States,1996,32907,Technology,Retail: Computer Software & Peripheral Equipment
PMVP,PMV Pharmaceuticals Inc. Common Stock,$28.48,-2.25,-7.322%,1289916587.00,United States,2020,391564,Consumer Durables,Specialty Chemicals
PNFP,Pinnacle Financial Partners Inc. Common Stock,$94.22,-0.77,-0.811%,7170891803.00,United States,,643074,Finance,Major Banks
PNT,POINT Biopharma Global Inc. Common Stock,$9.15,-2.11,-18.739%,824614415.00,United States,2020,326208,Consumer Durables,Specialty Chemicals
POAI,Predictive Oncology Inc. Common Stock,$1.04,0.02,1.961%,16037846.00,United States,,868901,Health Care,Medical/Dental Instruments
POOL,Pool Corporation Common Stock,$478.92,-14.51,-2.941%,43211228925.00,United States,1995,291232,Consumer Non-Durables,Recreational Products/Toys
POSH,Poshmark Inc. Class A Common Stock,$25.66,0.43,1.704%,1956549366.00,United States,2021,735133,Consumer Non-Durables,Department/Specialty Retail Stores
POWI,Power Integrations Inc. Common Stock,$109.30,1.79,1.665%,6589762908.00,United States,1997,251197,Technology,Semiconductors
POWW,AMMO Inc. Common Stock,$6.74,-0.15,-2.177%,762654320.00,United States,,2048226,Capital Goods,Military/Government/Technical
PPBI,Pacific Premier Bancorp Inc,$38.51,0.81,2.149%,3644952938.00,United States,,314272,Finance,Major Banks
PPC,Pilgrim's Pride Corporation Common Stock,$28.02,-0.03,-0.107%,6827788126.00,United States,,402576,Consumer Non-Durables,Meat/Poultry/Fish
PRAX,Praxis Precision Medicines Inc. Common Stock,$20.72,-0.25,-1.192%,926443787.00,United States,2020,211883,Health Care,Biotechnology: Pharmaceutical Preparations
PRCH,Porch Group Inc. Common Stock,$18.87,-3.35,-15.077%,1825374750.00,United States,2020,5884237,Technology,Computer Software: Prepackaged Software
PRDO,Perdoceo Education Corporation Common Stock,$10.81,0.24,2.271%,757587555.00,United States,,576054,Miscellaneous,Other Consumer Services
PRFT,Perficient Inc. Common Stock,$116.05,-2.46,-2.076%,3821676205.00,United States,1999,687542,Technology,EDP Services
PRGS,Progress Software Corporation Common Stock (DE),$45.52,0.16,0.353%,1991716083.00,United States,1991,184430,Technology,Computer Software: Prepackaged Software
PRIM,Primoris Services Corporation Common Stock,$26.17,0.24,0.926%,1406145661.00,United States,,222346,Basic Industries,Water Supply
PRLD,Prelude Therapeutics Incorporated Common Stock,$32.01,-0.82,-2.498%,1507463927.00,United States,2020,1137946,Consumer Durables,Specialty Chemicals
PRPH,ProPhase Labs Inc. Common Stock (DE),$5.07,-0.59,-10.424%,76832063.00,United States,,212198,Health Care,Biotechnology: Pharmaceutical Preparations
PRPL,Purple Innovation Inc. Common Stock,$23.86,0.58,2.491%,1594317803.00,United States,2015,656547,Consumer Durables,Home Furnishings
PRPO,Precipio Inc.  Common Stock,$3.16,0.04,1.282%,71757887.00,United States,,268437,Capital Goods,Biotechnology: Laboratory Analytical Instruments
PRTA,Prothena Corporation plc Ordinary Shares,$72.49,-3.89,-5.093%,3265489578.00,United States,,434905,Health Care,Biotechnology: Pharmaceutical Preparations
PRTH,Priority Technology Holdings Inc. Common Stock,$5.42,-0.05,-0.914%,374724041.00,United States,2016,11116,Technology,EDP Services
PRTK,Paratek Pharmaceuticals Inc. Common Stock,$4.70,-0.27,-5.433%,229334916.00,United States,,579706,Health Care,Biotechnology: Pharmaceutical Preparations
PRTS,CarParts.com Inc. Common Stock,$16.79,-0.49,-2.836%,876714565.00,United States,2007,681114,Consumer Services,Other Specialty Stores
PRVA,Privia Health Group Inc. Common Stock,$28.22,-1.25,-4.242%,2984066388.00,United States,2021,508796,Technology,Retail: Computer Software & Peripheral Equipment
PRVB,Provention Bio Inc. Common Stock,$6.73,0.26,4.019%,426511987.00,United States,2018,641481,Health Care,Biotechnology: Pharmaceutical Preparations
PSNL,Personalis Inc. Common Stock,$22.14,0.56,2.595%,983292374.00,United States,2019,529158,Health Care,Biotechnology: In Vitro & In Vivo Diagnostic Substances
PSTV,PLUS THERAPEUTICS Inc. Common Stock ,$1.83,-0.07,-3.684%,22120171.00,United States,,612901,Health Care,Medical/Dental Instruments
PSTX,Poseida Therapeutics Inc. Common Stock,$8.40,0.20,2.439%,523644215.00,United States,2020,121669,Consumer Durables,Specialty Chemicals
PTC,PTC Inc. Common Stock,$122.81,-2.81,-2.237%,14415656770.00,United States,,1728376,Technology,Computer Software: Prepackaged Software
PTE,PolarityTE Inc. Common Stock,$0.7187,0.0337,4.92%,58489511.00,United States,,1742019,Consumer Durables,Specialty Chemicals
PTGX,Protagonist Therapeutics Inc. Common Stock,$45.39,0.31,0.688%,2158320508.00,United States,2016,293274,Health Care,Biotechnology: Pharmaceutical Preparations
PTMN,Portman Ridge Finance Corporation Common Stock,$23.81,-0.24,-0.998%,217283012.00,United States,,36904,Finance,Finance/Investors Services
PTON,Peloton Interactive Inc. Class A Common Stock,$111.51,-2.88,-2.518%,33508458606.00,United States,2019,8510372,Consumer Services,Other Consumer Services
PTRA,Proterra Inc. Common Stock,$10.27,0.17,1.683%,2180323280.00,United States,2020,1615625,Capital Goods,Auto Manufacturing
PUBM,PubMatic Inc. Class A Common Stock,$28.62,0.20,0.704%,1368794544.00,United States,2020,842477,Technology,Computer Software: Prepackaged Software
PULM,Pulmatrix Inc. Common Stock,$0.8123,-0.0026,-0.319%,45691113.00,United States,2014,220062,Health Care,Biotechnology: Pharmaceutical Preparations
PVAC,Penn Virginia Corporation Common Stock,$20.79,0.57,2.819%,787066365.00,United States,,286415,Energy,Oil & Gas Production
PVBC,Provident Bancorp Inc. (MD) Common Stock,$15.72,-0.02,-0.127%,284469136.00,United States,2015,39089,Finance,Major Banks
PWFL,PowerFleet Inc. Common Stock,$6.86,-0.02,-0.291%,246743382.00,United States,,76204,Capital Goods,Telecommunications Equipment
PWP,Perella Weinberg Partners Class A Common Stock,$14.05,0.04,0.286%,1383933163.00,United States,2020,172292,Finance,Investment Bankers/Brokers/Service
PYCR,Paycor HCM Inc. Common Stock,$29.43,-2.34,-7.365%,5133472045.00,United States,2021,303547,Technology,Computer Software: Prepackaged Software
PYPL,PayPal Holdings Inc. Common Stock,$280.49,-3.83,-1.347%,329584767754.00,United States,,4834973,Miscellaneous,Business Services
PZZA,Papa John's International Inc. Common Stock,$128.66,-0.74,-0.572%,4704297607.00,United States,1993,187495,Consumer Services,Restaurants
QCOM,QUALCOMM Incorporated Common Stock,$143.41,0.73,0.512%,161766480000.00,United States,1991,4310846,Technology,Computer peripheral equipment
QCRH,QCR Holdings Inc. Common Stock,$50.50,0.36,0.718%,796342631.00,United States,,25841,Finance,Major Banks
QIPT,Quipt Home Medical Corp. Common Shares,$6.17,-0.04,-0.644%,204242604.00,United States,,98583,Capital Goods,Office Equipment/Supplies/Services
QMCO,Quantum Corporation Common Stock,$5.32,0.06,1.141%,309691654.00,United States,,193726,Technology,Electronic Components
QNST,QuinStreet Inc. Common Stock,$18.81,0.21,1.129%,1018047366.00,United States,2010,272482,Technology,Advertising
QRHC,Quest Resource Holding Corporation Common Stock,$5.98,-0.16,-2.606%,112430135.00,United States,,32640,Capital Goods,Building Products
QRVO,Qorvo Inc. Common Stock,$182.37,3.07,1.712%,20268880097.00,United States,,950194,Capital Goods,Industrial Machinery/Components
QTRX,Quanterix Corporation Common Stock,$46.21,-1.73,-3.609%,1687720436.00,United States,2017,175279,Health Care,Industrial Specialties
QUIK,QuickLogic Corporation Common Stock,$5.91,0.19,3.322%,68213090.00,United States,1999,54388,Technology,Semiconductors
RADI,Radius Global Infrastructure Inc. Class A Common Stock,$17.18,-0.21,-1.208%,1300329134.00,United States,,1398185,Consumer Services,Telecommunications Equipment
RAIN,Rain Therapeutics Inc. Common Stock,$17.00,0.31,1.857%,449934682.00,United States,2021,441910,Health Care,Biotechnology: Pharmaceutical Preparations
RANI,Rani Therapeutics Holdings Inc. Class A Common Stock,$21.43,1.25,6.194%,1083328160.00,United States,2021,141765,Consumer Durables,Specialty Chemicals
RAPT,RAPT Therapeutics Inc. Common Stock,$34.79,-0.35,-0.996%,1025900288.00,United States,2019,216547,Health Care,Biotechnology: Pharmaceutical Preparations
RARE,Ultragenyx Pharmaceutical Inc. Common Stock,$100.47,-1.22,-1.20%,6815488948.00,United States,2014,516867,Health Care,Biotechnology: Pharmaceutical Preparations
RBBN,Ribbon Communications Inc. Common Stock,$6.32,0.29,4.809%,936083236.00,United States,,446879,Technology,EDP Services
RBCAA,Republic Bancorp Inc. Class A Common Stock,$49.84,0.50,1.013%,1016679182.00,United States,1998,27162,Finance,Major Banks
RBNC,Reliant Bancorp Inc. Common Stock,$27.84,0.36,1.31%,464350793.00,United States,,44653,Finance,Major Banks
RCEL,Avita Therapeutics Inc. Common Stock,$18.85,-0.26,-1.361%,469287036.00,United States,,91461,Health Care,Medical Specialities
RCII,Rent-A-Center Inc. Common Stock,$60.57,0.64,1.068%,4025583776.00,United States,1995,417259,Technology,Diversified Commercial Services
RCKT,Rocket Pharmaceuticals Inc. Common Stock,$35.60,0.27,0.764%,2293699420.00,United States,2015,360947,Health Care,Biotechnology: Pharmaceutical Preparations
RCKY,Rocky Brands Inc. Common Stock,$48.00,-0.96,-1.961%,349868880.00,United States,1993,37997,Consumer Non-Durables,Shoe Manufacturing
RCM,R1 RCM Inc. Common Stock,$20.39,0.24,1.191%,5686168027.00,United States,,1130775,Consumer Services,Other Consumer Services
RDNT,RadNet Inc. Common Stock,$28.32,-1.08,-3.673%,1504885945.00,United States,,298011,Health Care,Medical Specialities
REED,Reeds Inc. Common Stock,$0.60,0.0002,0.033%,56200713.00,United States,,4451386,Consumer Non-Durables,Beverages (Production/Distribution)
REGI,Renewable Energy Group Inc. Common Stock,$48.89,3.72,8.236%,2455992475.00,United States,2012,1174492,Basic Industries,Major Chemicals
REGN,Regeneron Pharmaceuticals Inc. Common Stock,$639.52,-10.97,-1.686%,68400103978.00,United States,1991,797977,Health Care,Biotechnology: Pharmaceutical Preparations
REKR,Rekor Systems Inc. Common Stock,$11.15,-0.64,-5.428%,488874995.00,United States,,2013477,Technology,EDP Services
REPH,Recro Pharma Inc. Common Stock,$2.17,-0.02,-0.913%,100939538.00,United States,2014,163566,Health Care,Biotechnology: Pharmaceutical Preparations
REPL,Replimune Group Inc. Common Stock,$32.66,0.64,1.999%,1527582110.00,United States,2018,193485,Health Care,Biotechnology: Pharmaceutical Preparations
RESN,Resonant Inc. Common Stock,$2.60,-0.05,-1.887%,163862998.00,United States,2014,483106,Technology,Semiconductors
RETA,Reata Pharmaceuticals Inc. Class A Common Stock,$109.14,0.71,0.655%,3971321054.00,United States,2016,135867,Health Care,Biotechnology: Pharmaceutical Preparations
REYN,Reynolds Consumer Products Inc. Common Stock,$28.09,0.22,0.789%,5892124383.00,United States,2020,372096,Capital Goods,Office Equipment/Supplies/Services
RFIL,RF Industries Ltd. Common Stock,$8.88,0.38,4.471%,88939034.00,United States,,179669,Capital Goods,Electrical Products
RGCO,RGC Resources Inc. Common Stock,$23.44,-0.16,-0.678%,195849545.00,United States,,8217,Public Utilities,Oil & Gas Production
RGEN,Repligen Corporation Common Stock,$289.57,-5.46,-1.851%,15919741723.00,United States,1986,477460,Health Care,Medical/Dental Instruments
RGLS,Regulus Therapeutics Inc. Common Stock,$0.7511,-0.0865,-10.327%,65375996.00,United States,2012,1485830,Health Care,Biotechnology: Pharmaceutical Preparations
RGNX,REGENXBIO Inc. Common Stock,$43.40,10.32,31.197%,1848862915.00,United States,2015,3050721,Health Care,Biotechnology: Biological Products (No Diagnostic Substances)
RIGL,Rigel Pharmaceuticals Inc. Common Stock,$3.84,-0.03,-0.775%,656065175.00,United States,2000,1417293,Health Care,Biotechnology: Pharmaceutical Preparations
RIOT,Riot Blockchain Inc.  Common Stock ,$29.30,-0.32,-1.08%,2811283198.00,United States,,10610722,Technology,Retail: Computer Software & Peripheral Equipment
RKDA,Arcadia Biosciences Inc. Common Stock,$2.27,-0.02,-0.873%,50334186.00,United States,2015,145273,Basic Industries,Agricultural Chemicals
RKLB,Rocket Lab USA Inc. Common Stock,$15.40,-3.29,-17.603%,0.00,United States,2020,8753615,,
RLAY,Relay Therapeutics Inc. Common Stock,$35.70,3.55,11.042%,3309214963.00,United States,2020,1515393,Health Care,Biotechnology: Pharmaceutical Preparations
RLMD,Relmada Therapeutics Inc. Common Stock,$26.56,0.54,2.075%,464082508.00,United States,,172449,Health Care,Biotechnology: Pharmaceutical Preparations
RLYB,Rallybio Corporation Common Stock,$11.32,-0.08,-0.702%,363711260.00,United States,2021,87355,Health Care,Biotechnology: Pharmaceutical Preparations
RMBL,RumbleOn Inc. Class B Common Stock,$35.09,-0.79,-2.202%,526350000.00,United States,,25044,Capital Goods,Automotive Aftermarket
RMBS,Rambus Inc. Common Stock,$23.71,0.11,0.466%,2581954864.00,United States,1997,606306,Technology,Semiconductors
RMNI,Rimini Street Inc. (DE) Common Stock,$9.69,0.00,0.00%,831053160.00,United States,2015,383429,Technology,EDP Services
RMTI,Rockwell Medical Inc. (DE) Common Stock,$0.624,-0.022,-3.406%,58586662.00,United States,1998,409013,Health Care,Biotechnology: Pharmaceutical Preparations
RNA,Avidity Biosciences Inc. Common Stock,$23.92,1.36,6.028%,1121130328.00,United States,2020,336924,Health Care,Biotechnology: Pharmaceutical Preparations
RNWK,RealNetworks Inc. Common Stock,$1.77,0.02,1.143%,83201953.00,United States,1997,176607,Technology,EDP Services
ROAD,Construction Partners Inc. Class A Common Stock,$33.95,0.35,1.042%,1775329628.00,United States,2018,85213,Capital Goods,Engineering & Construction
ROCK,Gibraltar Industries Inc. Common Stock,$69.84,1.01,1.467%,2279321986.00,United States,1993,104394,,
ROKU,Roku Inc. Class A Common Stock,$322.82,-5.48,-1.669%,43080783208.00,United States,2017,4013781,Consumer Services,Television Services
ROST,Ross Stores Inc. Common Stock,$113.55,0.74,0.656%,40351804872.00,United States,1985,1330081,Consumer Services,Clothing/Shoe/Accessory Stores
ROVR,Rover Group Inc. Class A Common Stock,$13.70,0.05,0.366%,2153628191.00,United States,2021,422776,Miscellaneous,Other Consumer Services
RPAY,Repay Holdings Corporation Class A Common Stock,$22.73,0.20,0.888%,2059027736.00,United States,2018,538770,Technology,EDP Services
RPD,Rapid7 Inc. Common Stock,$120.97,2.57,2.171%,6748126003.00,United States,2015,352786,Technology,Computer Software: Prepackaged Software
RPHM,Reneo Pharmaceuticals Inc. Common Stock,$9.22,0.56,6.467%,225017115.00,United States,2021,54261,Health Care,Biotechnology: Pharmaceutical Preparations
RPID,Rapid Micro Biosystems Inc. Class A Common Stock,$20.02,-0.90,-4.302%,822461940.00,United States,2021,88266,Health Care,Medical Specialities
RPRX,Royalty Pharma plc Class A Ordinary Shares ,$38.51,0.03,0.078%,16443996747.00,United States,2020,2471081,Health Care,Biotechnology: Pharmaceutical Preparations
RRBI,Red River Bancshares Inc. Common Stock,$49.15,-0.21,-0.425%,357639139.00,United States,2019,2553,Finance,Commercial Banks
RRR,Red Rock Resorts Inc. Class A Common Stock,$43.23,0.48,1.123%,5030216516.00,United States,2016,566738,Consumer Services,Recreational Products/Toys
RSSS,Research Solutions Inc Common Stock,$2.62,0.07,2.745%,69732568.00,United States,,14050,Technology,Retail: Computer Software & Peripheral Equipment
RSVR,Reservoir Media Inc. Common Stock,$8.36,-1.19,-12.461%,535618955.00,United States,2021,350126,Consumer Services,Movies/Entertainment
